authors,Year,title,venue,pages,article,publisher_location,doi,doi_url,category,raw_entry
"Yijing Lin, Zhipeng Gao, Hongyang Du, Dusit Niyato, Jiawen Kang, and Xiaoyuan Liu",2024,Incentive and Dynamic Client Selection for Federated Unlearning,the ACM Web Conference 2024 (WWW '24),2936–2944,,"New York, NY, USA, 2936–2944",10.1145/3589334.3645462,https://doi.org/10.1145/3589334.3645462,unlearning,"Yijing Lin, Zhipeng Gao, Hongyang Du, Dusit Niyato, Jiawen Kang, and Xiaoyuan Liu. 2024. Incentive and Dynamic Client Selection for Federated Unlearning. In Proceedings of the ACM Web Conference 2024 (WWW '24). Association for Computing Machinery, New York, NY, USA, 2936–2944. https://doi.org/10.1145/3589334.3645462"
"Shannon K. Gallagher, Jasmine Ratchford, Tyler Brooks, Bryan P. Brown, Eric Heim, William R. Nichols, Scott Mcmillan, Swati Rallapalli, Carol J. Smith, Nathan Vanhoudnos, Nick Winski, and Andrew O. Mellinger",2024,Assessing LLMs for High Stakes Applications,the 46th International Conference on Software Engineering: Software Engineering in Practice (ICSE-SEIP '24),103–105,,"New York, NY, USA, 103–105",10.1145/3639477.3639720,https://doi.org/10.1145/3639477.3639720,,"Shannon K. Gallagher, Jasmine Ratchford, Tyler Brooks, Bryan P. Brown, Eric Heim, William R. Nichols, Scott Mcmillan, Swati Rallapalli, Carol J. Smith, Nathan Vanhoudnos, Nick Winski, and Andrew O. Mellinger. 2024. Assessing LLMs for High Stakes Applications. In Proceedings of the 46th International Conference on Software Engineering: Software Engineering in Practice (ICSE-SEIP '24). Association for Computing Machinery, New York, NY, USA, 103–105. https://doi.org/10.1145/3639477.3639720"
"Zhao Ren, Kun Qian, Tanja Schultz, and Bj\""{o}rn W. Schuller",2023,An Overview of the ICASSP Special Session on AI Security and Privacy in Speech and Audio Processing,the 5th ACM International Conference on Multimedia in Asia Workshops (MMAsia '23 Workshops),1–6,8,"New York, NY, USA, Article 8, 1–6",10.1145/3611380.3628563,https://doi.org/10.1145/3611380.3628563,,"Zhao Ren, Kun Qian, Tanja Schultz, and Bj\""{o}rn W. Schuller. 2023. An Overview of the ICASSP Special Session on AI Security and Privacy in Speech and Audio Processing. In Proceedings of the 5th ACM International Conference on Multimedia in Asia Workshops (MMAsia '23 Workshops). Association for Computing Machinery, New York, NY, USA, Article 8, 1–6. https://doi.org/10.1145/3611380.3628563"
"Yaron Kanza, Balachander Krishnamurthy, and Divesh Srivastava",2024,"A Geospatial Perspective on Data Ownership, the Right to be Forgotten, Copyrights, and Plagiarism in Generative AI",the 32nd ACM International Conference on Advances in Geographic Information Systems (SIGSPATIAL '24),477–480,,"New York, NY, USA, 477–480",10.1145/3678717.3691269,https://doi.org/10.1145/3678717.3691269,,"Yaron Kanza, Balachander Krishnamurthy, and Divesh Srivastava. 2024. A Geospatial Perspective on Data Ownership, the Right to be Forgotten, Copyrights, and Plagiarism in Generative AI. In Proceedings of the 32nd ACM International Conference on Advances in Geographic Information Systems (SIGSPATIAL '24). Association for Computing Machinery, New York, NY, USA, 477–480. https://doi.org/10.1145/3678717.3691269"
"Wenhan Wu, Jiawei Jiang, and Chuang Hu",2025,Aegis: Post-Training Attribute Unlearning in Federated Recommender Systems against Attribute Inference Attacks,the ACM on Web Conference 2025 (WWW '25),3783–3793,,"New York, NY, USA, 3783–3793",10.1145/3696410.3714823,https://doi.org/10.1145/3696410.3714823,unlearning,"Wenhan Wu, Jiawei Jiang, and Chuang Hu. 2025. Aegis: Post-Training Attribute Unlearning in Federated Recommender Systems against Attribute Inference Attacks. In Proceedings of the ACM on Web Conference 2025 (WWW '25). Association for Computing Machinery, New York, NY, USA, 3783–3793. https://doi.org/10.1145/3696410.3714823"
"Fengyuan Yu, Yuyuan Li, Xiaohua Feng, Junjie Fang, Tao Wang, and Chaochao Chen",2025,LEGO: A Lightweight and Efficient Multiple-Attribute Unlearning Framework for Recommender Systems,the 33rd ACM International Conference on Multimedia (MM '25),6242–6251,,"New York, NY, USA, 6242–6251",10.1145/3746027.3755604,https://doi.org/10.1145/3746027.3755604,framework,"Fengyuan Yu, Yuyuan Li, Xiaohua Feng, Junjie Fang, Tao Wang, and Chaochao Chen. 2025. LEGO: A Lightweight and Efficient Multiple-Attribute Unlearning Framework for Recommender Systems. In Proceedings of the 33rd ACM International Conference on Multimedia (MM '25). Association for Computing Machinery, New York, NY, USA, 6242–6251. https://doi.org/10.1145/3746027.3755604"
"Yiling Tao, Shuyi Wang, Jiaxi Yang, and Guido Zuccon",2025,Unlearning for Federated Online Learning to Rank: A Reproducibility Study,the 48th International ACM SIGIR Conference on Research and Development in Information Retrieval (SIGIR '25),3377–3386,,"New York, NY, USA, 3377–3386",10.1145/3726302.3730336,https://doi.org/10.1145/3726302.3730336,unlearning,"Yiling Tao, Shuyi Wang, Jiaxi Yang, and Guido Zuccon. 2025. Unlearning for Federated Online Learning to Rank: A Reproducibility Study. In Proceedings of the 48th International ACM SIGIR Conference on Research and Development in Information Retrieval (SIGIR '25). Association for Computing Machinery, New York, NY, USA, 3377–3386. https://doi.org/10.1145/3726302.3730336"
"Tao Wang, Yushu Zhang, Shuren Qi, Ruoyu Zhao, Zhihua Xia, and Jian Weng",2024,Security and Privacy on Generative Data in AIGC: A Survey,ACM Comput,,82,,10.1145/3703626,https://doi.org/10.1145/3703626,survey,"Tao Wang, Yushu Zhang, Shuren Qi, Ruoyu Zhao, Zhihua Xia, and Jian Weng. 2024. Security and Privacy on Generative Data in AIGC: A Survey. ACM Comput. Surv. 57, 4, Article 82 (April 2025), 34 pages. https://doi.org/10.1145/3703626"
"He Zhang, Bang Wu, Xiangwen Yang, Xingliang Yuan, Xiaoning Liu, and Xun Yi",2025,Dynamic Graph Unlearning: A General and Efficient Post-Processing Method via Gradient Transformation,the ACM on Web Conference 2025 (WWW '25),931–944,,"New York, NY, USA, 931–944",10.1145/3696410.3714911,https://doi.org/10.1145/3696410.3714911,unlearning,"He Zhang, Bang Wu, Xiangwen Yang, Xingliang Yuan, Xiaoning Liu, and Xun Yi. 2025. Dynamic Graph Unlearning: A General and Efficient Post-Processing Method via Gradient Transformation. In Proceedings of the ACM on Web Conference 2025 (WWW '25). Association for Computing Machinery, New York, NY, USA, 931–944. https://doi.org/10.1145/3696410.3714911"
"Xuebin Ren, Shusen Yang, Cong Zhao, Julie McCann, and Zongben Xu",2024,Belt and Braces: When Federated Learning Meets Differential Privacy,"ACM 67, 12 (December 2024), 66–77",66–77,,,10.1145/3650028,https://doi.org/10.1145/3650028,,"Xuebin Ren, Shusen Yang, Cong Zhao, Julie McCann, and Zongben Xu. 2024. Belt and Braces: When Federated Learning Meets Differential Privacy. Commun. ACM 67, 12 (December 2024), 66–77. https://doi.org/10.1145/3650028"
"Kajal Kansal, Yongkang Wong, and Mohan Kankanhalli",2025,Implications of Privacy Regulations on Video Surveillance Systems,ACM Trans,,184,,10.1145/3706108,https://doi.org/10.1145/3706108,,"Kajal Kansal, Yongkang Wong, and Mohan Kankanhalli. 2025. Implications of Privacy Regulations on Video Surveillance Systems. ACM Trans. Multimedia Comput. Commun. Appl. 21, 7, Article 184 (July 2025), 27 pages. https://doi.org/10.1145/3706108"
"Joseph Renzullo, Pemma Reiter, Westley Weimer, and Stephanie Forrest",2025,Automated Program Repair: Emerging Trends Pose and Expose Problems for Benchmarks,ACM Comput,,208,,10.1145/3704997,https://doi.org/10.1145/3704997,,"Joseph Renzullo, Pemma Reiter, Westley Weimer, and Stephanie Forrest. 2025. Automated Program Repair: Emerging Trends Pose and Expose Problems for Benchmarks. ACM Comput. Surv. 57, 8, Article 208 (August 2025), 18 pages. https://doi.org/10.1145/3704997"
"Xinyi Sheng, Wei Bao, and Liming Ge",2024,Robust Federated Unlearning,the 33rd ACM International Conference on Information and Knowledge Management (CIKM '24),2034–2044,,"New York, NY, USA, 2034–2044",10.1145/3627673.3679817,https://doi.org/10.1145/3627673.3679817,unlearning,"Xinyi Sheng, Wei Bao, and Liming Ge. 2024. Robust Federated Unlearning. In Proceedings of the 33rd ACM International Conference on Information and Knowledge Management (CIKM '24). Association for Computing Machinery, New York, NY, USA, 2034–2044. https://doi.org/10.1145/3627673.3679817"
Anasua Banerjee and Debajyoty Banik,2025,A Comprehensive Survey on Transformer-Based Machine Translation: Identifying Research Gaps and Solutions for Large Language Models,ACM Comput,,124,,10.1145/3773076,https://doi.org/10.1145/3773076,survey,"Anasua Banerjee and Debajyoty Banik. 2025. A Comprehensive Survey on Transformer-Based Machine Translation: Identifying Research Gaps and Solutions for Large Language Models. ACM Comput. Surv. 58, 5, Article 124 (April 2026), 33 pages. https://doi.org/10.1145/3773076"
"Tian Hui, Farhad Farokhi, and Olga Ohrimenko",2023,Information Leakage from Data Updates in Machine Learning Models,the 16th ACM Workshop on Artificial Intelligence and Security (AISec '23),35–41,,"New York, NY, USA, 35–41",10.1145/3605764.3623905,https://doi.org/10.1145/3605764.3623905,,"Tian Hui, Farhad Farokhi, and Olga Ohrimenko. 2023. Information Leakage from Data Updates in Machine Learning Models. In Proceedings of the 16th ACM Workshop on Artificial Intelligence and Security (AISec '23). Association for Computing Machinery, New York, NY, USA, 35–41. https://doi.org/10.1145/3605764.3623905"
Samuel Greengard,2022,Can AI learn to forget? Commun,"ACM 65, 4 (April 2022), 9–11",9–11,,,10.1145/3516514,https://doi.org/10.1145/3516514,,"Samuel Greengard. 2022. Can AI learn to forget? Commun. ACM 65, 4 (April 2022), 9–11. https://doi.org/10.1145/3516514"
"Zichen Wang, Xiangshan Gao, Cong Wang, Peng Cheng, and Jiming Chen",2024,Efficient Vertical Federated Unlearning via Fast Retraining,ACM Trans,,11,,10.1145/3657290,https://doi.org/10.1145/3657290,unlearning,"Zichen Wang, Xiangshan Gao, Cong Wang, Peng Cheng, and Jiming Chen. 2024. Efficient Vertical Federated Unlearning via Fast Retraining. ACM Trans. Internet Technol. 24, 2, Article 11 (May 2024), 22 pages. https://doi.org/10.1145/3657290"
"Yuyuan Li, Chaochao Chen, Xiaolin Zheng, Yizhao Zhang, Zhongxuan Han, Dan Meng, and Jun Wang",2023,Making Users Indistinguishable: Attribute-wise Unlearning in Recommender Systems,the 31st ACM International Conference on Multimedia (MM '23),984–994,,"New York, NY, USA, 984–994",10.1145/3581783.3612418,https://doi.org/10.1145/3581783.3612418,unlearning,"Yuyuan Li, Chaochao Chen, Xiaolin Zheng, Yizhao Zhang, Zhongxuan Han, Dan Meng, and Jun Wang. 2023. Making Users Indistinguishable: Attribute-wise Unlearning in Recommender Systems. In Proceedings of the 31st ACM International Conference on Multimedia (MM '23). Association for Computing Machinery, New York, NY, USA, 984–994. https://doi.org/10.1145/3581783.3612418"
"Mohammad Nur Nobi, Maanak Gupta, Ram Krishnan, Md Shohel Rana, Lopamudra Praharaj, and Mahmoud Abdelsalam",2025,Machine Learning in Access Control: A Taxonomy [Systematization of Knowledge Paper],the 30th ACM Symposium on Access Control Models and Technologies (SACMAT '25),145–156,,"New York, NY, USA, 145–156",10.1145/3734436.3734453,https://doi.org/10.1145/3734436.3734453,,"Mohammad Nur Nobi, Maanak Gupta, Ram Krishnan, Md Shohel Rana, Lopamudra Praharaj, and Mahmoud Abdelsalam. 2025. Machine Learning in Access Control: A Taxonomy [Systematization of Knowledge Paper]. In Proceedings of the 30th ACM Symposium on Access Control Models and Technologies (SACMAT '25). Association for Computing Machinery, New York, NY, USA, 145–156. https://doi.org/10.1145/3734436.3734453"
"Hongyu Lin, Linhan Fang, Guanchen Du, and Yuxuan Guo",2026,CEFU-QoS: A Cloud-Edge Federated Unlearning Framework for Rapid QoS Prediction via Collaborative Mechanisms,the 13th International Conference on Information Technology: IoT and Smart City (ICIT '25),159–165,,"New York, NY, USA, 159–165",10.1145/3787330.3787356,https://doi.org/10.1145/3787330.3787356,framework,"Hongyu Lin, Linhan Fang, Guanchen Du, and Yuxuan Guo. 2026. CEFU-QoS: A Cloud-Edge Federated Unlearning Framework for Rapid QoS Prediction via Collaborative Mechanisms. In Proceedings of the 13th International Conference on Information Technology: IoT and Smart City (ICIT '25). Association for Computing Machinery, New York, NY, USA, 159–165. https://doi.org/10.1145/3787330.3787356"
"Baochen Yan, Jiahe Lan, and Zheng Yan",2024,Backdoor Attacks against Voice Recognition Systems: A Survey,ACM Comput,,78,,10.1145/3701985,https://doi.org/10.1145/3701985,survey,"Baochen Yan, Jiahe Lan, and Zheng Yan. 2024. Backdoor Attacks against Voice Recognition Systems: A Survey. ACM Comput. Surv. 57, 3, Article 78 (March 2025), 35 pages. https://doi.org/10.1145/3701985"
"Xiaohua Feng, Yuyuan Li, Fengyuan Yu, Li Zhang, Chaochao Chen, and Xiaolin Zheng",2025,Plug and Play: Enabling Pluggable Attribute Unlearning in Recommender Systems,the ACM on Web Conference 2025 (WWW '25),2689–2699,,"New York, NY, USA, 2689–2699",10.1145/3696410.3714671,https://doi.org/10.1145/3696410.3714671,unlearning,"Xiaohua Feng, Yuyuan Li, Fengyuan Yu, Li Zhang, Chaochao Chen, and Xiaolin Zheng. 2025. Plug and Play: Enabling Pluggable Attribute Unlearning in Recommender Systems. In Proceedings of the ACM on Web Conference 2025 (WWW '25). Association for Computing Machinery, New York, NY, USA, 2689–2699. https://doi.org/10.1145/3696410.3714671"
"Qiyuan Wang, Ruiling Xu, Shibo He, Randall Berry, and Meng Zhang",2025,Unlearning Incentivizes Learning under Privacy Risk,the ACM on Web Conference 2025 (WWW '25),1456–1467,,"New York, NY, USA, 1456–1467",10.1145/3696410.3714740,https://doi.org/10.1145/3696410.3714740,unlearning,"Qiyuan Wang, Ruiling Xu, Shibo He, Randall Berry, and Meng Zhang. 2025. Unlearning Incentivizes Learning under Privacy Risk. In Proceedings of the ACM on Web Conference 2025 (WWW '25). Association for Computing Machinery, New York, NY, USA, 1456–1467. https://doi.org/10.1145/3696410.3714740"
Ge Wang and Roy Pea,2026,Algorithmic Autonomy in Data-Driven AI,"ACM 69, 3 (March 2026), 74–81",74–81,,,10.1145/3765704,https://doi.org/10.1145/3765704,,"Ge Wang and Roy Pea. 2026. Algorithmic Autonomy in Data-Driven AI. Commun. ACM 69, 3 (March 2026), 74–81. https://doi.org/10.1145/3765704"
Naiyu Liu,2025,GDPR Constraints on AI-Generated Music: Privacy Protection Challenges in Training Data,the 2025 International Conference on AI-enabled Education (AIEE '25),368–372,,"New York, NY, USA, 368–372",10.1145/3768421.3768484,https://doi.org/10.1145/3768421.3768484,,"Naiyu Liu. 2025. GDPR Constraints on AI-Generated Music: Privacy Protection Challenges in Training Data. In Proceedings of the 2025 International Conference on AI-enabled Education (AIEE '25). Association for Computing Machinery, New York, NY, USA, 368–372. https://doi.org/10.1145/3768421.3768484"
Zitao Chen,2024,Catch Me if You Can: Detecting Unauthorized Data Use in Training Deep Learning Models,the 2024 on ACM SIGSAC Conference on Computer and Communications Security (CCS '24),5098–5100,,"New York, NY, USA, 5098–5100",10.1145/3658644.3690858,https://doi.org/10.1145/3658644.3690858,,"Zitao Chen. 2024. Catch Me if You Can: Detecting Unauthorized Data Use in Training Deep Learning Models. In Proceedings of the 2024 on ACM SIGSAC Conference on Computer and Communications Security (CCS '24). Association for Computing Machinery, New York, NY, USA, 5098–5100. https://doi.org/10.1145/3658644.3690858"
"Mary Hall, Ganesh Gopalakrishnan, Eric Eide, Johanna Cohoon, Jeff Phillips, Mu Zhang, Shireen Elhabian, Aditya Bhaskara, Harvey Dam, Artem Yadrov, Tushar Kataria, Amir Mohammad Tavakkoli, Sameeran Joshi, and Mokshagna Sai Teja Karanam",2023,An NSF REU Site Based on Trust and Reproducibility of Intelligent Computation: Experience Report,"the SC '23 Workshops of the International Conference on High Performance Computing, Network, Storage, and Analysis (SC-W '23)",343–349,,"New York, NY, USA, 343–349",10.1145/3624062.3624100,https://doi.org/10.1145/3624062.3624100,,"Mary Hall, Ganesh Gopalakrishnan, Eric Eide, Johanna Cohoon, Jeff Phillips, Mu Zhang, Shireen Elhabian, Aditya Bhaskara, Harvey Dam, Artem Yadrov, Tushar Kataria, Amir Mohammad Tavakkoli, Sameeran Joshi, and Mokshagna Sai Teja Karanam. 2023. An NSF REU Site Based on Trust and Reproducibility of Intelligent Computation: Experience Report. In Proceedings of the SC '23 Workshops of the International Conference on High Performance Computing, Network, Storage, and Analysis (SC-W '23). Association for Computing Machinery, New York, NY, USA, 343–349. https://doi.org/10.1145/3624062.3624100"
"Seung-Yeon Back, Geonho Son, Dahye Jeong, Eunil Park, and Simon S. Woo",2024,Preserving Old Memories in Vivid Detail: Human-Interactive Photo Restoration Framework,the 33rd ACM International Conference on Information and Knowledge Management (CIKM '24),5180–5184,,"New York, NY, USA, 5180–5184",10.1145/3627673.3679215,https://doi.org/10.1145/3627673.3679215,framework,"Seung-Yeon Back, Geonho Son, Dahye Jeong, Eunil Park, and Simon S. Woo. 2024. Preserving Old Memories in Vivid Detail: Human-Interactive Photo Restoration Framework. In Proceedings of the 33rd ACM International Conference on Information and Knowledge Management (CIKM '24). Association for Computing Machinery, New York, NY, USA, 5180–5184. https://doi.org/10.1145/3627673.3679215"
"Renqiang Luo, Yongshuai Yang, Huafei Huang, Qing Qing, Mingliang Hou, Ziqi Xu, Yi Yu, Jingjing Zhou, and Feng Xia",2026,FairGU: Fairness-aware Graph Unlearning in Social Networks,the ACM Web Conference 2026 (WWW '26),9442–9451,,"New York, NY, USA, 9442–9451",10.1145/3774904.3793004,https://doi.org/10.1145/3774904.3793004,unlearning,"Renqiang Luo, Yongshuai Yang, Huafei Huang, Qing Qing, Mingliang Hou, Ziqi Xu, Yi Yu, Jingjing Zhou, and Feng Xia. 2026. FairGU: Fairness-aware Graph Unlearning in Social Networks. In Proceedings of the ACM Web Conference 2026 (WWW '26). Association for Computing Machinery, New York, NY, USA, 9442–9451. https://doi.org/10.1145/3774904.3793004"
Jingyan Zhang and Irina Tal,2024,A Systematic Review of Contemporary Applications of Privacy-Aware Graph Neural Networks in Smart Cities,"the 19th International Conference on Availability, Reliability and Security (ARES '24)",1–10,109,"New York, NY, USA, Article 109, 1–10",10.1145/3664476.3669980,https://doi.org/10.1145/3664476.3669980,,"Jingyan Zhang and Irina Tal. 2024. A Systematic Review of Contemporary Applications of Privacy-Aware Graph Neural Networks in Smart Cities. In Proceedings of the 19th International Conference on Availability, Reliability and Security (ARES '24). Association for Computing Machinery, New York, NY, USA, Article 109, 1–10. https://doi.org/10.1145/3664476.3669980"
Ramya Srinivasan,2024,To See or Not to See: Understanding the Tensions of Algorithmic Curation for Visual Arts,"the 2024 ACM Conference on Fairness, Accountability, and Transparency (FAccT '24)",444–455,,"New York, NY, USA, 444–455",10.1145/3630106.3658917,https://doi.org/10.1145/3630106.3658917,,"Ramya Srinivasan. 2024. To See or Not to See: Understanding the Tensions of Algorithmic Curation for Visual Arts. In Proceedings of the 2024 ACM Conference on Fairness, Accountability, and Transparency (FAccT '24). Association for Computing Machinery, New York, NY, USA, 444–455. https://doi.org/10.1145/3630106.3658917"
"Xinyu Li, Sishuo Chen, Guipeng Xv, Li Zhang, Mingxuan Luo, Zhangming Chan, Xiang-Rong Sheng, Han Zhu, Jian Xu, and Chen Lin",2026,"Delayed Feedback Modeling for Post-Click Gross Merchandise Volume Prediction: Benchmark, Insights and Approaches",the ACM Web Conference 2026 (WWW '26),6299–6308,,"New York, NY, USA, 6299–6308",10.1145/3774904.3792348,https://doi.org/10.1145/3774904.3792348,,"Xinyu Li, Sishuo Chen, Guipeng Xv, Li Zhang, Mingxuan Luo, Zhangming Chan, Xiang-Rong Sheng, Han Zhu, Jian Xu, and Chen Lin. 2026. Delayed Feedback Modeling for Post-Click Gross Merchandise Volume Prediction: Benchmark, Insights and Approaches. In Proceedings of the ACM Web Conference 2026 (WWW '26). Association for Computing Machinery, New York, NY, USA, 6299–6308. https://doi.org/10.1145/3774904.3792348"
"Ina Kaleva, Xiao Zhan, Ruba Abu-Salma, and Jose Such",2026,Privacy and Safety Experiences and Concerns of US Women Using Generative AI for Seeking Sexual and Reproductive Health Information,the 2026 CHI Conference on Human Factors in Computing Systems (CHI '26),1–21,1224,"New York, NY, USA, Article 1224, 1–21",10.1145/3772318.3791531,https://doi.org/10.1145/3772318.3791531,,"Ina Kaleva, Xiao Zhan, Ruba Abu-Salma, and Jose Such. 2026. Privacy and Safety Experiences and Concerns of US Women Using Generative AI for Seeking Sexual and Reproductive Health Information. In Proceedings of the 2026 CHI Conference on Human Factors in Computing Systems (CHI '26). Association for Computing Machinery, New York, NY, USA, Article 1224, 1–21. https://doi.org/10.1145/3772318.3791531"
"Abdullah Al-Mamun, Jianguo Wang, and Walid G. Aref",2025,"Learned Indexes From the One-dimensional to the Multi-dimensional Spaces: Challenges, Techniques, and Opportunities",,788–796,,"New York, NY, USA, 788–796",10.1145/3722212.3725639,https://doi.org/10.1145/3722212.3725639,,"Abdullah Al-Mamun, Jianguo Wang, and Walid G. Aref. 2025. Learned Indexes From the One-dimensional to the Multi-dimensional Spaces: Challenges, Techniques, and Opportunities. In Companion of the 2025 International Conference on Management of Data (SIGMOD/PODS '25). Association for Computing Machinery, New York, NY, USA, 788–796. https://doi.org/10.1145/3722212.3725639"
"Shunchang Liu, Zhuan Shi, Lingjuan Lyu, Yaochu Jin, and Boi Faltings",2025,CopyJudge: Automated Copyright Infringement Identification and Mitigation in Text-to-Image Diffusion Models,the 33rd ACM International Conference on Multimedia (MM '25),11347–11356,,"New York, NY, USA, 11347–11356",10.1145/3746027.3755027,https://doi.org/10.1145/3746027.3755027,,"Shunchang Liu, Zhuan Shi, Lingjuan Lyu, Yaochu Jin, and Boi Faltings. 2025. CopyJudge: Automated Copyright Infringement Identification and Mitigation in Text-to-Image Diffusion Models. In Proceedings of the 33rd ACM International Conference on Multimedia (MM '25). Association for Computing Machinery, New York, NY, USA, 11347–11356. https://doi.org/10.1145/3746027.3755027"
,,,,,,"New York, NY, USA",,,,"2025. Proceedings of the Intelligent Robotics FAIR 2025. Association for Computing Machinery, New York, NY, USA."
Nicolas Papernot,2022,The Role of Randomization in Trustworthy Machine Learning,the 9th ACM Workshop on Moving Target Defense (MTD'22),23–24,,"New York, NY, USA, 23–24",10.1145/3560828.3564001,https://doi.org/10.1145/3560828.3564001,,"Nicolas Papernot. 2022. The Role of Randomization in Trustworthy Machine Learning. In Proceedings of the 9th ACM Workshop on Moving Target Defense (MTD'22). Association for Computing Machinery, New York, NY, USA, 23–24. https://doi.org/10.1145/3560828.3564001"
"Peiran Wang, Qiyu Li, Longxuan Yu, Ziyao Wang, Ang Li, and Haojian Jin",2024,Moderator: Moderating Text-to-Image Diffusion Models through Fine-grained Context-based Policies,the 2024 on ACM SIGSAC Conference on Computer and Communications Security (CCS '24),1181–1195,,"New York, NY, USA, 1181–1195",10.1145/3658644.3690327,https://doi.org/10.1145/3658644.3690327,,"Peiran Wang, Qiyu Li, Longxuan Yu, Ziyao Wang, Ang Li, and Haojian Jin. 2024. Moderator: Moderating Text-to-Image Diffusion Models through Fine-grained Context-based Policies. In Proceedings of the 2024 on ACM SIGSAC Conference on Computer and Communications Security (CCS '24). Association for Computing Machinery, New York, NY, USA, 1181–1195. https://doi.org/10.1145/3658644.3690327"
"Bojan Karla\v{s}, Babak Salimi, and Sebastian Schelter",2025,"Navigating Data Errors in Machine Learning Pipelines: Identify, Debug, and Learn",,813–820,,"New York, NY, USA, 813–820",10.1145/3722212.3725636,https://doi.org/10.1145/3722212.3725636,,"Bojan Karla\v{s}, Babak Salimi, and Sebastian Schelter. 2025. Navigating Data Errors in Machine Learning Pipelines: Identify, Debug, and Learn. In Companion of the 2025 International Conference on Management of Data (SIGMOD/PODS '25). Association for Computing Machinery, New York, NY, USA, 813–820. https://doi.org/10.1145/3722212.3725636"
"Fan Qi, Ao Liu, Zixin Zhang, and Changsheng Xu",2025,FORGET ME: Federated Unlearning for Face Generation Models,the 33rd ACM International Conference on Multimedia (MM '25),11288–11297,,"New York, NY, USA, 11288–11297",10.1145/3746027.3754935,https://doi.org/10.1145/3746027.3754935,unlearning,"Fan Qi, Ao Liu, Zixin Zhang, and Changsheng Xu. 2025. FORGET ME: Federated Unlearning for Face Generation Models. In Proceedings of the 33rd ACM International Conference on Multimedia (MM '25). Association for Computing Machinery, New York, NY, USA, 11288–11297. https://doi.org/10.1145/3746027.3754935"
"Shuai Cheng, Haitao Xu, Shu Meng, Shuai Hao, Chuan Yue, and Zhao Li",2026,The Privacy Paradox of LLMs: User Perceptions and the Reality of PII Leakage,the 2026 CHI Conference on Human Factors in Computing Systems (CHI '26),1–25,1638,"New York, NY, USA, Article 1638, 1–25",10.1145/3772318.3791809,https://doi.org/10.1145/3772318.3791809,,"Shuai Cheng, Haitao Xu, Shu Meng, Shuai Hao, Chuan Yue, and Zhao Li. 2026. The Privacy Paradox of LLMs: User Perceptions and the Reality of PII Leakage. In Proceedings of the 2026 CHI Conference on Human Factors in Computing Systems (CHI '26). Association for Computing Machinery, New York, NY, USA, Article 1638, 1–25. https://doi.org/10.1145/3772318.3791809"
