authors,Year,title,venue,pages,article,publisher_location,doi,doi_url,category,raw_entry
"Thanh Tam Nguyen, Thanh Trung Huynh, Zhao Ren, Phi Le Nguyen, Alan Wee-Chung Liew, Hongzhi Yin, and Quoc Viet Hung Nguyen",2025,A Survey of Machine Unlearning,ACM Trans,,108,,10.1145/3749987,https://doi.org/10.1145/3749987,survey,"Thanh Tam Nguyen, Thanh Trung Huynh, Zhao Ren, Phi Le Nguyen, Alan Wee-Chung Liew, Hongzhi Yin, and Quoc Viet Hung Nguyen. 2025. A Survey of Machine Unlearning. ACM Trans. Intell. Syst. Technol. 16, 5, Article 108 (October 2025), 46 pages. https://doi.org/10.1145/3749987"
"Lulu Xue, Shengshan Hu, Wei Lu, Yan Shen, Dongxu Li, Peijin Guo, Ziqi Zhou, Minghui Li, Yanjun Zhang, and Leo Zhang",2026,Towards Reliable Forgetting: A Survey on Machine Unlearning Verification,ACM Comput,,314,,10.1145/3807451,https://doi.org/10.1145/3807451,survey,"Lulu Xue, Shengshan Hu, Wei Lu, Yan Shen, Dongxu Li, Peijin Guo, Ziqi Zhou, Minghui Li, Yanjun Zhang, and Leo Zhang. 2026. Towards Reliable Forgetting: A Survey on Machine Unlearning Verification. ACM Comput. Surv. 58, 12, Article 314 (September 2026), 35 pages. https://doi.org/10.1145/3807451"
Yezi Liu and Yanning Shen,2025,Enabling Group Fairness in Machine Unlearning via Distribution Correction,the 34th ACM International Conference on Information and Knowledge Management (CIKM '25),1925–1935,,"New York, NY, USA, 1925–1935",10.1145/3746252.3761299,https://doi.org/10.1145/3746252.3761299,unlearning,"Yezi Liu and Yanning Shen. 2025. Enabling Group Fairness in Machine Unlearning via Distribution Correction. In Proceedings of the 34th ACM International Conference on Information and Knowledge Management (CIKM '25). Association for Computing Machinery, New York, NY, USA, 1925–1935. https://doi.org/10.1145/3746252.3761299"
"Renyang Liu, Wenjie Feng, Tianwei Zhang, Wei Zhou, Xueqi Cheng, and See-Kiong Ng",2025,Rethinking Machine Unlearning in Image Generation Models,the 2025 ACM SIGSAC Conference on Computer and Communications Security (CCS '25),993–1007,,"New York, NY, USA, 993–1007",10.1145/3719027.3744793,https://doi.org/10.1145/3719027.3744793,unlearning,"Renyang Liu, Wenjie Feng, Tianwei Zhang, Wei Zhou, Xueqi Cheng, and See-Kiong Ng. 2025. Rethinking Machine Unlearning in Image Generation Models. In Proceedings of the 2025 ACM SIGSAC Conference on Computer and Communications Security (CCS '25). Association for Computing Machinery, New York, NY, USA, 993–1007. https://doi.org/10.1145/3719027.3744793"
Khoa Tran and Simon S. Woo,2025,Fairness and Robustness in Machine Unlearning,ACM on Web Conference 2025 (WWW '25),1336–1340,,"New York, NY, USA, 1336–1340",10.1145/3701716.3715598,https://doi.org/10.1145/3701716.3715598,unlearning,"Khoa Tran and Simon S. Woo. 2025. Fairness and Robustness in Machine Unlearning. In Companion Proceedings of the ACM on Web Conference 2025 (WWW '25). Association for Computing Machinery, New York, NY, USA, 1336–1340. https://doi.org/10.1145/3701716.3715598"
"Andrea D'Angelo, Claudio Savelli, Gabriele Tagliente, Flavio Giobergia, Elena Baralis, and Giovanni Stilo",2025,ERASURE: A Modular and Extensible Framework for Machine Unlearning,the 34th ACM International Conference on Information and Knowledge Management (CIKM '25),6346–6350,,"New York, NY, USA, 6346–6350",10.1145/3746252.3761627,https://doi.org/10.1145/3746252.3761627,framework,"Andrea D'Angelo, Claudio Savelli, Gabriele Tagliente, Flavio Giobergia, Elena Baralis, and Giovanni Stilo. 2025. ERASURE: A Modular and Extensible Framework for Machine Unlearning. In Proceedings of the 34th ACM International Conference on Information and Knowledge Management (CIKM '25). Association for Computing Machinery, New York, NY, USA, 6346–6350. https://doi.org/10.1145/3746252.3761627"
"Yurim Jang, Jaeung Lee, Dohyun Kim, Jaemin Jo, and Simon S Woo",2026,Suppression or Deletion: A Restoration-Based Representation-Level Analysis of Machine Unlearning,the ACM Web Conference 2026 (WWW '26),8505–8508,,"New York, NY, USA, 8505–8508",10.1145/3774904.3792896,https://doi.org/10.1145/3774904.3792896,unlearning,"Yurim Jang, Jaeung Lee, Dohyun Kim, Jaemin Jo, and Simon S Woo. 2026. Suppression or Deletion: A Restoration-Based Representation-Level Analysis of Machine Unlearning. In Proceedings of the ACM Web Conference 2026 (WWW '26). Association for Computing Machinery, New York, NY, USA, 8505–8508. https://doi.org/10.1145/3774904.3792896"
"Zitong Li, Qingqing Ye, and Haibo Hu",2025,FUNU: Boosting Machine Unlearning Efficiency by Filtering Unnecessary Unlearning,the ACM on Web Conference 2025 (WWW '25),3366–3376,,"New York, NY, USA, 3366–3376",10.1145/3696410.3714711,https://doi.org/10.1145/3696410.3714711,unlearning,"Zitong Li, Qingqing Ye, and Haibo Hu. 2025. FUNU: Boosting Machine Unlearning Efficiency by Filtering Unnecessary Unlearning. In Proceedings of the ACM on Web Conference 2025 (WWW '25). Association for Computing Machinery, New York, NY, USA, 3366–3376. https://doi.org/10.1145/3696410.3714711"
"Heng Xu, Tianqing Zhu, Lefeng Zhang, Wanlei Zhou, and Philip S. Yu",2023,Machine Unlearning: A Survey,ACM Comput,,9,,10.1145/3603620,https://doi.org/10.1145/3603620,survey,"Heng Xu, Tianqing Zhu, Lefeng Zhang, Wanlei Zhou, and Philip S. Yu. 2023. Machine Unlearning: A Survey. ACM Comput. Surv. 56, 1, Article 9 (January 2024), 36 pages. https://doi.org/10.1145/3603620"
"Gaoyang Liu, Xijie Wang, Zixiong Wang, Chen Wang, Ahmed M. Abdelmoniem, and Desheng Wang",2025,Prototype Surgery: Tailoring Neural Prototypes via Soft Labels for Efficient Machine Unlearning,the 2025 ACM SIGSAC Conference on Computer and Communications Security (CCS '25),2804–2817,,"New York, NY, USA, 2804–2817",10.1145/3719027.3744827,https://doi.org/10.1145/3719027.3744827,unlearning,"Gaoyang Liu, Xijie Wang, Zixiong Wang, Chen Wang, Ahmed M. Abdelmoniem, and Desheng Wang. 2025. Prototype Surgery: Tailoring Neural Prototypes via Soft Labels for Efficient Machine Unlearning. In Proceedings of the 2025 ACM SIGSAC Conference on Computer and Communications Security (CCS '25). Association for Computing Machinery, New York, NY, USA, 2804–2817. https://doi.org/10.1145/3719027.3744827"
"Weiqi Wang, Zhiyi Tian, An Liu, and Shui Yu",2025,TAPE: Tailored Posterior Difference for Auditing of Machine Unlearning,the ACM on Web Conference 2025 (WWW '25),3061–3072,,"New York, NY, USA, 3061–3072",10.1145/3696410.3714875,https://doi.org/10.1145/3696410.3714875,unlearning,"Weiqi Wang, Zhiyi Tian, An Liu, and Shui Yu. 2025. TAPE: Tailored Posterior Difference for Auditing of Machine Unlearning. In Proceedings of the ACM on Web Conference 2025 (WWW '25). Association for Computing Machinery, New York, NY, USA, 3061–3072. https://doi.org/10.1145/3696410.3714875"
"Shanshan Ye, Jie Lu, and Guangquan Zhang",2025,Towards Safe Machine Unlearning: A Paradigm that Mitigates Performance Degradation,the ACM on Web Conference 2025 (WWW '25),4635–4652,,"New York, NY, USA, 4635–4652",10.1145/3696410.3714638,https://doi.org/10.1145/3696410.3714638,unlearning,"Shanshan Ye, Jie Lu, and Guangquan Zhang. 2025. Towards Safe Machine Unlearning: A Paradigm that Mitigates Performance Degradation. In Proceedings of the ACM on Web Conference 2025 (WWW '25). Association for Computing Machinery, New York, NY, USA, 4635–4652. https://doi.org/10.1145/3696410.3714638"
Sangjun Chung and Simon S. Woo,2025,MU-OT: Effective and Unified Machine Unlearning with Optimal Transport for Feature Realignment,the 34th ACM International Conference on Information and Knowledge Management (CIKM '25),4690–4694,,"New York, NY, USA, 4690–4694",10.1145/3746252.3760915,https://doi.org/10.1145/3746252.3760915,unlearning,"Sangjun Chung and Simon S. Woo. 2025. MU-OT: Effective and Unified Machine Unlearning with Optimal Transport for Feature Realignment. In Proceedings of the 34th ACM International Conference on Information and Knowledge Management (CIKM '25). Association for Computing Machinery, New York, NY, USA, 4690–4694. https://doi.org/10.1145/3746252.3760915"
"Min Chen, Weizhuo Gao, Chen Wang, Gaoyang Liu, Ahmed M. Abdelmoniem, and Kai Peng",2025,From Expansion to Retraction: Long-tailed Machine Unlearning via Boundary Manipulation,the 31st ACM SIGKDD Conference on Knowledge Discovery and Data Mining V.2 (KDD '25),215–226,,"New York, NY, USA, 215–226",10.1145/3711896.3736970,https://doi.org/10.1145/3711896.3736970,unlearning,"Min Chen, Weizhuo Gao, Chen Wang, Gaoyang Liu, Ahmed M. Abdelmoniem, and Kai Peng. 2025. From Expansion to Retraction: Long-tailed Machine Unlearning via Boundary Manipulation. In Proceedings of the 31st ACM SIGKDD Conference on Knowledge Discovery and Data Mining V.2 (KDD '25). Association for Computing Machinery, New York, NY, USA, 215–226. https://doi.org/10.1145/3711896.3736970"
"Xiang Li, Wenqi Wei, and Bhavani Thuraisingham",2025,MUBox: A Critical Evaluation Framework of Deep Machine Unlearning [Systematization of Knowledge Paper],the 30th ACM Symposium on Access Control Models and Technologies (SACMAT '25),175–188,,"New York, NY, USA, 175–188",10.1145/3734436.3734454,https://doi.org/10.1145/3734436.3734454,framework,"Xiang Li, Wenqi Wei, and Bhavani Thuraisingham. 2025. MUBox: A Critical Evaluation Framework of Deep Machine Unlearning [Systematization of Knowledge Paper]. In Proceedings of the 30th ACM Symposium on Access Control Models and Technologies (SACMAT '25). Association for Computing Machinery, New York, NY, USA, 175–188. https://doi.org/10.1145/3734436.3734454"
"Meghdad Kurmanji, Eleni Triantafillou, and Peter Triantafillou",2024,Machine Unlearning in Learned Databases: An Experimental Analysis,ACM Manag,,49,,10.1145/3639304,https://doi.org/10.1145/3639304,unlearning,"Meghdad Kurmanji, Eleni Triantafillou, and Peter Triantafillou. 2024. Machine Unlearning in Learned Databases: An Experimental Analysis. Proc. ACM Manag. Data 2, 1, Article 49 (February 2024), 26 pages. https://doi.org/10.1145/3639304"
"Yuke Hu, Jian Lou, Jiaqi Liu, Wangze Ni, Feng Lin, Zhan Qin, and Kui Ren",2024,ERASER: Machine Unlearning in MLaaS via an Inference Serving-Aware Approach,the 2024 on ACM SIGSAC Conference on Computer and Communications Security (CCS '24),3883–3897,,"New York, NY, USA, 3883–3897",10.1145/3658644.3670398,https://doi.org/10.1145/3658644.3670398,unlearning,"Yuke Hu, Jian Lou, Jiaqi Liu, Wangze Ni, Feng Lin, Zhan Qin, and Kui Ren. 2024. ERASER: Machine Unlearning in MLaaS via an Inference Serving-Aware Approach. In Proceedings of the 2024 on ACM SIGSAC Conference on Computer and Communications Security (CCS '24). Association for Computing Machinery, New York, NY, USA, 3883–3897. https://doi.org/10.1145/3658644.3670398"
"Shuijing Zhang, Jian Lou, Li Xiong, Xiaoyu Zhang, and Jing Liu",2023,Closed-form Machine Unlearning for Matrix Factorization,the 32nd ACM International Conference on Information and Knowledge Management (CIKM '23),3278–3287,,"New York, NY, USA, 3278–3287",10.1145/3583780.3614811,https://doi.org/10.1145/3583780.3614811,unlearning,"Shuijing Zhang, Jian Lou, Li Xiong, Xiaoyu Zhang, and Jing Liu. 2023. Closed-form Machine Unlearning for Matrix Factorization. In Proceedings of the 32nd ACM International Conference on Information and Knowledge Management (CIKM '23). Association for Computing Machinery, New York, NY, USA, 3278–3287. https://doi.org/10.1145/3583780.3614811"
"Shen Lin, Xiaoyu Zhang, Willy Susilo, Xiaofeng Chen, and Jun Liu",2024,GDR-GMA: Machine Unlearning via Direction-Rectified and Magnitude-Adjusted Gradients,the 32nd ACM International Conference on Multimedia (MM '24),9087–9095,,"New York, NY, USA, 9087–9095",10.1145/3664647.3680775,https://doi.org/10.1145/3664647.3680775,unlearning,"Shen Lin, Xiaoyu Zhang, Willy Susilo, Xiaofeng Chen, and Jun Liu. 2024. GDR-GMA: Machine Unlearning via Direction-Rectified and Magnitude-Adjusted Gradients. In Proceedings of the 32nd ACM International Conference on Multimedia (MM '24). Association for Computing Machinery, New York, NY, USA, 9087–9095. https://doi.org/10.1145/3664647.3680775"
"Haruki Yonekura, Ren Ozeki, Tatsuya Amano, Hamada Rizk, and Hirozumi Yamaguchi",2025,MobText-SISA: Efficient Machine Unlearning for Mobility Logs with Spatio-Temporal and Natural-Language Data,the 33rd ACM International Conference on Advances in Geographic Information Systems (SIGSPATIAL '25),1186–1189,,"New York, NY, USA, 1186–1189",10.1145/3748636.3763226,https://doi.org/10.1145/3748636.3763226,unlearning,"Haruki Yonekura, Ren Ozeki, Tatsuya Amano, Hamada Rizk, and Hirozumi Yamaguchi. 2025. MobText-SISA: Efficient Machine Unlearning for Mobility Logs with Spatio-Temporal and Natural-Language Data. In Proceedings of the 33rd ACM International Conference on Advances in Geographic Information Systems (SIGSPATIAL '25). Association for Computing Machinery, New York, NY, USA, 1186–1189. https://doi.org/10.1145/3748636.3763226"
"Ci Zhang, Chence Yang, Qitao Tan, Jun Liu, Ao Li, Yanzhi Wang, Jin Lu, Jinhui Wang, and Geng Yuan",2025,Towards Memory-Efficient and Sustainable Machine Unlearning on Edge using Zeroth-Order Optimizer,the Great Lakes Symposium on VLSI 2025 (GLSVLSI '25),227–232,,"New York, NY, USA, 227–232",10.1145/3716368.3735273,https://doi.org/10.1145/3716368.3735273,unlearning,"Ci Zhang, Chence Yang, Qitao Tan, Jun Liu, Ao Li, Yanzhi Wang, Jin Lu, Jinhui Wang, and Geng Yuan. 2025. Towards Memory-Efficient and Sustainable Machine Unlearning on Edge using Zeroth-Order Optimizer. In Proceedings of the Great Lakes Symposium on VLSI 2025 (GLSVLSI '25). Association for Computing Machinery, New York, NY, USA, 227–232. https://doi.org/10.1145/3716368.3735273"
Tam\'{a}s Tak\'{a}cs and L\'{a}szl\'{o} Guly\'{a}s,2025,Failure Modes of Zero-Shot Machine Unlearning in Reinforcement Learning and Robotics,the Intelligent Robotics FAIR 2025 (IntRob '25),76–81,,"New York, NY, USA, 76–81",10.1145/3759355.3759625,https://doi.org/10.1145/3759355.3759625,unlearning,"Tam\'{a}s Tak\'{a}cs and L\'{a}szl\'{o} Guly\'{a}s. 2025. Failure Modes of Zero-Shot Machine Unlearning in Reinforcement Learning and Robotics. In Proceedings of the Intelligent Robotics FAIR 2025 (IntRob '25). Association for Computing Machinery, New York, NY, USA, 76–81. https://doi.org/10.1145/3759355.3759625"
"Huawei Lin, Jun Woo Chung, Yingjie Lao, and Weijie Zhao",2023,Machine Unlearning in Gradient Boosting Decision Trees,the 29th ACM SIGKDD Conference on Knowledge Discovery and Data Mining (KDD '23),1374–1383,,"New York, NY, USA, 1374–1383",10.1145/3580305.3599420,https://doi.org/10.1145/3580305.3599420,unlearning,"Huawei Lin, Jun Woo Chung, Yingjie Lao, and Weijie Zhao. 2023. Machine Unlearning in Gradient Boosting Decision Trees. In Proceedings of the 29th ACM SIGKDD Conference on Knowledge Discovery and Data Mining (KDD '23). Association for Computing Machinery, New York, NY, USA, 1374–1383. https://doi.org/10.1145/3580305.3599420"
"Yong Zhang, Xiliang Jiang, Bo Xia, Qi Ding, and Fan Zhang",2025,A Novel Model-Knowledge Transfer Approach for Effective Machine Unlearning and Performance Preservation,"the 2024 2nd International Conference on Artificial Intelligence, Systems and Network Security (AISNS '24)",215–220,,"New York, NY, USA, 215–220",10.1145/3714334.3714371,https://doi.org/10.1145/3714334.3714371,unlearning,"Yong Zhang, Xiliang Jiang, Bo Xia, Qi Ding, and Fan Zhang. 2025. A Novel Model-Knowledge Transfer Approach for Effective Machine Unlearning and Performance Preservation. In Proceedings of the 2024 2nd International Conference on Artificial Intelligence, Systems and Network Security (AISNS '24). Association for Computing Machinery, New York, NY, USA, 215–220. https://doi.org/10.1145/3714334.3714371"
"Vasileios Perifanis, Efstathios Karypidis, Nikos Komodakis, and Pavlos Efraimidis",2024,SFTC: Machine Unlearning via Selective Fine-tuning and Targeted Confusion,the 2024 European Interdisciplinary Cybersecurity Conference (EICC '24),29–36,,"New York, NY, USA, 29–36",10.1145/3655693.3655697,https://doi.org/10.1145/3655693.3655697,unlearning,"Vasileios Perifanis, Efstathios Karypidis, Nikos Komodakis, and Pavlos Efraimidis. 2024. SFTC: Machine Unlearning via Selective Fine-tuning and Targeted Confusion. In Proceedings of the 2024 European Interdisciplinary Cybersecurity Conference (EICC '24). Association for Computing Machinery, New York, NY, USA, 29–36. https://doi.org/10.1145/3655693.3655697"
"Zheyuan Liu, Guangyao Dou, Eli Chien, Chunhui Zhang, Yijun Tian, and Ziwei Zhu",2024,"Breaking the Trilemma of Privacy, Utility, and Efficiency via Controllable Machine Unlearning",the ACM Web Conference 2024 (WWW '24),1260–1271,,"New York, NY, USA, 1260–1271",10.1145/3589334.3645669,https://doi.org/10.1145/3589334.3645669,unlearning,"Zheyuan Liu, Guangyao Dou, Eli Chien, Chunhui Zhang, Yijun Tian, and Ziwei Zhu. 2024. Breaking the Trilemma of Privacy, Utility, and Efficiency via Controllable Machine Unlearning. In Proceedings of the ACM Web Conference 2024 (WWW '24). Association for Computing Machinery, New York, NY, USA, 1260–1271. https://doi.org/10.1145/3589334.3645669"
"Min Chen, Zhikun Zhang, Tianhao Wang, Michael Backes, Mathias Humbert, and Yang Zhang",2021,When Machine Unlearning Jeopardizes Privacy,the 2021 ACM SIGSAC Conference on Computer and Communications Security (CCS '21),896–911,,"New York, NY, USA, 896–911",10.1145/3460120.3484756,https://doi.org/10.1145/3460120.3484756,unlearning,"Min Chen, Zhikun Zhang, Tianhao Wang, Michael Backes, Mathias Humbert, and Yang Zhang. 2021. When Machine Unlearning Jeopardizes Privacy. In Proceedings of the 2021 ACM SIGSAC Conference on Computer and Communications Security (CCS '21). Association for Computing Machinery, New York, NY, USA, 896–911. https://doi.org/10.1145/3460120.3484756"
Dominika \v{C}upkov\'{a},2026,Practicing The Weird Third Thing: A Participatory Methodology for Machine Unlearning through Playful Subversion,"the 2025 12th International Conference on Digital and Interactive Arts: Media Art Cultures, Communities &amp; Territories (ARTECH '25)",1–6,57,"New York, NY, USA, Article 57, 1–6",10.1145/3773699.3774358,https://doi.org/10.1145/3773699.3774358,unlearning,"Dominika \v{C}upkov\'{a}. 2026. Practicing The Weird Third Thing: A Participatory Methodology for Machine Unlearning through Playful Subversion. In Proceedings of the 2025 12th International Conference on Digital and Interactive Arts: Media Art Cultures, Communities &amp; Territories (ARTECH '25). Association for Computing Machinery, New York, NY, USA, Article 57, 1–6. https://doi.org/10.1145/3773699.3774358"
"Peng-Fei Zhang, Guangdong Bai, Zi Huang, and Xin-Shun Xu",2022,Machine Unlearning for Image Retrieval: A Generative Scrubbing Approach,the 30th ACM International Conference on Multimedia (MM '22),237–245,,"New York, NY, USA, 237–245",10.1145/3503161.3548378,https://doi.org/10.1145/3503161.3548378,unlearning,"Peng-Fei Zhang, Guangdong Bai, Zi Huang, and Xin-Shun Xu. 2022. Machine Unlearning for Image Retrieval: A Generative Scrubbing Approach. In Proceedings of the 30th ACM International Conference on Multimedia (MM '22). Association for Computing Machinery, New York, NY, USA, 237–245. https://doi.org/10.1145/3503161.3548378"
"Qun Song, Rui Tan, and Jianping Wang",2023,Towards Efficient Personalized Driver Behavior Modeling with Machine Unlearning,Cyber-Physical Systems and Internet of Things Week 2023 (CPS-IoT Week '23),31–36,,"New York, NY, USA, 31–36",10.1145/3576914.3587489,https://doi.org/10.1145/3576914.3587489,unlearning,"Qun Song, Rui Tan, and Jianping Wang. 2023. Towards Efficient Personalized Driver Behavior Modeling with Machine Unlearning. In Proceedings of Cyber-Physical Systems and Internet of Things Week 2023 (CPS-IoT Week '23). Association for Computing Machinery, New York, NY, USA, 31–36. https://doi.org/10.1145/3576914.3587489"
"Manaar Alam, Hithem Lamri, and Michail Maniatakos",2025,ReVeil: Unconstrained Concealed Backdoor Attack on Deep Neural Networks Using Machine Unlearning,,1–7,364,,10.1109/DAC63849.2025.11133199,https://doi.org/10.1109/DAC63849.2025.11133199,unlearning,"Manaar Alam, Hithem Lamri, and Michail Maniatakos. 2025. ReVeil: Unconstrained Concealed Backdoor Attack on Deep Neural Networks Using Machine Unlearning. In Proceedings of the 62nd Annual ACM/IEEE Design Automation Conference (DAC '25). IEEE Press, Article 364, 1–7. https://doi.org/10.1109/DAC63849.2025.11133199"
"Zhaomin Wu, Junhui Zhu, Qinbin Li, and Bingsheng He",2023,DeltaBoost: Gradient Boosting Decision Trees with Efficient Machine Unlearning,ACM Manag,,168,,10.1145/3589313,https://doi.org/10.1145/3589313,unlearning,"Zhaomin Wu, Junhui Zhu, Qinbin Li, and Bingsheng He. 2023. DeltaBoost: Gradient Boosting Decision Trees with Efficient Machine Unlearning. Proc. ACM Manag. Data 1, 2, Article 168 (June 2023), 26 pages. https://doi.org/10.1145/3589313"
"Aman Tahiliani, Vikas Hassija, Vinay Chamola, and Mohsen Guizani",2021,Machine Unlearning: Its Need and Implementation Strategies,the 2021 Thirteenth International Conference on Contemporary Computing (IC3-2021),241–246,,"New York, NY, USA, 241–246",10.1145/3474124.3474158,https://doi.org/10.1145/3474124.3474158,unlearning,"Aman Tahiliani, Vikas Hassija, Vinay Chamola, and Mohsen Guizani. 2021. Machine Unlearning: Its Need and Implementation Strategies. In Proceedings of the 2021 Thirteenth International Conference on Contemporary Computing (IC3-2021). Association for Computing Machinery, New York, NY, USA, 241–246. https://doi.org/10.1145/3474124.3474158"
"Sebastian Schelter, Stefan Grafberger, and Maarten de Rijke",2024,Snarcase - Regain Control over Your Predictions with Low-Latency Machine Unlearning,,4273–4276,,,10.14778/3685800.3685853,https://doi.org/10.14778/3685800.3685853,unlearning,"Sebastian Schelter, Stefan Grafberger, and Maarten de Rijke. 2024. Snarcase - Regain Control over Your Predictions with Low-Latency Machine Unlearning. Proc. VLDB Endow. 17, 12 (August 2024), 4273–4276. https://doi.org/10.14778/3685800.3685853"
"Sebastian Schelter, Stefan Grafberger, and Ted Dunning",2021,HedgeCut: Maintaining Randomised Trees for Low-Latency Machine Unlearning,the 2021 International Conference on Management of Data (SIGMOD '21),1545–1557,,"New York, NY, USA, 1545–1557",10.1145/3448016.3457239,https://doi.org/10.1145/3448016.3457239,unlearning,"Sebastian Schelter, Stefan Grafberger, and Ted Dunning. 2021. HedgeCut: Maintaining Randomised Trees for Low-Latency Machine Unlearning. In Proceedings of the 2021 International Conference on Management of Data (SIGMOD '21). Association for Computing Machinery, New York, NY, USA, 1545–1557. https://doi.org/10.1145/3448016.3457239"
"Quoc Phong Nguyen, Ryutaro Oikawa, Dinil Mon Divakaran, Mun Choon Chan, and Bryan Kian Hsiang Low",2022,Markov Chain Monte Carlo-Based Machine Unlearning: Unlearning What Needs to be Forgotten,the 2022 ACM on Asia Conference on Computer and Communications Security (ASIA CCS '22),351–363,,"New York, NY, USA, 351–363",10.1145/3488932.3517406,https://doi.org/10.1145/3488932.3517406,unlearning,"Quoc Phong Nguyen, Ryutaro Oikawa, Dinil Mon Divakaran, Mun Choon Chan, and Bryan Kian Hsiang Low. 2022. Markov Chain Monte Carlo-Based Machine Unlearning: Unlearning What Needs to be Forgotten. In Proceedings of the 2022 ACM on Asia Conference on Computer and Communications Security (ASIA CCS '22). Association for Computing Machinery, New York, NY, USA, 351–363. https://doi.org/10.1145/3488932.3517406"
"Chenhan Zhang, Benjamin Zhao, Hassan Asghar, Weiqi Wang, An Liu, and Dali Kaafar",2026,"Forget Me, Not My Friends! Object Unlearning Based on Scene Graphs",the Nineteenth ACM International Conference on Web Search and Data Mining (WSDM '26),913–923,,"New York, NY, USA, 913–923",10.1145/3773966.3777964,https://doi.org/10.1145/3773966.3777964,unlearning,"Chenhan Zhang, Benjamin Zhao, Hassan Asghar, Weiqi Wang, An Liu, and Dali Kaafar. 2026. Forget Me, Not My Friends! Object Unlearning Based on Scene Graphs. In Proceedings of the Nineteenth ACM International Conference on Web Search and Data Mining (WSDM '26). Association for Computing Machinery, New York, NY, USA, 913–923. https://doi.org/10.1145/3773966.3777964"
"Zhigao Zheng, Kai Yin, Yaowen Kuang, Tao Wang, Yahong Chen, Shihong Yao, and Hao Huang",2026,DeepUL: Deep Unlearning via Model Sparsity,the ACM Web Conference 2026 (WWW '26),3102–3110,,"New York, NY, USA, 3102–3110",10.1145/3774904.3792441,https://doi.org/10.1145/3774904.3792441,unlearning,"Zhigao Zheng, Kai Yin, Yaowen Kuang, Tao Wang, Yahong Chen, Shihong Yao, and Hao Huang. 2026. DeepUL: Deep Unlearning via Model Sparsity. In Proceedings of the ACM Web Conference 2026 (WWW '26). Association for Computing Machinery, New York, NY, USA, 3102–3110. https://doi.org/10.1145/3774904.3792441"
"Lefeng Zhang, Tianqing Zhu, Ping Xiong, and Wanlei Zhou",2025,The Price of Unlearning: Identifying Unlearning Risk in Edge Computing,ACM Trans,,218,,10.1145/3662184,https://doi.org/10.1145/3662184,unlearning,"Lefeng Zhang, Tianqing Zhu, Ping Xiong, and Wanlei Zhou. 2025. The Price of Unlearning: Identifying Unlearning Risk in Edge Computing. ACM Trans. Multimedia Comput. Commun. Appl. 21, 8, Article 218 (August 2025), 23 pages. https://doi.org/10.1145/3662184"
