authors,Year,title,venue,pages,article,publisher_location,doi,doi_url,category,raw_entry
"Jiajie He, Yuechun Gu, and Keke Chen",2025,RecPS: Privacy Risk Scoring for Recommender Systems,the Nineteenth ACM Conference on Recommender Systems (RecSys '25),432–440,,"New York, NY, USA, 432–440",10.1145/3705328.3748052,https://doi.org/10.1145/3705328.3748052,,"Jiajie He, Yuechun Gu, and Keke Chen. 2025. RecPS: Privacy Risk Scoring for Recommender Systems. In Proceedings of the Nineteenth ACM Conference on Recommender Systems (RecSys '25). Association for Computing Machinery, New York, NY, USA, 432–440. https://doi.org/10.1145/3705328.3748052"
"Yizhan Huang, Yichen Li, Weibin Wu, Jianping Zhang, and Michael R. Lyu",2024,Your Code Secret Belongs to Me: Neural Code Completion Tools Can Memorize Hard-Coded Credentials,ACM Softw,,111,,10.1145/3660818,https://doi.org/10.1145/3660818,,"Yizhan Huang, Yichen Li, Weibin Wu, Jianping Zhang, and Michael R. Lyu. 2024. Your Code Secret Belongs to Me: Neural Code Completion Tools Can Memorize Hard-Coded Credentials. Proc. ACM Softw. Eng. 1, FSE, Article 111 (July 2024), 23 pages. https://doi.org/10.1145/3660818"
"Nils Kemmerzell, Annika Schreiner, Haroon Khalid, Michael Schalk, and Letizia Bordoli",2025,Towards a Better Understanding of Evaluating Trustworthiness in AI Systems,ACM Comput,,218,,10.1145/3721976,https://doi.org/10.1145/3721976,,"Nils Kemmerzell, Annika Schreiner, Haroon Khalid, Michael Schalk, and Letizia Bordoli. 2025. Towards a Better Understanding of Evaluating Trustworthiness in AI Systems. ACM Comput. Surv. 57, 9, Article 218 (September 2025), 38 pages. https://doi.org/10.1145/3721976"
"Beining Zhang, Kai Wu, Xiaoyu Zhang, Handing Wang, Jing Liu, Bei Wang, and Kai Wang",2025,TSGGuide: Recommendation Guide for Multivariate Time Series Generation,ACM on Web Conference 2025 (WWW '25),2215–2224,,"New York, NY, USA, 2215–2224",10.1145/3701716.3717381,https://doi.org/10.1145/3701716.3717381,,"Beining Zhang, Kai Wu, Xiaoyu Zhang, Handing Wang, Jing Liu, Bei Wang, and Kai Wang. 2025. TSGGuide: Recommendation Guide for Multivariate Time Series Generation. In Companion Proceedings of the ACM on Web Conference 2025 (WWW '25). Association for Computing Machinery, New York, NY, USA, 2215–2224. https://doi.org/10.1145/3701716.3717381"
"Caleb Geren, Amanda Board, Gaby G. Dagher, Tim Andersen, and Jun Zhuang",2025,Blockchain for Large Language Model Security and Safety: A Holistic Survey,,1–20,,,10.1145/3715073.3715075,https://doi.org/10.1145/3715073.3715075,survey,"Caleb Geren, Amanda Board, Gaby G. Dagher, Tim Andersen, and Jun Zhuang. 2025. Blockchain for Large Language Model Security and Safety: A Holistic Survey. SIGKDD Explor. Newsl. 26, 2 (December 2024), 1–20. https://doi.org/10.1145/3715073.3715075"
"Chuanhao Nie, Yunbo Liu, and Chao Wang",2026,AI Application in Anti-Money Laundering for Sustainable and Transparent Financial Systems,the 2025 International Conference on Artificial Intelligence and Sustainable Development (ICAISD '25),239–251,,"New York, NY, USA, 239–251",10.1145/3786484.3786522,https://doi.org/10.1145/3786484.3786522,,"Chuanhao Nie, Yunbo Liu, and Chao Wang. 2026. AI Application in Anti-Money Laundering for Sustainable and Transparent Financial Systems. In Proceedings of the 2025 International Conference on Artificial Intelligence and Sustainable Development (ICAISD '25). Association for Computing Machinery, New York, NY, USA, 239–251. https://doi.org/10.1145/3786484.3786522"
"Philipp Hacker, Felix Naumann, Tobias Friedrich, Stefan Grundmann, Anja Lehmann, and Herbert Zech",2022,AI Compliance – Challenges of Bridging Data Science and Law,,,21,,10.1145/3531532,https://doi.org/10.1145/3531532,,"Philipp Hacker, Felix Naumann, Tobias Friedrich, Stefan Grundmann, Anja Lehmann, and Herbert Zech. 2022. AI Compliance – Challenges of Bridging Data Science and Law. J. Data and Information Quality 14, 3, Article 21 (September 2022), 4 pages. https://doi.org/10.1145/3531532"
"Xingqi Wang, Xiaoyuan Yi, Xing Xie, and Jia Jia",2025,Specify Privacy Yourself: Assessing Inference-Time Personalized Privacy Preservation Ability of Large Vision-Language Models,the 33rd ACM International Conference on Multimedia (MM '25),12304–12313,,"New York, NY, USA, 12304–12313",10.1145/3746027.3758156,https://doi.org/10.1145/3746027.3758156,,"Xingqi Wang, Xiaoyuan Yi, Xing Xie, and Jia Jia. 2025. Specify Privacy Yourself: Assessing Inference-Time Personalized Privacy Preservation Ability of Large Vision-Language Models. In Proceedings of the 33rd ACM International Conference on Multimedia (MM '25). Association for Computing Machinery, New York, NY, USA, 12304–12313. https://doi.org/10.1145/3746027.3758156"
"Pengjun Zeng, Danruolan Li, and Shuangshuang Li",2024,Improving Accuracy by Using Tailored Diffusion Model,the 5th International Conference on Computer Information and Big Data Applications (CIBDA '24),252–257,,"New York, NY, USA, 252–257",10.1145/3671151.3671197,https://doi.org/10.1145/3671151.3671197,,"Pengjun Zeng, Danruolan Li, and Shuangshuang Li. 2024. Improving Accuracy by Using Tailored Diffusion Model. In Proceedings of the 5th International Conference on Computer Information and Big Data Applications (CIBDA '24). Association for Computing Machinery, New York, NY, USA, 252–257. https://doi.org/10.1145/3671151.3671197"
"Ningning Ding, Zhenyu Sun, Ermin Wei, and Randall Berry",2023,Incentive Mechanism Design for Federated Learning and Unlearning,"the Twenty-fourth International Symposium on Theory, Algorithmic Foundations, and Protocol Design for Mobile Networks and Mobile Computing (MobiHoc '23)",11–20,,"New York, NY, USA, 11–20",10.1145/3565287.3610269,https://doi.org/10.1145/3565287.3610269,unlearning,"Ningning Ding, Zhenyu Sun, Ermin Wei, and Randall Berry. 2023. Incentive Mechanism Design for Federated Learning and Unlearning. In Proceedings of the Twenty-fourth International Symposium on Theory, Algorithmic Foundations, and Protocol Design for Mobile Networks and Mobile Computing (MobiHoc '23). Association for Computing Machinery, New York, NY, USA, 11–20. https://doi.org/10.1145/3565287.3610269"
"Girim Ban, Hyeonseok Yun, Banseok Lee, David Sung, and Simon S. Woo",2024,Deep Journey Hierarchical Attention Networks for Conversion Predictions in Digital Marketing,the 33rd ACM International Conference on Information and Knowledge Management (CIKM '24),4358–4365,,"New York, NY, USA, 4358–4365",10.1145/3627673.3680066,https://doi.org/10.1145/3627673.3680066,,"Girim Ban, Hyeonseok Yun, Banseok Lee, David Sung, and Simon S. Woo. 2024. Deep Journey Hierarchical Attention Networks for Conversion Predictions in Digital Marketing. In Proceedings of the 33rd ACM International Conference on Information and Knowledge Management (CIKM '24). Association for Computing Machinery, New York, NY, USA, 4358–4365. https://doi.org/10.1145/3627673.3680066"
"Lingxin Jin, Xiangyu Wen, Wei Jiang, Jinyu Zhan, and Xingzhi Zhou",2025,Trojan Attacks and Countermeasures on Deep Neural Networks from Life-Cycle Perspective: A Review,ACM Comput,,244,,10.1145/3727640,https://doi.org/10.1145/3727640,,"Lingxin Jin, Xiangyu Wen, Wei Jiang, Jinyu Zhan, and Xingzhi Zhou. 2025. Trojan Attacks and Countermeasures on Deep Neural Networks from Life-Cycle Perspective: A Review. ACM Comput. Surv. 57, 10, Article 244 (October 2025), 37 pages. https://doi.org/10.1145/3727640"
"Shujun Li, Kovila Coopamootoo, and Michael Sirivianos (Eds.)",2024,Proceedings of the 2024 European Interdisciplinary Cybersecurity Conference,,,,"New York, NY, USA",,,,"Shujun Li, Kovila Coopamootoo, and Michael Sirivianos (Eds.). 2024. Proceedings of the 2024 European Interdisciplinary Cybersecurity Conference. Association for Computing Machinery, New York, NY, USA."
"Yan Kang, Tao Fan, Hanlin Gu, Xiaojin Zhang, Lixin Fan, and Qiang Yang",2025,Grounding Foundation Models through Federated Transfer Learning: A General Framework,ACM Trans,,96,,10.1145/3742788,https://doi.org/10.1145/3742788,framework,"Yan Kang, Tao Fan, Hanlin Gu, Xiaojin Zhang, Lixin Fan, and Qiang Yang. 2025. Grounding Foundation Models through Federated Transfer Learning: A General Framework. ACM Trans. Intell. Syst. Technol. 16, 4, Article 96 (August 2025), 54 pages. https://doi.org/10.1145/3742788"
"Alessandra Calvi, Gianclaudio Malgieri, and Dimitris Kotzinos",2024,The unfair side of Privacy Enhancing Technologies: addressing the trade-offs between PETs and fairness,"the 2024 ACM Conference on Fairness, Accountability, and Transparency (FAccT '24)",2047–2059,,"New York, NY, USA, 2047–2059",10.1145/3630106.3659024,https://doi.org/10.1145/3630106.3659024,,"Alessandra Calvi, Gianclaudio Malgieri, and Dimitris Kotzinos. 2024. The unfair side of Privacy Enhancing Technologies: addressing the trade-offs between PETs and fairness. In Proceedings of the 2024 ACM Conference on Fairness, Accountability, and Transparency (FAccT '24). Association for Computing Machinery, New York, NY, USA, 2047–2059. https://doi.org/10.1145/3630106.3659024"
Junliang Luo and Xue Liu,2025,Optimizing Blockchain Analysis: Tackling Temporality and Scalability with an Incremental Approach with Metropolis-Hastings Random Walks,the Eighteenth ACM International Conference on Web Search and Data Mining (WSDM '25),410–418,,"New York, NY, USA, 410–418",10.1145/3701551.3703521,https://doi.org/10.1145/3701551.3703521,,"Junliang Luo and Xue Liu. 2025. Optimizing Blockchain Analysis: Tackling Temporality and Scalability with an Incremental Approach with Metropolis-Hastings Random Walks. In Proceedings of the Eighteenth ACM International Conference on Web Search and Data Mining (WSDM '25). Association for Computing Machinery, New York, NY, USA, 410–418. https://doi.org/10.1145/3701551.3703521"
"Xiangrong Zhu, Guangyao Li, and Wei Hu",2023,Heterogeneous Federated Knowledge Graph Embedding Learning and Unlearning,the ACM Web Conference 2023 (WWW '23),2444–2454,,"New York, NY, USA, 2444–2454",10.1145/3543507.3583305,https://doi.org/10.1145/3543507.3583305,unlearning,"Xiangrong Zhu, Guangyao Li, and Wei Hu. 2023. Heterogeneous Federated Knowledge Graph Embedding Learning and Unlearning. In Proceedings of the ACM Web Conference 2023 (WWW '23). Association for Computing Machinery, New York, NY, USA, 2444–2454. https://doi.org/10.1145/3543507.3583305"
,,,,,,"New York, NY, USA",,,,"2025. Proceedings of the 26th International Middleware Conference. Association for Computing Machinery, New York, NY, USA."
"Ashish Mishra, Gyanaranjan Nayak, Suparna Bhattacharya, Tarun Kumar, Arpit Shah, and Martin Foltin",2024,LLM-Guided Counterfactual Data Generation for Fairer AI,ACM Web Conference 2024 (WWW '24),1538–1545,,"New York, NY, USA, 1538–1545",10.1145/3589335.3651929,https://doi.org/10.1145/3589335.3651929,,"Ashish Mishra, Gyanaranjan Nayak, Suparna Bhattacharya, Tarun Kumar, Arpit Shah, and Martin Foltin. 2024. LLM-Guided Counterfactual Data Generation for Fairer AI. In Companion Proceedings of the ACM Web Conference 2024 (WWW '24). Association for Computing Machinery, New York, NY, USA, 1538–1545. https://doi.org/10.1145/3589335.3651929"
"Fabio Pinelli, Gabriele Tolomei, and Giovanni Trappolini",2023,FLIRT: Federated Learning for Information Retrieval,the 46th International ACM SIGIR Conference on Research and Development in Information Retrieval (SIGIR '23),3472–3475,,"New York, NY, USA, 3472–3475",10.1145/3539618.3591926,https://doi.org/10.1145/3539618.3591926,,"Fabio Pinelli, Gabriele Tolomei, and Giovanni Trappolini. 2023. FLIRT: Federated Learning for Information Retrieval. In Proceedings of the 46th International ACM SIGIR Conference on Research and Development in Information Retrieval (SIGIR '23). Association for Computing Machinery, New York, NY, USA, 3472–3475. https://doi.org/10.1145/3539618.3591926"
"Francesco Zola, Xabier Echeberria, Jokin Petisco, Nikos Vakakis, Antonis Voulgaridis, and Kostantinos Votis",2025,KINAITICS: Enhancing Cybersecurity Education Using AI-Based Tools and Gamification,the 2024 16th International Conference on Education Technology and Computers (ICETC '24),138–147,,"New York, NY, USA, 138–147",10.1145/3702163.3702183,https://doi.org/10.1145/3702163.3702183,,"Francesco Zola, Xabier Echeberria, Jokin Petisco, Nikos Vakakis, Antonis Voulgaridis, and Kostantinos Votis. 2025. KINAITICS: Enhancing Cybersecurity Education Using AI-Based Tools and Gamification. In Proceedings of the 2024 16th International Conference on Education Technology and Computers (ICETC '24). Association for Computing Machinery, New York, NY, USA, 138–147. https://doi.org/10.1145/3702163.3702183"
"Wenpeng Xing, Minghao Li, Mohan Li, and Meng Han",2026,Towards Robust and Secure Embodied AI: A Survey on Vulnerabilities and Attacks,ACM Comput,,312,,10.1145/3806048,https://doi.org/10.1145/3806048,survey,"Wenpeng Xing, Minghao Li, Mohan Li, and Meng Han. 2026. Towards Robust and Secure Embodied AI: A Survey on Vulnerabilities and Attacks. ACM Comput. Surv. 58, 12, Article 312 (September 2026), 36 pages. https://doi.org/10.1145/3806048"
"Johnny Tian-Zheng Wei, Maggie Wang, Ameya Godbole, Jonathan Choi, and Robin Jia",2025,Interrogating LLM design under copyright law,"the 2025 ACM Conference on Fairness, Accountability, and Transparency (FAccT '25)",3030–3045,,"New York, NY, USA, 3030–3045",10.1145/3715275.3732193,https://doi.org/10.1145/3715275.3732193,,"Johnny Tian-Zheng Wei, Maggie Wang, Ameya Godbole, Jonathan Choi, and Robin Jia. 2025. Interrogating LLM design under copyright law. In Proceedings of the 2025 ACM Conference on Fairness, Accountability, and Transparency (FAccT '25). Association for Computing Machinery, New York, NY, USA, 3030–3045. https://doi.org/10.1145/3715275.3732193"
"Heesoo Jung, Chanyong Kim, Geonhee Han, and Hogun Park",2025,Harnessing Influence Function in Explaining Graph Neural Networks,the 31st ACM SIGKDD Conference on Knowledge Discovery and Data Mining V.2 (KDD '25),1106–1117,,"New York, NY, USA, 1106–1117",10.1145/3711896.3736995,https://doi.org/10.1145/3711896.3736995,,"Heesoo Jung, Chanyong Kim, Geonhee Han, and Hogun Park. 2025. Harnessing Influence Function in Explaining Graph Neural Networks. In Proceedings of the 31st ACM SIGKDD Conference on Knowledge Discovery and Data Mining V.2 (KDD '25). Association for Computing Machinery, New York, NY, USA, 1106–1117. https://doi.org/10.1145/3711896.3736995"
"Song Wang, Yaochen Zhu, Haochen Liu, Zaiyi Zheng, Chen Chen, and Jundong Li",2024,Knowledge Editing for Large Language Models: A Survey,ACM Comput,,59,,10.1145/3698590,https://doi.org/10.1145/3698590,survey,"Song Wang, Yaochen Zhu, Haochen Liu, Zaiyi Zheng, Chen Chen, and Jundong Li. 2024. Knowledge Editing for Large Language Models: A Survey. ACM Comput. Surv. 57, 3, Article 59 (March 2025), 37 pages. https://doi.org/10.1145/3698590"
Arijit Khan and Cuneyt Gurcan Akcora,2022,Graph-based Management and Mining of Blockchain Data,the 31st ACM International Conference on Information &amp; Knowledge Management (CIKM '22),5140–5143,,"New York, NY, USA, 5140–5143",10.1145/3511808.3557502,https://doi.org/10.1145/3511808.3557502,,"Arijit Khan and Cuneyt Gurcan Akcora. 2022. Graph-based Management and Mining of Blockchain Data. In Proceedings of the 31st ACM International Conference on Information &amp; Knowledge Management (CIKM '22). Association for Computing Machinery, New York, NY, USA, 5140–5143. https://doi.org/10.1145/3511808.3557502"
"SeungWon Jeong, Soyeon Woo, Daewon Chung, Simon S. Woo, and Youjin Shin",2024,Decomposed Attention Segment Recurrent Neural Network for Orbit Prediction,the 30th ACM SIGKDD Conference on Knowledge Discovery and Data Mining (KDD '24),5172–5182,,"New York, NY, USA, 5172–5182",10.1145/3637528.3671546,https://doi.org/10.1145/3637528.3671546,,"SeungWon Jeong, Soyeon Woo, Daewon Chung, Simon S. Woo, and Youjin Shin. 2024. Decomposed Attention Segment Recurrent Neural Network for Orbit Prediction. In Proceedings of the 30th ACM SIGKDD Conference on Knowledge Discovery and Data Mining (KDD '24). Association for Computing Machinery, New York, NY, USA, 5172–5182. https://doi.org/10.1145/3637528.3671546"
,,,,,,"New York, NY, USA",,,,"2023. Proceedings of the 24th International Middleware Conference: Demos, Posters and Doctoral Symposium. Association for Computing Machinery, New York, NY, USA."
"Julia Stoyanovich, Serge Abiteboul, Bill Howe, H. V. Jagadish, and Sebastian Schelter",2022,Responsible data management,"ACM 65, 6 (June 2022), 64–74",64–74,,,10.1145/3488717,https://doi.org/10.1145/3488717,,"Julia Stoyanovich, Serge Abiteboul, Bill Howe, H. V. Jagadish, and Sebastian Schelter. 2022. Responsible data management. Commun. ACM 65, 6 (June 2022), 64–74. https://doi.org/10.1145/3488717"
"Poupak Azad, Cuneyt Gurcan Akcora, and Arijit Khan",2025,Machine Learning for Blockchain Data Analysis: Progress and Opportunities,,,10,,10.1145/3728474,https://doi.org/10.1145/3728474,,"Poupak Azad, Cuneyt Gurcan Akcora, and Arijit Khan. 2025. Machine Learning for Blockchain Data Analysis: Progress and Opportunities. Distrib. Ledger Technol. 5, 1, Article 10 (March 2026), 27 pages. https://doi.org/10.1145/3728474"
,,,ACM Workshop on Artificial Intelligence and Security,,,"New York, NY, USA",,,,"2025. Proceedings of the 18th ACM Workshop on Artificial Intelligence and Security. Association for Computing Machinery, New York, NY, USA."
"Hao Wang, Zhichao Chen, Honglei Zhang, Zhengnan Li, Licheng Pan, Haoxuan Li, and Mingming Gong",2025,Debiased Recommendation via Wasserstein Causal Balancing,ACM Trans,,145,,10.1145/3725731,https://doi.org/10.1145/3725731,,"Hao Wang, Zhichao Chen, Honglei Zhang, Zhengnan Li, Licheng Pan, Haoxuan Li, and Mingming Gong. 2025. Debiased Recommendation via Wasserstein Causal Balancing. ACM Trans. Inf. Syst. 43, 6, Article 145 (November 2025), 24 pages. https://doi.org/10.1145/3725731"
"Vu Tuan Truong, Luan Ba Dang, and Long Bao Le",2025,Attacks and Defenses for Generative Diffusion Models: A Comprehensive Survey,ACM Comput,,216,,10.1145/3721479,https://doi.org/10.1145/3721479,survey,"Vu Tuan Truong, Luan Ba Dang, and Long Bao Le. 2025. Attacks and Defenses for Generative Diffusion Models: A Comprehensive Survey. ACM Comput. Surv. 57, 8, Article 216 (August 2025), 44 pages. https://doi.org/10.1145/3721479"
"Luis Ibanez-Lissen, Jose Maria De Fuentes, Lorena Gonzalez-Manzano, and Nicolas Anciaux",2024,Continuous Authentication Leveraging Matrix Profile,"the 19th International Conference on Availability, Reliability and Security (ARES '24)",1–13,7,"New York, NY, USA, Article 7, 1–13",10.1145/3664476.3664481,https://doi.org/10.1145/3664476.3664481,,"Luis Ibanez-Lissen, Jose Maria De Fuentes, Lorena Gonzalez-Manzano, and Nicolas Anciaux. 2024. Continuous Authentication Leveraging Matrix Profile. In Proceedings of the 19th International Conference on Availability, Reliability and Security (ARES '24). Association for Computing Machinery, New York, NY, USA, Article 7, 1–13. https://doi.org/10.1145/3664476.3664481"
"Alexandra Sasha Luccioni, Frances Corry, Hamsini Sridharan, Mike Ananny, Jason Schultz, and Kate Crawford",2022,"A Framework for Deprecating Datasets: Standardizing Documentation, Identification, and Communication","the 2022 ACM Conference on Fairness, Accountability, and Transparency (FAccT '22)",199–212,,"New York, NY, USA, 199–212",10.1145/3531146.3533086,https://doi.org/10.1145/3531146.3533086,framework,"Alexandra Sasha Luccioni, Frances Corry, Hamsini Sridharan, Mike Ananny, Jason Schultz, and Kate Crawford. 2022. A Framework for Deprecating Datasets: Standardizing Documentation, Identification, and Communication. In Proceedings of the 2022 ACM Conference on Fairness, Accountability, and Transparency (FAccT '22). Association for Computing Machinery, New York, NY, USA, 199–212. https://doi.org/10.1145/3531146.3533086"
"Enneng Yang, Li Shen, Guibing Guo, Xingwei Wang, Xiaochun Cao, Jie Zhang, and Dacheng Tao",2026,"Model Merging in LLMs, MLLMs, and Beyond: Methods, Theories, Applications, and Opportunities",ACM Comput,,216,,10.1145/3787849,https://doi.org/10.1145/3787849,,"Enneng Yang, Li Shen, Guibing Guo, Xingwei Wang, Xiaochun Cao, Jie Zhang, and Dacheng Tao. 2026. Model Merging in LLMs, MLLMs, and Beyond: Methods, Theories, Applications, and Opportunities. ACM Comput. Surv. 58, 8, Article 216 (June 2026), 41 pages. https://doi.org/10.1145/3787849"
"Xiaoyong (Brian) Yuan, Xiaolong Ma, Linke Guo, and Lan Zhang",2025,What Lurks Within? Concept Auditing for Shared Diffusion Models at Scale,the 2025 ACM SIGSAC Conference on Computer and Communications Security (CCS '25),4154–4168,,"New York, NY, USA, 4154–4168",10.1145/3719027.3765052,https://doi.org/10.1145/3719027.3765052,,"Xiaoyong (Brian) Yuan, Xiaolong Ma, Linke Guo, and Lan Zhang. 2025. What Lurks Within? Concept Auditing for Shared Diffusion Models at Scale. In Proceedings of the 2025 ACM SIGSAC Conference on Computer and Communications Security (CCS '25). Association for Computing Machinery, New York, NY, USA, 4154–4168. https://doi.org/10.1145/3719027.3765052"
Zitao Chen and Karthik Pattabiraman,2025,Anonymity Unveiled: A Practical Framework for Auditing Data Use in Deep Learning Models,the 2025 ACM SIGSAC Conference on Computer and Communications Security (CCS '25),513–527,,"New York, NY, USA, 513–527",10.1145/3719027.3744794,https://doi.org/10.1145/3719027.3744794,framework,"Zitao Chen and Karthik Pattabiraman. 2025. Anonymity Unveiled: A Practical Framework for Auditing Data Use in Deep Learning Models. In Proceedings of the 2025 ACM SIGSAC Conference on Computer and Communications Security (CCS '25). Association for Computing Machinery, New York, NY, USA, 513–527. https://doi.org/10.1145/3719027.3744794"
"Weibin Wu, Haoxuan Hu, Zhaoji Fan, Yitong Qiao, Yizhan Huang, Yichen Li, Zibin Zheng, and Michael Lyu",2025,An Empirical Study of Code Clones from Commercial AI Code Generators,ACM Softw,,FSE127,,10.1145/3729397,https://doi.org/10.1145/3729397,,"Weibin Wu, Haoxuan Hu, Zhaoji Fan, Yitong Qiao, Yizhan Huang, Yichen Li, Zibin Zheng, and Michael Lyu. 2025. An Empirical Study of Code Clones from Commercial AI Code Generators. Proc. ACM Softw. Eng. 2, FSE, Article FSE127 (July 2025), 23 pages. https://doi.org/10.1145/3729397"
"Zhongcheng Wei, Wei Chen, Shuli Ning, Weidong Lin, Nan Li, Bin Lian, Xiang Sun, and Jijun Zhao",2025,"A Survey on WiFi-based Human Identification: Scenarios, Challenges, and Current Solutions",ACM Trans,,10,,10.1145/3708323,https://doi.org/10.1145/3708323,survey,"Zhongcheng Wei, Wei Chen, Shuli Ning, Weidong Lin, Nan Li, Bin Lian, Xiang Sun, and Jijun Zhao. 2025. A Survey on WiFi-based Human Identification: Scenarios, Challenges, and Current Solutions. ACM Trans. Sen. Netw. 21, 1, Article 10 (January 2025), 32 pages. https://doi.org/10.1145/3708323"
"Romila Pradhan, Jiongli Zhu, Boris Glavic, and Babak Salimi",2022,Interpretable Data-Based Explanations for Fairness Debugging,the 2022 International Conference on Management of Data (SIGMOD '22),247–261,,"New York, NY, USA, 247–261",10.1145/3514221.3517886,https://doi.org/10.1145/3514221.3517886,,"Romila Pradhan, Jiongli Zhu, Boris Glavic, and Babak Salimi. 2022. Interpretable Data-Based Explanations for Fairness Debugging. In Proceedings of the 2022 International Conference on Management of Data (SIGMOD '22). Association for Computing Machinery, New York, NY, USA, 247–261. https://doi.org/10.1145/3514221.3517886"
"Md Tamjid Hossain, Hung La, and Shahriar Badsha",2024,RAMPART: Reinforcing Autonomous Multi-Agent Protection through Adversarial Resistance in Transportation,ACM J,,21,,10.1145/3643137,https://doi.org/10.1145/3643137,,"Md Tamjid Hossain, Hung La, and Shahriar Badsha. 2024. RAMPART: Reinforcing Autonomous Multi-Agent Protection through Adversarial Resistance in Transportation. ACM J. Auton. Transport. Syst. 1, 4, Article 21 (December 2024), 25 pages. https://doi.org/10.1145/3643137"
"Gian Alix, Arian Haghparast, and Manos Papagelis",2026,PathletRL++: Optimizing Trajectory Pathlet Extraction and Dictionary Formation via Reinforcement Learning,ACM Trans,,7,,10.1145/3801963,https://doi.org/10.1145/3801963,,"Gian Alix, Arian Haghparast, and Manos Papagelis. 2026. PathletRL++: Optimizing Trajectory Pathlet Extraction and Dictionary Formation via Reinforcement Learning. ACM Trans. Spatial Algorithms Syst. 12, 2, Article 7 (June 2026), 37 pages. https://doi.org/10.1145/3801963"
"Zhuo Cai, Shoujin Wang, Peilin Zhou, Yan Wang, Xiao Liu, Lianyong Qi, Julian McAuley, and Dietmar Jannach",2026,Misinformation Unlearning for Responsible Content Recommendation,ACM Trans,,,,10.1145/3812649,https://doi.org/10.1145/3812649,unlearning,"Zhuo Cai, Shoujin Wang, Peilin Zhou, Yan Wang, Xiao Liu, Lianyong Qi, Julian McAuley, and Dietmar Jannach. 2026. Misinformation Unlearning for Responsible Content Recommendation. ACM Trans. Inf. Syst. Just Accepted (April 2026). https://doi.org/10.1145/3812649"
"Haizhou Shi, Zihao Xu, Hengyi Wang, Weiyi Qin, Wenyuan Wang, Yibin Wang, Zifeng Wang, Sayna Ebrahimi, and Hao Wang",2025,Continual Learning of Large Language Models: A Comprehensive Survey,ACM Comput,,120,,10.1145/3735633,https://doi.org/10.1145/3735633,survey,"Haizhou Shi, Zihao Xu, Hengyi Wang, Weiyi Qin, Wenyuan Wang, Yibin Wang, Zifeng Wang, Sayna Ebrahimi, and Hao Wang. 2025. Continual Learning of Large Language Models: A Comprehensive Survey. ACM Comput. Surv. 58, 5, Article 120 (April 2026), 42 pages. https://doi.org/10.1145/3735633"
