authors,Year,title,venue,pages,article,publisher_location,doi,doi_url,category,raw_entry
"Sebastian Schelter, Mozhdeh Ariannezhad, and Maarten de Rijke",2023,Forget Me Now: Fast and Exact Unlearning in Neighborhood-based Recommendation,the 46th International ACM SIGIR Conference on Research and Development in Information Retrieval (SIGIR '23),2011–2015,,"New York, NY, USA, 2011–2015",10.1145/3539618.3591989,https://doi.org/10.1145/3539618.3591989,unlearning,"Sebastian Schelter, Mozhdeh Ariannezhad, and Maarten de Rijke. 2023. Forget Me Now: Fast and Exact Unlearning in Neighborhood-based Recommendation. In Proceedings of the 46th International ACM SIGIR Conference on Research and Development in Information Retrieval (SIGIR '23). Association for Computing Machinery, New York, NY, USA, 2011–2015. https://doi.org/10.1145/3539618.3591989"
"Junxiao Wang, Song Guo, Xin Xie, and Heng Qi",2022,Federated Unlearning via Class-Discriminative Pruning,the ACM Web Conference 2022 (WWW '22),622–632,,"New York, NY, USA, 622–632",10.1145/3485447.3512222,https://doi.org/10.1145/3485447.3512222,unlearning,"Junxiao Wang, Song Guo, Xin Xie, and Heng Qi. 2022. Federated Unlearning via Class-Discriminative Pruning. In Proceedings of the ACM Web Conference 2022 (WWW '22). Association for Computing Machinery, New York, NY, USA, 622–632. https://doi.org/10.1145/3485447.3512222"
"Ziyao Liu, Yu Jiang, Jiyuan Shen, Minyi Peng, Kwok-Yan Lam, Xingliang Yuan, and Xiaoning Liu",2024,"A Survey on Federated Unlearning: Challenges, Methods, and Future Directions",ACM Comput,,2,,10.1145/3679014,https://doi.org/10.1145/3679014,survey,"Ziyao Liu, Yu Jiang, Jiyuan Shen, Minyi Peng, Kwok-Yan Lam, Xingliang Yuan, and Xiaoning Liu. 2024. A Survey on Federated Unlearning: Challenges, Methods, and Future Directions. ACM Comput. Surv. 57, 1, Article 2 (January 2025), 38 pages. https://doi.org/10.1145/3679014"
"Samaneh Mohammadi, Vasileios Tsouvalas, Iraklis Symeonidis, Ali Balador, Tanir Ozcelebi, Francesco Flammini, and Nirvana Meratnia",2025,EFU: Enforcing Federated Unlearning via Functional Encryption,the 34th ACM International Conference on Information and Knowledge Management (CIKM '25),2148–2158,,"New York, NY, USA, 2148–2158",10.1145/3746252.3761091,https://doi.org/10.1145/3746252.3761091,unlearning,"Samaneh Mohammadi, Vasileios Tsouvalas, Iraklis Symeonidis, Ali Balador, Tanir Ozcelebi, Francesco Flammini, and Nirvana Meratnia. 2025. EFU: Enforcing Federated Unlearning via Functional Encryption. In Proceedings of the 34th ACM International Conference on Information and Knowledge Management (CIKM '25). Association for Computing Machinery, New York, NY, USA, 2148–2158. https://doi.org/10.1145/3746252.3761091"
"Jorn Bach, Alexander Grohsjean, Christian Schwanenberger, and Peer Stelldinger",2025,Unlearning with Partial Label Learning,the 18th ACM International Conference on PErvasive Technologies Related to Assistive Environments (PETRA '25),175–181,,"New York, NY, USA, 175–181",10.1145/3733155.3733201,https://doi.org/10.1145/3733155.3733201,unlearning,"Jorn Bach, Alexander Grohsjean, Christian Schwanenberger, and Peer Stelldinger. 2025. Unlearning with Partial Label Learning. In Proceedings of the 18th ACM International Conference on PErvasive Technologies Related to Assistive Environments (PETRA '25). Association for Computing Machinery, New York, NY, USA, 175–181. https://doi.org/10.1145/3733155.3733201"
"Jin Li, Huilin Gu, Shoujin Wang, Qi Zhang, Shui Yu, Chen Wang, Xiwei Xu, and Fang Chen",2026,Towards Fair Large Language Model-based Recommender Systems without Costly Retraining,the ACM Web Conference 2026 (WWW '26),9675–9686,,"New York, NY, USA, 9675–9686",10.1145/3774904.3793052,https://doi.org/10.1145/3774904.3793052,,"Jin Li, Huilin Gu, Shoujin Wang, Qi Zhang, Shui Yu, Chen Wang, Xiwei Xu, and Fang Chen. 2026. Towards Fair Large Language Model-based Recommender Systems without Costly Retraining. In Proceedings of the ACM Web Conference 2026 (WWW '26). Association for Computing Machinery, New York, NY, USA, 9675–9686. https://doi.org/10.1145/3774904.3793052"
"Yang Xiao, Ruimeng Ye, Bohan Liu, Xiaolong Ma, and Bo Hui",2025,Efficient Knowledge Graph Unlearning with Zeroth-order Information,the 34th ACM International Conference on Information and Knowledge Management (CIKM '25),3509–3519,,"New York, NY, USA, 3509–3519",10.1145/3746252.3761379,https://doi.org/10.1145/3746252.3761379,unlearning,"Yang Xiao, Ruimeng Ye, Bohan Liu, Xiaolong Ma, and Bo Hui. 2025. Efficient Knowledge Graph Unlearning with Zeroth-order Information. In Proceedings of the 34th ACM International Conference on Information and Knowledge Management (CIKM '25). Association for Computing Machinery, New York, NY, USA, 3509–3519. https://doi.org/10.1145/3746252.3761379"
"Zhiqi Wang, Chengyu Zhang, Yuetian Chen, Nathalie Baracaldo, Swanand R Kadhe, and Lei Yu",2025,"Membership Inference Attacks as Privacy Tools: Reliability, Disparity and Ensemble",the 2025 ACM SIGSAC Conference on Computer and Communications Security (CCS '25),1724–1738,,"New York, NY, USA, 1724–1738",10.1145/3719027.3744818,https://doi.org/10.1145/3719027.3744818,,"Zhiqi Wang, Chengyu Zhang, Yuetian Chen, Nathalie Baracaldo, Swanand R Kadhe, and Lei Yu. 2025. Membership Inference Attacks as Privacy Tools: Reliability, Disparity and Ensemble. In Proceedings of the 2025 ACM SIGSAC Conference on Computer and Communications Security (CCS '25). Association for Computing Machinery, New York, NY, USA, 1724–1738. https://doi.org/10.1145/3719027.3744818"
"Wei Qian, Chenxu Zhao, Wei Le, Meiyi Ma, and Mengdi Huai",2023,Towards Understanding and Enhancing Robustness of Deep Learning Models against Malicious Unlearning Attacks,the 29th ACM SIGKDD Conference on Knowledge Discovery and Data Mining (KDD '23),1932–1942,,"New York, NY, USA, 1932–1942",10.1145/3580305.3599526,https://doi.org/10.1145/3580305.3599526,unlearning,"Wei Qian, Chenxu Zhao, Wei Le, Meiyi Ma, and Mengdi Huai. 2023. Towards Understanding and Enhancing Robustness of Deep Learning Models against Malicious Unlearning Attacks. In Proceedings of the 29th ACM SIGKDD Conference on Knowledge Discovery and Data Mining (KDD '23). Association for Computing Machinery, New York, NY, USA, 1932–1942. https://doi.org/10.1145/3580305.3599526"
"Yarden Gabbay, Haoquan Guan, Shaull Almagor, El Kindi Rezig, Brit Youngmann, and Babak Salimi",2026,Stress-Testing Causal Claims via Cardinality Repairs,ACM Manag,,86,,10.1145/3786700,https://doi.org/10.1145/3786700,,"Yarden Gabbay, Haoquan Guan, Shaull Almagor, El Kindi Rezig, Brit Youngmann, and Babak Salimi. 2026. Stress-Testing Causal Claims via Cardinality Repairs. Proc. ACM Manag. Data 4, 1, Article 86 (February 2026), 24 pages. https://doi.org/10.1145/3786700"
"Zhifeng Kong, Amrita Roy Chowdhury, and Kamalika Chaudhuri",2022,Forgeability and Membership Inference Attacks,the 15th ACM Workshop on Artificial Intelligence and Security (AISec'22),25–31,,"New York, NY, USA, 25–31",10.1145/3560830.3563731,https://doi.org/10.1145/3560830.3563731,,"Zhifeng Kong, Amrita Roy Chowdhury, and Kamalika Chaudhuri. 2022. Forgeability and Membership Inference Attacks. In Proceedings of the 15th ACM Workshop on Artificial Intelligence and Security (AISec'22). Association for Computing Machinery, New York, NY, USA, 25–31. https://doi.org/10.1145/3560830.3563731"
"Yinzhi Cao, Alexander Fangxiao Yu, Andrew Aday, Eric Stahl, Jon Merwine, and Junfeng Yang",2018,Efficient Repair of Polluted Machine Learning Systems via Causal Unlearning,the 2018 on Asia Conference on Computer and Communications Security (ASIACCS '18),735–747,,"New York, NY, USA, 735–747",10.1145/3196494.3196517,https://doi.org/10.1145/3196494.3196517,unlearning,"Yinzhi Cao, Alexander Fangxiao Yu, Andrew Aday, Eric Stahl, Jon Merwine, and Junfeng Yang. 2018. Efficient Repair of Polluted Machine Learning Systems via Causal Unlearning. In Proceedings of the 2018 on Asia Conference on Computer and Communications Security (ASIACCS '18). Association for Computing Machinery, New York, NY, USA, 735–747. https://doi.org/10.1145/3196494.3196517"
"Dawen Zhang, Boming Xia, Yue Liu, Xiwei Xu, Thong Hoang, Zhenchang Xing, Mark Staples, Qinghua Lu, and Liming Zhu",2024,Privacy and Copyright Protection in Generative AI: A Lifecycle Perspective,the IEEE/ACM 3rd International Conference on AI Engineering - Software Engineering for AI (CAIN '24),92–97,,"New York, NY, USA, 92–97",10.1145/3644815.3644952,https://doi.org/10.1145/3644815.3644952,,"Dawen Zhang, Boming Xia, Yue Liu, Xiwei Xu, Thong Hoang, Zhenchang Xing, Mark Staples, Qinghua Lu, and Liming Zhu. 2024. Privacy and Copyright Protection in Generative AI: A Lifecycle Perspective. In Proceedings of the IEEE/ACM 3rd International Conference on AI Engineering - Software Engineering for AI (CAIN '24). Association for Computing Machinery, New York, NY, USA, 92–97. https://doi.org/10.1145/3644815.3644952"
"Yongjing Hao, Fuzhen Zhuang, Deqing Wang, Guanfeng Liu, Victor S. Sheng, and Pengpeng Zhao",2024,A General Strategy Graph Collaborative Filtering for Recommendation Unlearning,the 33rd ACM International Conference on Information and Knowledge Management (CIKM '24),799–808,,"New York, NY, USA, 799–808",10.1145/3627673.3679637,https://doi.org/10.1145/3627673.3679637,unlearning,"Yongjing Hao, Fuzhen Zhuang, Deqing Wang, Guanfeng Liu, Victor S. Sheng, and Pengpeng Zhao. 2024. A General Strategy Graph Collaborative Filtering for Recommendation Unlearning. In Proceedings of the 33rd ACM International Conference on Information and Knowledge Management (CIKM '24). Association for Computing Machinery, New York, NY, USA, 799–808. https://doi.org/10.1145/3627673.3679637"
"Alyssa Shuang Sha, Bernardo Nunes, and Armin Haller",2026,Selective Forgetting in Machine Learning and Beyond: A Survey,ACM Comput,,241,,10.1145/3796542,https://doi.org/10.1145/3796542,survey,"Alyssa Shuang Sha, Bernardo Nunes, and Armin Haller. 2026. Selective Forgetting in Machine Learning and Beyond: A Survey. ACM Comput. Surv. 58, 9, Article 241 (July 2026), 41 pages. https://doi.org/10.1145/3796542"
"Kun Wu, Jie Shen, Yue Ning, Ting Wang, and Wendy Hui Wang",2023,Certified Edge Unlearning for Graph Neural Networks,the 29th ACM SIGKDD Conference on Knowledge Discovery and Data Mining (KDD '23),2606–2617,,"New York, NY, USA, 2606–2617",10.1145/3580305.3599271,https://doi.org/10.1145/3580305.3599271,unlearning,"Kun Wu, Jie Shen, Yue Ning, Ting Wang, and Wendy Hui Wang. 2023. Certified Edge Unlearning for Graph Neural Networks. In Proceedings of the 29th ACM SIGKDD Conference on Knowledge Discovery and Data Mining (KDD '23). Association for Computing Machinery, New York, NY, USA, 2606–2617. https://doi.org/10.1145/3580305.3599271"
"Jiancan Wu, Yi Yang, Yuchun Qian, Yongduo Sui, Xiang Wang, and Xiangnan He",2023,GIF: A General Graph Unlearning Strategy via Influence Function,the ACM Web Conference 2023 (WWW '23),651–661,,"New York, NY, USA, 651–661",10.1145/3543507.3583521,https://doi.org/10.1145/3543507.3583521,unlearning,"Jiancan Wu, Yi Yang, Yuchun Qian, Yongduo Sui, Xiang Wang, and Xiangnan He. 2023. GIF: A General Graph Unlearning Strategy via Influence Function. In Proceedings of the ACM Web Conference 2023 (WWW '23). Association for Computing Machinery, New York, NY, USA, 651–661. https://doi.org/10.1145/3543507.3583521"
"Zhipeng Yin, Zichong Wang, Avash Palikhe, and Wenbin Zhang",2025,Uncertain Boundaries: A Tutorial on Copyright Challenges and Cross-Disciplinary Solutions for Generative AI,the 34th ACM International Conference on Information and Knowledge Management (CIKM '25),6853–6856,,"New York, NY, USA, 6853–6856",10.1145/3746252.3761450,https://doi.org/10.1145/3746252.3761450,,"Zhipeng Yin, Zichong Wang, Avash Palikhe, and Wenbin Zhang. 2025. Uncertain Boundaries: A Tutorial on Copyright Challenges and Cross-Disciplinary Solutions for Generative AI. In Proceedings of the 34th ACM International Conference on Information and Knowledge Management (CIKM '25). Association for Computing Machinery, New York, NY, USA, 6853–6856. https://doi.org/10.1145/3746252.3761450"
"Yi Li, Debo Cheng, Guixian Zhang, Chengyu Li, and Shichao Zhang",2026,Graph Unlearning System with Subgraph De-Isolation Measures,ACM Trans,,9,,10.1145/3750734,https://doi.org/10.1145/3750734,unlearning,"Yi Li, Debo Cheng, Guixian Zhang, Chengyu Li, and Shichao Zhang. 2026. Graph Unlearning System with Subgraph De-Isolation Measures. ACM Trans. Auton. Adapt. Syst. 21, 1, Article 9 (March 2026), 25 pages. https://doi.org/10.1145/3750734"
"Gregory Blanc, Takeshi Takahashi, and Zonghua Zhang",2025,ARTMAN '25: Third Workshop on Recent Advances in Resilient and Trustworthy MAchine learning-driveN systems,the 2025 ACM SIGSAC Conference on Computer and Communications Security (CCS '25),4894–4895,,"New York, NY, USA, 4894–4895",10.1145/3719027.3767660,https://doi.org/10.1145/3719027.3767660,,"Gregory Blanc, Takeshi Takahashi, and Zonghua Zhang. 2025. ARTMAN '25: Third Workshop on Recent Advances in Resilient and Trustworthy MAchine learning-driveN systems. In Proceedings of the 2025 ACM SIGSAC Conference on Computer and Communications Security (CCS '25). Association for Computing Machinery, New York, NY, USA, 4894–4895. https://doi.org/10.1145/3719027.3767660"
"Shang Wang, Tianqing Zhu, Bo Liu, Ming Ding, Dayong Ye, Wanlei Zhou, and Philip Yu",2025,Unique Security and Privacy Threats of Large Language Models: A Comprehensive Survey,ACM Comput,,83,,10.1145/3764113,https://doi.org/10.1145/3764113,survey,"Shang Wang, Tianqing Zhu, Bo Liu, Ming Ding, Dayong Ye, Wanlei Zhou, and Philip Yu. 2025. Unique Security and Privacy Threats of Large Language Models: A Comprehensive Survey. ACM Comput. Surv. 58, 4, Article 83 (March 2026), 36 pages. https://doi.org/10.1145/3764113"
"Kai Zhang, Congchao Wang, Liqian Peng, Alec Go, and Xiaozhong Liu",2026,Privacy-preserved LLM Cascade via CoT-enhanced Policy Learning,the Nineteenth ACM International Conference on Web Search and Data Mining (WSDM '26),955–964,,"New York, NY, USA, 955–964",10.1145/3773966.3777920,https://doi.org/10.1145/3773966.3777920,,"Kai Zhang, Congchao Wang, Liqian Peng, Alec Go, and Xiaozhong Liu. 2026. Privacy-preserved LLM Cascade via CoT-enhanced Policy Learning. In Proceedings of the Nineteenth ACM International Conference on Web Search and Data Mining (WSDM '26). Association for Computing Machinery, New York, NY, USA, 955–964. https://doi.org/10.1145/3773966.3777920"
"Ignacio Marco-P\'{e}rez, Beatriz P\'{e}rez, Angel Luis Rubio Garcia, and Mar\'{\i}a A. Zapata",2026,The Many Faces of Data Deletion: On the Significance and Implications of Deleting Data,ACM Comput,,174,,10.1145/3779299,https://doi.org/10.1145/3779299,,"Ignacio Marco-P\'{e}rez, Beatriz P\'{e}rez, Angel Luis Rubio Garcia, and Mar\'{\i}a A. Zapata. 2026. The Many Faces of Data Deletion: On the Significance and Implications of Deleting Data. ACM Comput. Surv. 58, 7, Article 174 (May 2026), 31 pages. https://doi.org/10.1145/3779299"
"Xiongfei Wu, Mingfei Cheng, Xiaoning Ren, Qiang Hu, Jianlang Chen, Yuheng Huang, Maxime Cordy, Yao Zhang, Xiaofei Xie, Lei Ma, and Yves Le Traon",2026,Foundation Models for Autonomous Driving Systems: An Initial Roadmap,ACM Trans,,,,10.1145/3807455,https://doi.org/10.1145/3807455,,"Xiongfei Wu, Mingfei Cheng, Xiaoning Ren, Qiang Hu, Jianlang Chen, Yuheng Huang, Maxime Cordy, Yao Zhang, Xiaofei Xie, Lei Ma, and Yves Le Traon. 2026. Foundation Models for Autonomous Driving Systems: An Initial Roadmap. ACM Trans. Softw. Eng. Methodol. Just Accepted (April 2026). https://doi.org/10.1145/3807455"
"Jiawei Wang, Zilong Zhao, Leonardo Aniello, and Han Wu",2026,Peeling the Layers of Privacy-Utility Onion on Tabular Data,the Sixth European Workshop on Machine Learning and Systems (EuroMLSys '26),139–146,,"New York, NY, USA, 139–146",10.1145/3805621.3807630,https://doi.org/10.1145/3805621.3807630,,"Jiawei Wang, Zilong Zhao, Leonardo Aniello, and Han Wu. 2026. Peeling the Layers of Privacy-Utility Onion on Tabular Data. In Proceedings of the Sixth European Workshop on Machine Learning and Systems (EuroMLSys '26). Association for Computing Machinery, New York, NY, USA, 139–146. https://doi.org/10.1145/3805621.3807630"
"Archer Amon, Zhipeng Yin, Zichong Wang, Avash Palikhe, Tongjia Yu, and Wenbin Zhang",2026,Uncertain Boundaries: Multidisciplinary Approaches to Copyright Issues in Generative AI,,1–12,,,10.1145/3787470.3787472,https://doi.org/10.1145/3787470.3787472,,"Archer Amon, Zhipeng Yin, Zichong Wang, Avash Palikhe, Tongjia Yu, and Wenbin Zhang. 2026. Uncertain Boundaries: Multidisciplinary Approaches to Copyright Issues in Generative AI. SIGKDD Explor. Newsl. 27, 2 (December 2025), 1–12. https://doi.org/10.1145/3787470.3787472"
"Jiaheng Wei, Yanjun Zhang, Leo Yu Zhang, Ming Ding, Chao Chen, Kok-Leong Ong, Jun Zhang, and Yang Xiang",2025,Memorization in Deep Learning: A Survey,ACM Comput,,98,,10.1145/3769076,https://doi.org/10.1145/3769076,survey,"Jiaheng Wei, Yanjun Zhang, Leo Yu Zhang, Ming Ding, Chao Chen, Kok-Leong Ong, Jun Zhang, and Yang Xiang. 2025. Memorization in Deep Learning: A Survey. ACM Comput. Surv. 58, 4, Article 98 (March 2026), 35 pages. https://doi.org/10.1145/3769076"
"Chaochao Chen, Yizhao Zhang, Yuyuan Li, Jun Wang, Lianyong Qi, Xiaolong Xu, Xiaolin Zheng, and Jianwei Yin",2024,Post-Training Attribute Unlearning in Recommender Systems,ACM Trans,,25,,10.1145/3701987,https://doi.org/10.1145/3701987,unlearning,"Chaochao Chen, Yizhao Zhang, Yuyuan Li, Jun Wang, Lianyong Qi, Xiaolong Xu, Xiaolin Zheng, and Jianwei Yin. 2024. Post-Training Attribute Unlearning in Recommender Systems. ACM Trans. Inf. Syst. 43, 1, Article 25 (January 2025), 28 pages. https://doi.org/10.1145/3701987"
Ivan Visconti,2024,The Right to Be Zero-Knowledge Forgotten,"the 19th International Conference on Availability, Reliability and Security (ARES '24)",1–9,110,"New York, NY, USA, Article 110, 1–9",10.1145/3664476.3669973,https://doi.org/10.1145/3664476.3669973,,"Ivan Visconti. 2024. The Right to Be Zero-Knowledge Forgotten. In Proceedings of the 19th International Conference on Availability, Reliability and Security (ARES '24). Association for Computing Machinery, New York, NY, USA, Article 110, 1–9. https://doi.org/10.1145/3664476.3669973"
Javier Mart\'{\i}nez Llamas,2023,Attacks and Defences for ML-enhanced Access Control,"the 24th International Middleware Conference: Demos, Posters and Doctoral Symposium (Middleware '23)",23–24,,"New York, NY, USA, 23–24",10.1145/3626564.3629102,https://doi.org/10.1145/3626564.3629102,,"Javier Mart\'{\i}nez Llamas. 2023. Attacks and Defences for ML-enhanced Access Control. In Proceedings of the 24th International Middleware Conference: Demos, Posters and Doctoral Symposium (Middleware '23). Association for Computing Machinery, New York, NY, USA, 23–24. https://doi.org/10.1145/3626564.3629102"
"Qinbin Li, Junyuan Hong, Chulin Xie, Jeffrey Tan, Rachel Xin, Junyi Hou, Xavier Yin, Zhun Wang, Dan Hendrycks, Zhangyang Wang, Bo Li, Bingsheng He, and Dawn Song",2024,LLM-PBE: Assessing Data Privacy in Large Language Models,,3201–3214,,,10.14778/3681954.3681994,https://doi.org/10.14778/3681954.3681994,,"Qinbin Li, Junyuan Hong, Chulin Xie, Jeffrey Tan, Rachel Xin, Junyi Hou, Xavier Yin, Zhun Wang, Dan Hendrycks, Zhangyang Wang, Bo Li, Bingsheng He, and Dawn Song. 2024. LLM-PBE: Assessing Data Privacy in Large Language Models. Proc. VLDB Endow. 17, 11 (July 2024), 3201–3214. https://doi.org/10.14778/3681954.3681994"
"Yizhou Dang, Yuting Liu, Enneng Yang, Guibing Guo, Linying Jiang, Jianzhe Zhao, and Xingwei Wang",2025,Efficient and Adaptive Recommendation Unlearning: A Guided Filtering Framework to Erase Outdated Preferences,ACM Trans,,49,,10.1145/3706633,https://doi.org/10.1145/3706633,framework,"Yizhou Dang, Yuting Liu, Enneng Yang, Guibing Guo, Linying Jiang, Jianzhe Zhao, and Xingwei Wang. 2025. Efficient and Adaptive Recommendation Unlearning: A Guided Filtering Framework to Erase Outdated Preferences. ACM Trans. Inf. Syst. 43, 2, Article 49 (March 2025), 25 pages. https://doi.org/10.1145/3706633"
"Moncef Gabbouj, Jin Li, Hu Haibo, and Yang Xiang",2025,Introduction to the Special Issue on AI Empowered Edge Computing for Multimedia Applications,ACM Trans,,214,,10.1145/3714421,https://doi.org/10.1145/3714421,,"Moncef Gabbouj, Jin Li, Hu Haibo, and Yang Xiang. 2025. Introduction to the Special Issue on AI Empowered Edge Computing for Multimedia Applications. ACM Trans. Multimedia Comput. Commun. Appl. 21, 8, Article 214 (August 2025), 3 pages. https://doi.org/10.1145/3714421"
"Zonghao Huang, Neil Zhenqiang Gong, and Michael K. Reiter",2024,A General Framework for Data-Use Auditing of ML Models,the 2024 on ACM SIGSAC Conference on Computer and Communications Security (CCS '24),1300–1314,,"New York, NY, USA, 1300–1314",10.1145/3658644.3690226,https://doi.org/10.1145/3658644.3690226,framework,"Zonghao Huang, Neil Zhenqiang Gong, and Michael K. Reiter. 2024. A General Framework for Data-Use Auditing of ML Models. In Proceedings of the 2024 on ACM SIGSAC Conference on Computer and Communications Security (CCS '24). Association for Computing Machinery, New York, NY, USA, 1300–1314. https://doi.org/10.1145/3658644.3690226"
"Baobao Song, Shiva Raj Pokhrel, Mengyue Deng, Qiujun Lan, Robin Ram Doss, Tianqing Zhu, and Gang Li",2025,Digital Privacy Under Attack: Challenges and Enablers,ACM Comput,,107,,10.1145/3770853,https://doi.org/10.1145/3770853,,"Baobao Song, Shiva Raj Pokhrel, Mengyue Deng, Qiujun Lan, Robin Ram Doss, Tianqing Zhu, and Gang Li. 2025. Digital Privacy Under Attack: Challenges and Enablers. ACM Comput. Surv. 58, 4, Article 107 (March 2026), 35 pages. https://doi.org/10.1145/3770853"
"Lea Demelius, Roman Kern, and Andreas Tr\""{u}gler",2025,Recent Advances of Differential Privacy in Centralized Deep Learning: A Systematic Survey,ACM Comput,,158,,10.1145/3712000,https://doi.org/10.1145/3712000,survey,"Lea Demelius, Roman Kern, and Andreas Tr\""{u}gler. 2025. Recent Advances of Differential Privacy in Centralized Deep Learning: A Systematic Survey. ACM Comput. Surv. 57, 6, Article 158 (June 2025), 28 pages. https://doi.org/10.1145/3712000"
"Yang Zhang, Zhiyu Hu, Yimeng Bai, Jiancan Wu, Qifan Wang, and Fuli Feng",2024,Recommendation Unlearning via Influence Function,ACM Trans,,22,,10.1145/3701763,https://doi.org/10.1145/3701763,unlearning,"Yang Zhang, Zhiyu Hu, Yimeng Bai, Jiancan Wu, Qifan Wang, and Fuli Feng. 2024. Recommendation Unlearning via Influence Function. ACM Trans. Recomm. Syst. 3, 2, Article 22 (June 2025), 23 pages. https://doi.org/10.1145/3701763"
"Xin Xin, Liu Yang, Ziqi Zhao, Pengjie Ren, Zhumin Chen, Jun Ma, and Zhaochun Ren",2024,On the Effectiveness of Unlearning in Session-Based Recommendation,the 17th ACM International Conference on Web Search and Data Mining (WSDM '24),855–863,,"New York, NY, USA, 855–863",10.1145/3616855.3635823,https://doi.org/10.1145/3616855.3635823,unlearning,"Xin Xin, Liu Yang, Ziqi Zhao, Pengjie Ren, Zhumin Chen, Jun Ma, and Zhaochun Ren. 2024. On the Effectiveness of Unlearning in Session-Based Recommendation. In Proceedings of the 17th ACM International Conference on Web Search and Data Mining (WSDM '24). Association for Computing Machinery, New York, NY, USA, 855–863. https://doi.org/10.1145/3616855.3635823"
Yuchen Xie,2026,Bio-Inspired LLMs Forgetting: Integrating Neuroscience and Computational Mechanisms,"the 2025 International Conference on Artificial Intelligence, Virtual Reality and Interaction Design (AIVRID '25)",153–161,,"New York, NY, USA, 153–161",10.1145/3777730.3777756,https://doi.org/10.1145/3777730.3777756,,"Yuchen Xie. 2026. Bio-Inspired LLMs Forgetting: Integrating Neuroscience and Computational Mechanisms. In Proceedings of the 2025 International Conference on Artificial Intelligence, Virtual Reality and Interaction Design (AIVRID '25). Association for Computing Machinery, New York, NY, USA, 153–161. https://doi.org/10.1145/3777730.3777756"
"Youming Tao, Cheng-Long Wang, Miao Pan, Dongxiao Yu, Xiuzhen Cheng, and Di Wang",2024,Communication Efficient and Provable Federated Unlearning,,1119–1131,,,10.14778/3641204.3641220,https://doi.org/10.14778/3641204.3641220,unlearning,"Youming Tao, Cheng-Long Wang, Miao Pan, Dongxiao Yu, Xiuzhen Cheng, and Di Wang. 2024. Communication Efficient and Provable Federated Unlearning. Proc. VLDB Endow. 17, 5 (January 2024), 1119–1131. https://doi.org/10.14778/3641204.3641220"
"Tianyi Zhao, Liangliang Zhang, Yao Ma, and Lu Cheng",2024,A Survey on Safe Multi-Modal Learning Systems,the 30th ACM SIGKDD Conference on Knowledge Discovery and Data Mining (KDD '24),6655–6665,,"New York, NY, USA, 6655–6665",10.1145/3637528.3671462,https://doi.org/10.1145/3637528.3671462,survey,"Tianyi Zhao, Liangliang Zhang, Yao Ma, and Lu Cheng. 2024. A Survey on Safe Multi-Modal Learning Systems. In Proceedings of the 30th ACM SIGKDD Conference on Knowledge Discovery and Data Mining (KDD '24). Association for Computing Machinery, New York, NY, USA, 6655–6665. https://doi.org/10.1145/3637528.3671462"
"Haocheng Xia, Jinfei Liu, Jian Lou, Zhan Qin, Kui Ren, Yang Cao, and Li Xiong",2023,Equitable Data Valuation Meets the Right to Be Forgotten in Model Markets,,3349–3362,,,10.14778/3611479.3611531,https://doi.org/10.14778/3611479.3611531,,"Haocheng Xia, Jinfei Liu, Jian Lou, Zhan Qin, Kui Ren, Yang Cao, and Li Xiong. 2023. Equitable Data Valuation Meets the Right to Be Forgotten in Model Markets. Proc. VLDB Endow. 16, 11 (July 2023), 3349–3362. https://doi.org/10.14778/3611479.3611531"
