"Machine Unlearning Across Scales: Evaluation of Optimization Methods on Language Models","A. Hatua; T. T. Nguyen","AI Center of Excellence, Fidelity Investments, Boston, MA, USA; Computer Science Department, Winona State University, Winona, MN, USA","2025 IEEE 16th Annual Ubiquitous Computing, Electronics & Mobile Communication Conference (UEMCON)","4 Dec 2025","2025","","","0065","0071","Machine unlearning has emerged as a critical capability for removing specific knowledge from trained language models while preserving general performance. However, the effectiveness of different unlearning optimization methods across varying model scales remains underexplored. In this work, we conduct a systematic comparative study of three optimization approaches, such as Gradient Ascent, Scaled Gradient Ascent, and Weapons of Mass Destruction Proxy (WMDP)-style Weighted Loss unlearning, applied to two models of dramatically different scales: Llama-3-8B-bnb-4bit (8 billion parameters) and SmolLM-135M-bnb-4bit (135 million parameters). Using the Task of Fictitious Unlearning (TOFU) dataset for evaluation, we assess the effectiveness of unlearning through both in-domain robustness testing on holdout forget samples and out-of-domain evaluation on general knowledge tasks using the MuskumPillerum/GeneralKnowledge dataset. Our evaluation employs ROUGE scores for answer quality comparison, Kullback-Leibler (KL) divergence for distribution analysis, and a novel retain-model comparison methodology that establishes objective benchmarks for successful unlearning. Results reveal significant differences in unlearning behavior across model scales, with SmolLM-135M combined with Scaled Gradient Ascent demonstrating superior unlearning performance compared to all other model-method combinations, achieving high behavioral alignment with retain-only models. Our work contributes to understanding how model capacity influences unlearning dynamics, introduces a rigorous evaluation framework based on retain-model comparison, and offers empirical evidence for method selection in real-world deployment scenarios that require privacy protection and knowledge management.","","979-8-3315-6501-5","10.1109/UEMCON67449.2025.11267758","","https://ieeexplore.ieee.org/stamp/stamp.jsp?arnumber=11267758","machine unlearning;optimization;Large Language Model;TOFU dataset","Privacy;Systematics;Large language models;Optimization methods;Benchmark testing;Mobile communication;Robustness;Knowledge management;Protection;Weapons of mass destruction","","","","22","IEEE","4 Dec 2025","22-24 Oct. 2025","22-24 Oct. 2025","IEEE","IEEE Conferences"
"Genμ: The Generative Machine Unlearning Challenge","K. Thakral; S. Pathak; T. Glaser; T. Hassner; D. Garcia-Olano; I. Masi; R. Singh; M. Vatsa","IIT Jodhpur; IIT Jodhpur; Harman International; Weir AI, USA; Meta AI; Sapienza, U. of Rome; IIT Jodhpur; IIT Jodhpur",2025 IEEE/CVF International Conference on Computer Vision Workshops (ICCVW),"23 Feb 2026","2025","","","2554","2562","Generative machine unlearning has emerged as a critical requirement for the responsible deployment of text-to-image generative models, where the ability to erase specific visual concepts is essential for addressing concerns of privacy, copyright, and ethical use. Despite rapid progress in generative modeling, the field lacks standardized benchmarks to evaluate how effectively models can forget targeted concepts while retaining adjacent and unrelated knowledge. To fill this gap, we introduce the Genμ benchmark, which provides an extensive dataset of target, retain, and adjacent concepts, coupled with carefully engineered and adversarial prompts designed to probe unlearning robustness. To ensure fair and comprehensive assessment, we utilize the Erasing-Retention-Robustness score, a unified metric for capturing erasing accuracy, retention accuracy, adjacent-concept preservation, engineered-prompt robustness, and adversarial robustness. Alongside this benchmark, we establish detailed baselines using widely adopted unlearning algorithms, demonstrating the strengths and limitations of current approaches. By consolidating tasks such as single-concept, multi-concept, and continuous unlearning in a unified framework, the Genμ benchmark provides the first rigorous foundation for systematic evaluation in this domain. It aims to catalyze future research on controllable and responsible generative models that can selectively forget while preserving generality and robustness.","2473-9944","979-8-3315-8988-2","10.1109/ICCVW69036.2025.00266","European Union(grant numbers:20227YET9B); ","https://ieeexplore.ieee.org/stamp/stamp.jsp?arnumber=11375400","machine unlearning;generative ai;model editing","Measurement;Visualization;Privacy;Ethics;Accuracy;Systematics;Text to image;Benchmark testing;Robustness;Probes","","","","24","IEEE","23 Feb 2026","19-20 Oct. 2025","19-20 Oct. 2025","IEEE","IEEE Conferences"
"MUNBa: Machine Unlearning Via Nash Bargaining","J. Wu; M. Harandi","Department of Data Science & AI, Monash University, Melbourne, VIC, Australia; Department of Electrical Computer Systems Engineering, Monash University, Melbourne, VIC, Australia",2025 IEEE/CVF International Conference on Computer Vision (ICCV),"29 Apr 2026","2025","","","1","12","Machine Unlearning (MU) aims to selectively erase harmful behaviors from models while retaining the overall utility of the model. As a multi-task learning problem, MU involves balancing objectives related to forgetting specific concepts/data and preserving general performance. A naive integration of these forgetting and preserving objectives can lead to gradient conflicts and dominance, impeding MU algorithms from reaching optimal solutions. To address the gradient conflict and dominance issue, we reformulate $M U$ as a two-player cooperative game, where the two players, namely, the forgetting player and the preservation player, contribute via their gradient proposals to maximize their overall gain and balance their contributions. To this end, inspired by the Nash bargaining theory, we derive a closedform solution to guide the model toward the Pareto stationary point. Our formulation of MU guarantees an equilibrium solution, where any deviation from the final state would lead to a reduction in the overall objectives for both players, ensuring optimality in each objective. We evaluate our algorithm's effectiveness on a diverse set of tasks across image classification and image generation. Extensive experiments with ResNet, vision-language model CLIP, and text-to-image diffusion models demonstrate that our method outperforms state-of-the-art MU algorithms, achieving a better trade-off between forgetting and preserving. Our results also highlight improvements in forgetting precision, preservation of generalization, and robustness against adversarial attacks. WARNING: This paper contains sexually explicit imagery that may be offensive in nature.","2380-7504","979-8-3315-8775-8","10.1109/ICCV51701.2025.00452","","https://ieeexplore.ieee.org/stamp/stamp.jsp?arnumber=11445593","machine unlearning;game theory;t2i diffusion model;clip","Feedback;Filtering;Circuits;Filters;MIMICs;Millimeter wave integrated circuits;Monolithic integrated circuits;Protocols;Communication systems;Quality of service","","","","83","IEEE","29 Apr 2026","19-25 Oct. 2025","19-25 Oct. 2025","IEEE","IEEE Conferences"
"On User Privacy in MNO: Machine Unlearning Techniques for Data Compliance and Security","E. Figetakis; A. Refaey; A. Rahmati","University of Guelph, Ontario, Canada; University of Guelph, Ontario, Canada; Stony Brook University, New York, USA",ICC 2025 - IEEE International Conference on Communications,"26 Sep 2025","2025","","","3150","3155","Artificial Intelligence (AI) integration in network management has significantly improved Quality of Experience (QoE) and achieved high availability, reaching 99.99% uptime with an aim to meet the five 9s standard in Next Generation Networks. Utilizing Closed Loop Automation (CLA) within the management plane, AI-driven systems dynamically allocate network resources based on real-time user data. However, the shift to automated management introduces privacy concerns, as retained user data may violate the GDPR's “right to be forgotten” requirement. To address this, we propose a machine unlearning framework for precise data removal in Deep Neural Network (DNN) models that is fully integrated into the CLA. This framework ensures compliant data deletion requests while preserving model performance. Our experiments demonstrate the framework's effectiveness by preserving the model's accuracy on validation data by 79.38 % compared to the existing benchmark methods of 57.0048 %, underscoring its potential in secure, privacy-aware network management. The update is tested on model forecasting Internet usage from a telecommunications dataset and achieves a low complexity while maintaining the model's accuracy over a validation dataset. The method provides a reasonable time to run for the 7 million parameter model. Its ease of integration within the network management plane allows operators to reach compliance with the Data Acts.","1938-1883","979-8-3315-0521-9","10.1109/ICC52391.2025.11162036","","https://ieeexplore.ieee.org/stamp/stamp.jsp?arnumber=11162036","Machine Unlearning;DNN;Next Generation Networks;NGN;6G;Differential Privacy","Accuracy;Artificial neural networks;Predictive models;Data models;Telecommunications;Quality of experience;Security;Artificial intelligence;Next generation networking;Standards","","","","13","IEEE","26 Sep 2025","8-12 June 2025","8-12 June 2025","IEEE","IEEE Conferences"
"Backdoor Defense via Malicious Knowledge Capturing and Machine Unlearning with Out-of-Distribution Data","D. Liang; K. Chen; H. Yan; C. Dong","Institute of Artificial Intelligence, Guangzhou University, Guangzhou, China; Institute of Artificial Intelligence, Guangzhou University, Guangzhou, China; Institute of Artificial Intelligence, Guangzhou University, Guangzhou, China; Institute of Artificial Intelligence, Guangzhou University, Guangzhou, China",2025 International Joint Conference on Neural Networks (IJCNN),"14 Nov 2025","2025","","","1","8","Recent studies reveal that backdoor attacks are a significant security threat to deep neural networks. Existing defense methods for removing backdoors from victim models often assume that defenders have access to limited clean training data, which is unrealistic in real-world scenarios. Inspired by the biological immune response process, we propose a novel backdoor defense framework comprises three key steps. First, a max-entropy staircase approximator (MSA) is implemented to capture the valid trigger distribution through trigger reconstruction. We then utilize these reconstructed trigger patterns to extract backdoor knowledge from the victim model using a knowledge distillation-based approach. Finally, to completely eliminate the backdoor knowledge, we design a machine unlearning method optimized by maximizing the KL-divergence between the backdoor knowledge representation and the victim model. Our framework relies solely on unlabeled out-of-distribution data, significantly enhancing its practicality. Extensive experiments on various backdoor attacks show that our approach can lower the attack success rates of five state-of-the-art backdoor attacks by an average of 99% and outperforms five state-of-the-art defense methods that rely on clean training data.","2161-4407","979-8-3315-1042-8","10.1109/IJCNN64981.2025.11228380","National Natural Science Foundation of China; Guangzhou University; National Natural Science Foundation of China; ","https://ieeexplore.ieee.org/stamp/stamp.jsp?arnumber=11228380","Backdoor Defense;Trigger Pattern Recovery;Machine Unlearning","Immune response;Biological system modeling;Training data;Knowledge representation;Artificial neural networks;Data models;Security","","","","39","IEEE","14 Nov 2025","30 June-5 July 2025","30 June-5 July 2025","IEEE","IEEE Conferences"
"An Intent-Based Networking Framework for Secure and Privacy-Compliant Machine Unlearning Using Meta-Learning and Redactable Blockchain","M. Shirmohammadi; A. Islam; H. Karimipour","Department of Electrical and Software Engineering, Schulich School of Engineering, University of Calgary, Calgary, AB, Canada; Department of Electrical and Software Engineering, Schulich School of Engineering, University of Calgary, Calgary, AB, Canada; Department of Electrical and Software Engineering, Schulich School of Engineering, University of Calgary, Calgary, AB, Canada",IEEE Internet of Things Journal,"24 Apr 2026","2026","13","9","18167","18181","Intent-based networking (IBN) is emerging as a powerful paradigm for managing complex, adaptive systems by translating high-level user policies into automated infrastructure behavior. To meet these intents effectively, especially in dynamic and data-driven environments, IBN increasingly depends on artificial intelligence (AI) for intelligent decision-making and task automation. While AI enhances the responsiveness of IBN, it introduces new challenges in data privacy and regulatory compliance—particularly in environments where sensitive personal data are continuously collected and learned. A central issue arises from the right to be forgotten (RTBF) under the general data protection regulation (GDPR), which requires that user data—and its learned influence—be fully removed upon request. However, conventional unlearning methods that rely on full model retraining are resource-intensive and impractical for real-time systems. To address this, this article proposes an intent-driven machine unlearning (MU) framework that integrates meta-learning, redactable blockchain, and secure multiparty computation (MPC), all coordinated through IBN. In this framework, unlearning is formulated as a targeted removal of a data point’s influence from the model without retraining, using implicit gradients. The redactable blockchain ensures compliant and auditable logging, while MPC supports secure, decentralized redaction. IBN orchestrates the process by aligning unlearning actions with privacy intents. The experimental results demonstrate that the proposed framework achieves up to 2.2% higher accuracy than baseline meta-learning approaches and  $2.78\times $  greater unlearning efficiency compared to retraining, while maintaining strong resistance to membership inference attacks (MIAs). This demonstrates its suitability for scalable, regulation-compliant AI unlearning.","2327-4662","","10.1109/JIOT.2025.3638966","Mitacs through the Mitacs Accelerate Program; ","https://ieeexplore.ieee.org/stamp/stamp.jsp?arnumber=11271447","Data privacy;intent-based networking (IBN);machine unlearning (MU);meta-learning;redacted blockchain;secure multiparty computation (MPC)","Blockchains;Metalearning;Data models;Artificial intelligence;Privacy;Data privacy;Computational modeling;Adaptation models;Internet of Things;Training","","","","29","IEEE","28 Nov 2025","1 May1, 2026","","IEEE","IEEE Journals"
"MiniUn: A Machine Unlearning Method to Minimize Dependency on Original Training Data","S. Youn; C. Kim","Department of IT Engineering, Sookmyung Women’s University, Seoul, Republic of Korea; Department of IT Engineering, Sookmyung Women’s University, Seoul, Republic of Korea",IEEE Access,"21 Jan 2026","2026","14","","9272","9283","The exponential growth in data volume has driven significant advances in machine learning, but the inclusion of private or unauthorized data in training dataset has led to a surge in deletion requests and privacy disputes. While retraining models without the contested data offers a fundamental solution, it incurs prohibitive computational costs. This challenge has given rise to machine unlearning, a process that selectively removes knowledge of specified data from a trained model. However, most unlearning methods require access to the complete original training dataset and often suffer from degraded generalization performance after unlearning. This limitation makes them impractical in scenarios where the full training dataset is no longer accessible. To address these challenges, we propose a novel unlearning technique for image classification and generation tasks that maintains effectiveness even with a small part of the original dataset. Experimental results demonstrate the superiority of our method, supporting the right to be forgotten.","2169-3536","","10.1109/ACCESS.2026.3653817","","https://ieeexplore.ieee.org/stamp/stamp.jsp?arnumber=11348058","Data privacy;image classification;image generation;machine unlearning;privacy-preserving machine learning","Image classification;Data models;Training;Computational modeling;Data privacy;Accuracy;Training data;Noise;Image restoration;Tensors","","","","29","CCBYNCND","13 Jan 2026","2026","","IEEE","IEEE Journals"
"BlindU: Blind Machine Unlearning Without Revealing Erasing Data","W. Wang; Z. Tian; C. Zhang; S. Yu","School of Computer Science, University of Technology Sydney, Ultimo, NSW, Australia; School of Cyber Science and Engineering, Southeast University, Nanjing, Jiangsu, China; School of Computer Science, University of Technology Sydney, Ultimo, NSW, Australia; School of Computer Science, University of Technology Sydney, Ultimo, NSW, Australia",IEEE Transactions on Pattern Analysis and Machine Intelligence,"3 Apr 2026","2026","48","5","5963","5978","Machine unlearning enables data holders to remove the contribution of their specified samples from trained models to protect their privacy. However, it is paradoxical that most unlearning methods require the unlearning requesters to first upload their data to the server as a prerequisite for unlearning. These methods are infeasible in many privacy-preserving scenarios where servers are prohibited from accessing users’ data, such as federated learning (FL). In this paper, we explore how to implement unlearning under the condition of not uncovering the erasing data to the server. We propose Blind Unlearning (BlindU), which carries out unlearning using compressed representations instead of original inputs. BlindU only involves the server and the unlearning user: the user locally generates privacy-preserving representations, and the server performs unlearning solely on these representations and their labels. For the FL model training, we employ the information bottleneck (IB) mechanism. The encoder of the IB-based FL model learns representations that distort maximum task-irrelevant information from inputs, allowing FL users to generate compressed representations locally. For effective unlearning using compressed representation, BlindU integrates two dedicated unlearning modules tailored explicitly for IB-based models and uses a multiple gradient descent algorithm to balance forgetting and utility retaining. While IB compression already provides protection for task-irrelevant information of inputs, to further enhance the privacy protection, we introduce a noise-free differential privacy (DP) masking method to deal with the raw erasing data before compressing. Theoretical analysis and extensive experimental results illustrate the superiority of BlindU in privacy protection and unlearning effectiveness compared with the best existing privacy-preserving unlearning benchmarks.","1939-3539","","10.1109/TPAMI.2026.3654093","Australia ARC(grant numbers:LP220100453,DP240100955); ","https://ieeexplore.ieee.org/stamp/stamp.jsp?arnumber=11353053","Machine unlearning;federated learning;privacy leakage;privacy preserving;information bottleneck","Servers;Protection;Privacy;Data privacy;Data models;Training;Computational modeling;Noise;Federated learning;Optimization","","","","60","IEEE","15 Jan 2026","May 2026","","IEEE","IEEE Journals"
"SMS: Self-Supervised Model Seeding for Verification of Machine Unlearning","W. Wang; C. Zhang; Z. Tian; S. Yu","School of Computer Science, University of Technology Sydney, Ultimo, NSW, Australia; School of Computer Science, University of Technology Sydney, Ultimo, NSW, Australia; School of Computer Science, University of Technology Sydney, Ultimo, NSW, Australia; School of Computer Science, University of Technology Sydney, Ultimo, NSW, Australia",IEEE Transactions on Dependable and Secure Computing,"15 Jan 2026","2026","23","1","1219","1231","Many machine unlearning methods have been proposed recently to uphold users’ right to be forgotten. However, offering users verification of their data removal post-unlearning is an important yet under-explored problem. Current verifications typically rely on backdooring, i.e., adding backdoored samples to influence model performance. Nevertheless, the backdoor methods can merely establish a connection between backdoored samples and models but fail to connect the backdoor with genuine samples. Thus, the backdoor removal can only confirm the unlearning of backdoored samples, not users’ genuine samples, as genuine samples are independent of backdoored ones. In this paper, we propose a Self-supervised Model Seeding (SMS) scheme to provide unlearning verification for genuine samples. Unlike backdooring, SMS links user-specific seeds (such as users’ unique indices), original samples, and models, thereby facilitating the verification of unlearning genuine samples. However, implementing SMS for unlearning verification presents two significant challenges. First, embedding the seeds into the service model while keeping them secret from the server requires a sophisticated approach. We address this by employing a self-supervised model seeding task, which learns the entire sample, including the seeds, into the model’s latent space. Second, maintaining the utility of the original service model while ensuring the seeding effect requires a delicate balance. We design a joint-training structure that optimizes both the self-supervised model seeding task and the primary service task simultaneously on the model, thereby maintaining model utility while achieving effective model seeding. The effectiveness of the proposed SMS scheme is evaluated through extensive experiments on three representative datasets, utilizing various model architectures and exact and approximate unlearning benchmarks. The results demonstrate that SMS provides effective verification for genuine sample unlearning, effectively addressing the limitations of existing solutions.","1941-0018","","10.1109/TDSC.2025.3615615","Australia(grant numbers:ARC LP220100453,ARC DP240100955); ","https://ieeexplore.ieee.org/stamp/stamp.jsp?arnumber=11184497","Machine unlearning;unlearning verification;self-supervised model seeding;joint optimization;backdooring","Servers;Training;Computational modeling;Data models;Data privacy;Benchmark testing;Privacy;Optimization;General Data Protection Regulation;Degradation","","","","49","IEEE","29 Sep 2025","Jan.-Feb. 2026","","IEEE","IEEE Journals"
"Feature Space-Preserving Machine Unlearning for Robust Image Classification With Noisy Labels","S. Yamamoto; S. Yoshida; M. Muneyasu","Graduate School of Science and Engineering, Kansai University, Osaka, Japan; Faculty of Engineering Science, Kansai University, Osaka, Japan; Faculty of Engineering Science, Kansai University, Osaka, Japan",IEEE Access,"2 Apr 2026","2026","14","","45449","45463","Deep neural networks excel in image classification with clean data, but their performance deteriorates significantly when trained with noisy labels. In contrast to conventional approaches, which address this challenge through sample selection or loss correction, this study proposes a fundamentally different paradigm in which machine unlearning is employed to selectively forget noisy samples. Existing unlearning methods such as scalable remembering and unlearning unbound cause detrimental feature space dispersion, which creates ambiguous decision boundaries. Thus, this paper introduces a feature space-preserving unlearning framework that maintains discriminative structures while removing the influence of noisy labels. The proposed approach computes class centroids from reliable samples and implements a dual optimization strategy in which noisy samples are pushed away from all centroids while clean samples are simultaneously pulled toward their appropriate class centers. Comprehensive experiments on the CIFAR-10 and CIFAR-100 datasets with symmetric and asymmetric noise (ranging from 10%–90%) show that our method consistently outperforms standard unlearning techniques, achieving accuracy improvements of up to 27.61 percentage points on the more complex CIFAR-100 dataset under high-noise conditions. Furthermore, we confirm that our method remains effective even when applied to models trained with state-of-the-art noisy label learning methods. Visualization analysis demonstrates that our approach preserves compact class clusters with clear boundaries, despite aggressive unlearning. The reported implementation is available at https://github.com/meruemon/FSPMU","2169-3536","","10.1109/ACCESS.2026.3676403","Japan Society for the Promotion of Science (JSPS), KAKENHI, Japan(grant numbers:22K18007,25K00510); ","https://ieeexplore.ieee.org/stamp/stamp.jsp?arnumber=11450351","Learning with noisy labels;machine unlearning;image classification","Noise measurement;Noise;Training;Data models;Contrastive learning;Standards;Image classification;Representation learning;Semisupervised learning;Optimization","","","","48","CCBYNCND","23 Mar 2026","2026","","IEEE","IEEE Journals"
