"Towards Trustworthy AI in Ophthalmology: Unlearning with Explainable Transformers","V. Balan; G.Kumaravelan","Department of Computer Science, Pondicherry University, Pondicherry, India; Department of Computer Science, Pondicherry University, Pondicherry, India","2025 International Conference on Signal Processing, Computation, Electronics, Power and Telecommunication (IConSCEPT)","23 Mar 2026","2025","","","1","6","Deep learning based automated retinal disease diagnosis has become an effective tool for early diagnosis of diseases like glaucoma, cataracts, and diabetic retinopathy (DR). As machine learning methods become more common in clinical processes, the challenge of machine unlearning arises. This involves removing specific patient data from trained models while maintaining their predicted performance. Following privacy laws, such as the General Data Protection Regulation (GDPR), adds to this difficulty. This work uses the ODIR-5K dataset to build and evaluate a classification framework based on Vision Transformer (ViT) that can selectively unlearn. The study separates instances of DR, cataract, and glaucoma using an unlearning procedure that removes specific samples and re-trains the model. Along with visual comparisons of heatmap focus before and after unlearning, both explanation-based metrics — XAI Forgetting Score (XFS) and cosine similarity — were evaluated, as well as the Intersection over Union (IoU) of Grad-CAM heatmaps and conventional classification metrics (accuracy, precision, recall, F1-score, and AUC-ROC). The findings indicate that the proposed approach can ""forget"" specific samples while still demonstrating a strong capacity to categorize—the model showed a macro-averaged F1-score of 0.75 and an Accuracy of 0.92. The study indicates that privacy-preserving AI in ophthalmology is feasible and retains diagnostic accuracy. The proposed method combines interpretability with unlearning to promote clinical trustworthiness through regulatory compliance, thereby alleviating a vital tension that currently limits the use of medical AI.","","979-8-3315-7120-7","10.1109/IConSCEPT66142.2025.11437119","","https://ieeexplore.ieee.org/stamp/stamp.jsp?arnumber=11437119","Machine Unlearning;Explainable AI (XAI);Vision Transformer (ViT);Grad-CAM;ODIR-5K Dataset;Retinal Disease Classification","Measurement;Glaucoma;Cataracts;Computer vision;Visualization;Accuracy;Signal processing algorithms;Transformers;Retina;Ophthalmology","","","","19","IEEE","23 Mar 2026","6-7 Dec. 2025","6-7 Dec. 2025","IEEE","IEEE Conferences"
"Achieving Zero-Glance Unlearning with Data-Free Inversion and Selective Parameters Suppression","P. Lian; X. Ke; Z. Tan; J. Cai; X. Liu","College of Computer and Data Science, Fuzhou University, Fuzhou, China; College of Computer and Data Science, Fuzhou University, Fuzhou, China; College of Computer and Data Science, Fuzhou University, Fuzhou, China; Faculty of Data Science, City University of Macau, China; College of Computer and Data Science, Fuzhou University, Fuzhou, China",2025 IEEE International Conference on Multimedia and Expo (ICME),"30 Oct 2025","2025","","","1","9","In machine learning (ML), data deletion involves more than just removing data from a dataset. Machine unlearning enables ML models to eliminate the effects of specific data that needs to be deleted. Under zero-glance settings, we may lack the right to utilize the data slated for removal during unlearning, thereby heightening the complexity. To address this challenge, we propose UISPS, which employs data-free inversion to generate replacement data for unavailable forgotten data. Utilizing the generated data, we propose selective parameter suppression to address the issue of catastrophic forgetting during unlearning effectively. Its interpretability improves the reliability of unlearning under zero-glance conditions. The experiments demonstrate that UISPS performs forgotten tasks with commendable results. Meanwhile, UISPS maintains higher accuracy on retained data, improving it by up to 3.34% while reducing the attack success rate of membership inference attacks by 25.85% ∼ 39.54% compared to the state-of-the-art.","1945-788X","979-8-3315-9495-4","10.1109/ICME59968.2025.11209383","","https://ieeexplore.ieee.org/stamp/stamp.jsp?arnumber=11209383","Machine Unlearning;Model Inversion;Catastrophic Forgetting;Privacy and Security","Privacy;Accuracy;Machine learning;Data models;Complexity theory;Security;Reliability","","","","21","IEEE","30 Oct 2025","30 June-4 July 2025","30 June-4 July 2025","IEEE","IEEE Conferences"
"Towards a Privacy Preserving Framework for Mobility as a Service (MaaS)","E. C. Nkoro; A. O. Portillo-Dominguez; C. Thorpe; V. Ayala-Rivera","Faculty of Computing, Digital and Data; Digital Futures Research Hub, Technological University Dublin, Dublin, Ireland; Faculty of Computing, Digital and Data; Digital Futures Research Hub, Technological University Dublin, Dublin, Ireland; Faculty of Computing, Digital and Data; Digital Futures Research Hub, Technological University Dublin, Dublin, Ireland; Faculty of Computing, Digital and Data; Digital Futures Research Hub, Technological University Dublin, Dublin, Ireland","2025 6th International Conference on Communications, Information, Electronic and Energy Systems (CIEES)","25 Dec 2025","2025","","","1","6","Mobility-as-a-Service (MaaS) is reshaping urban transportation by integrating multiple travel modes into a cyberphysical ecosystem powered by artificial intelligence. However, growing privacy concerns and regulatory mandates, such as the GDPR Right to Be Forgotten (RTBF), pose significant challenges for data deletion and model compliance. To address this challenge, we propose a privacy-preserving machine unlearning (MU) framework tailored for MaaS using the Sharded, Isolated, Sliced, and Aggregated (SISA) approach. Our framework supports efficient removal of specific user data from trained ML models without requiring full retraining. Our evaluation shows that our framework can achieve high model utility, while effectively handling deletion requests (e.g., achieving a KL divergence of 0.0060–0.0068 and inference false positive rates of 17%–18%).","","979-8-3315-0119-8","10.1109/CIEES66347.2025.11300101","","https://ieeexplore.ieee.org/stamp/stamp.jsp?arnumber=11300101","Mobility-as-a-Service;secure software;machine unlearning;SISA;privacy;GDPR","Mobility as a service;Privacy;Data privacy;Ecosystems;Transportation;Cyber-physical systems;Data models;Software;Artificial intelligence","","","","15","IEEE","25 Dec 2025","26-28 Nov. 2025","26-28 Nov. 2025","IEEE","IEEE Conferences"
"Tackling Sequential Entanglement in Split Unlearning","A. Etheridge; M. Zhu; X. Liu; C. Huang","The School of Computing, Montclair State University; The School of Computing, Montclair State University; The Computer Science Department, The University of California, Davis; The School of Computing, Montclair State University",2025 IEEE 8th International Conference on Multimedia Information Processing and Retrieval (MIPR),"11 Nov 2025","2025","","","290","296","Split learning enables distributed model training by partitioning a neural network between clients and a server and exchanging information pertained to intermediate activations. Recent studies on machine unlearning emerged, where one aims to erase the impact of certain data points on the trained model. While existing related work focused on centralized and federated scenarios, the problem of split unlearning is much under-explored. To fill this gap, we propose a split unlearning algorithm that applies orthogonal projection to gradient caches on both the clients and the server to excise contributions from data slated for removal and then fine-tunes the model on the remaining data. A key technical challenge is associated with the model split and the sequential entanglement in split learning, where a client cache lacks entries for the data points to be removed from the other clients. We address this by employing a rounding mechanism that substitutes missing gradients with their nearest available approximations. We provide a convergence analysis of our algorithm, which achieves an $O(1/T)$ rate under non-convex objectives. Numerical experiments show that our algorithm can effectively unlearn various data points while achieving an accuracy close to the retrained benchmarks.","2770-4319","979-8-3315-9465-7","10.1109/MIPR67560.2025.00053","","https://ieeexplore.ieee.org/stamp/stamp.jsp?arnumber=11225938","split learning;machine unlearning;machine learning","Training;Accuracy;Neural networks;Information processing;Benchmark testing;Approximation algorithms;Data models;Numerical models;Servers;Convergence","","","","39","IEEE","11 Nov 2025","6-8 Aug. 2025","6-8 Aug. 2025","IEEE","IEEE Conferences"
"Memory-Efficient Distributed Unlearning","N. Lang; A. Helvits; N. Shlezinger","School of Electrical and Computer Engineering (ECE), Ben-Gurion University of the Negev, Be’er Sheva, Israel; School of Electrical and Computer Engineering (ECE), Ben-Gurion University of the Negev, Be’er Sheva, Israel; School of Electrical and Computer Engineering (ECE), Ben-Gurion University of the Negev, Be’er Sheva, Israel",IEEE Access,"18 Feb 2026","2026","14","","24361","24378","Machine unlearning considers the removal of the contribution of a set of data points from a trained model, and is often associated with realizing “the right to be forgotten”. In distributed settings, where a server orchestrates training using data available at a set of remote users, unlearning is essential to cope with malicious or corrupted clients. If these are revealed after training is concluded, and the collaborating users are no longer available, unlearning has to be completed solely by the server. Consequently, server-side unlearning conventionally requires the server to store all model updates observed in training, leading to immense storage overhead for preserving the ability to unlearn. In this work we study lossy compression schemes for facilitating distributed server-side unlearning with limited memory footprint. We propose memory-efficient distributed unlearning (MEDU), a hierarchical lossy compression scheme tailored for server-side unlearning, that integrates user sparsification, differential thresholding, and random lattice coding, to substantially reduce memory footprint. We rigorously analyze MEDU, deriving an upper bound on the difference between the desired model that is trained from scratch and the model unlearned from lossy compressed stored updates. Our bound outperforms the state-of-the-art known bounds for non-compressed decentralized server-side unlearning, even when lossy compression is incorporated. We further provide a numerical study, which shows that suited lossy compression can enable distributed unlearning with notably reduced memory footprint at the server while maintaining the utility of the unlearned model.","2169-3536","","10.1109/ACCESS.2026.3663428","","https://ieeexplore.ieee.org/stamp/stamp.jsp?arnumber=11389783","Machine unlearning;federated learning;lossy compression","Servers;Training;Distance learning;Computer aided instruction;Computational modeling;Probabilistic logic;Numerical models;Upper bound;Signal processing algorithms;Reviews","","","","73","CCBY","10 Feb 2026","2026","","IEEE","IEEE Journals"
"MOEA-SISA: Multiobjective Optimization to Improve Model Performance During Forgetting Data","B. Cao; Z. Wang; D. Chang; X. Liu; Y. Li","State Key Laboratory of Reliability and Intelligence of Electrical Equipment, Hebei University of Technology, Tianjin, China; School of Artificial Intelligence. Hebei University of Technology, Tianjin, China; School of Geophysics and Information Technology, University of Geosciences, Beijing, China; School of Economics and Management, Hebei University of Technology, Tianjin, China; Shenzhen Institute for Advanced Study, University of Electronic Science and Technology of China, Shenzhen, China",Chinese Journal of Electronics,"13 Apr 2026","2026","35","1","392","399","With the proliferation of shared personal data online, users encounter difficulties in revoking data access permissions and requesting data deletions, thus increasing the risk of privacy breaches. Machine unlearning offers a solution and is useful for sensing-computing integrated chips and systems, but the state-of-the-art shard-ed, isolated, sliced, and aggregated (SISA) method produces models with high complexity and limited generalization ability. This study proposes a novel framework, named multiobjective evolutionary algorithm-SISA (MOEA-SISA), which integrates feature decomposition-based differential grouping (FDbDG) to improve optimization efficiency through dynamic grouping of decision variables. Three optimization objectives can hence be proposed: model accuracy, model complexity, and generalization ability. By optimizing these three objectives, the trained model becomes closer to the retrained results while preventing excessive forgetting. Experimental models including ViT, VGG-16, and ResNet-50 are used for sub-class forgetting tasks. Compared with various state-of-the-art methods, MOEA-SISA offers advantages across these models, especially in terms of model complexity and generalization ability. Tests against membership inference attacks demonstrate that MOEA-SISA effectively retains accuracy and enhances the generalization ability in sub-class forgetting scenarios. Additionally, the proposed approach offers significant advantages for improving the efficiency and performance of sensing-computing integrated chips and systems.","2075-5597","","10.23919/cje.2024.00.052","National Key Research and Development Program of China(grant numbers:2023YFB4503000); ","https://ieeexplore.ieee.org/stamp/stamp.jsp?arnumber=11480068","Machine unlearning;Sharded;isolated;sliced;and aggregated (SISA);Forgetting;Multiobjective evolution;Multiobjective problems","Recommender systems;Information filtering;Electronic mail;Internet of Things;Storage area networks;Protocols;Communication systems;Internet;Computer networks;Vehicular ad hoc networks","","","","40","","13 Apr 2026","January 2026","","CIE","CIE Journals"
"Efficient Data Erasure in Deep Learning via Sparsity and Stability Mechanisms","U. J. Orthee; A. S. M. Naeem; T. Khatun; M. Ohona; N. Mansoor","Department of CSE, University of Liberal Arts Bangladesh, Dhaka, Bangladesh; Department of CSE, University of Liberal Arts Bangladesh, Dhaka, Bangladesh; Department of CSE, University of Liberal Arts Bangladesh, Dhaka, Bangladesh; Department of CSE, University of Liberal Arts Bangladesh, Dhaka, Bangladesh; Department of CSE, University of Liberal Arts Bangladesh, Dhaka, Bangladesh",2025 28th International Conference on Computer and Information Technology (ICCIT),"6 May 2026","2025","","","5140","5144","Machine unlearning (MU) has emerged as a critical paradigm to ensure trained models can selectively remove the influence of specific data without requiring full retraining. While early MU methods addressed privacy regulations such as the “right to be forgotten”, they often suffer from inefficiency, instability, or degraded model performance at scale. To advance MU toward practical deployment, this study introduces a sparsityenhanced unlearning framework that integrates pruning-based model reduction with stability-focused optimization strategies. Two novel methods are proposed: GA Repair, an extension of Gradient Ascent that alternates destructive forgetting with robust repair phases, and FT Confusion, a Fine-Tuning variant that employs entropy maximization and anchored preservation to achieve class-level erasure. Both approaches are evaluated on ResNet-18 with the CIFAR-10 benchmark under class-wise and instance-level forgetting scenarios. Results show that sparsity consistently narrows the gap between approximate unlearning and retraining, improving computational efficiency while maintaining stability. FT Confusion achieves retrain-level forgetting in class-wise tasks, whereas GA Repair provides stronger fidelity in random instance-level forgetting. These findings highlight that no single unlearning strategy is universally optimal; instead, scalable unlearning requires a portfolio of methods, with sparsity as a key enabler for efficiency and robustness.","2474-9656","979-8-3315-7867-1","10.1109/ICCIT68739.2025.11491062","","https://ieeexplore.ieee.org/stamp/stamp.jsp?arnumber=11491062","Machine Unlearning;Model Sparsification;Optimization;Deep Learning","Filtering;Filters;Neuromorphics;Recommender systems;Information filtering;Circuits and systems;Protocols;HTTP;Location awareness;Radio access networks","","","","27","IEEE","6 May 2026","19-21 Dec. 2025","19-21 Dec. 2025","IEEE","IEEE Conferences"
"Exploiting Hessian-Calibrated Parameter Differences for Generative Unlearning Inversion Attack","S. Cai; X. Liu","Hubei Key Laboratory of Transportation Internet of Things, School of Computer Science and Artificial Intelligence, Wuhan University of Technology, Wuhan, China; University of California San Diego, San Diego, CA, USA",IEEE Transactions on Dependable and Secure Computing,"","2026","PP","99","1","15","Machine unlearning has emerged as a key technique for supporting the “right to be forgotten” by enabling the removal of specific training records from deployed models. Recent studies on unlearning inversion attacks reveal that releasing both the original model and the unlearned model can expose an additional privacy attack surface, where adversaries attempt to reconstruct the forgotten data from the parameter difference. However, existing attacks largely rely on treating the model difference as a direct proxy of gradients, which is often inaccurate due to the preconditioning effect of second-order optimization, approximation errors in practical unlearning, and the entanglement of multiple forgotten samples. As a result, reconstruction quality degrades substantially under exact unlearning and collapses when the number of unlearned samples increases. In this work, we propose an unlearning inversion framework that improves robustness under both exact and approximate unlearning, especially in the multi-sample setting. We first apply a Hessian-informed enhancement that maps the parameter difference to a more gradient-like signal from public data, reducing the mismatch between model difference and true gradients. Then, we adopt an over-parameterized generative inversion network to fit the recovered gradient signal, leveraging implicit convolutional priors to stabilize reconstruction and mitigate noise. Experiments on benchmark datasets demonstrate that our method improves feature reconstruction over prior unlearning inversion baselines, with particularly large gains for exact unlearning and when unlearning larger batches of samples.","1941-0018","","10.1109/TDSC.2026.3691395","","https://ieeexplore.ieee.org/stamp/stamp.jsp?arnumber=11512324","Machine unlearning;model inversion attack;privacy protection","Modeling;Calibration;Optimization;Generators;Machining;Training;Noise;Privacy;Heart rate;Conferences","","","","","IEEE","8 May 2026","","","IEEE","IEEE Early Access Articles"
"Deep Unlearning of Breast Cancer Histopathological Images for Enhanced Responsibility in Classification","L. Aliyeva; N. Abdullayev; S. Zarbiyeva; I. Huseynov; U. Suleymanov","School of IT and Engineering, ADA University, Baku, Azerbaijan; School of IT and Engineering, ADA University, Baku, Azerbaijan; School of IT and Engineering, ADA University, Baku, Azerbaijan; School of Business, ADA University, Baku, Azerbaijan; School of IT and Engineering, ADA University, Baku, Azerbaijan",2024 IEEE 18th International Conference on Application of Information and Communication Technologies (AICT),"6 Nov 2024","2024","","","1","6","This study is focused on the applicability of machine unlearning techniques towards histopathological images for breast cancer classification with the usage of the DenseNet model. The core focus area of the research is to mitigate data privacy problems and to comply with jurisdictions regarding accepting the request for data removal. This is achieved through an influence-based unlearning technique that adjusts the model's parameters to minimize the impact of targeted data points. The dataset used for this study is the BreaKHis histopathological images dataset. Additionally, after applied techniques, accuracy, F1-score, unlearning time, and confidence distribution are used for evaluation of the method. This study is among the first to use deep unlearning-based approaches in the domain of classification of medical images, thus, making AI in healthcare more responsible and safe.","2472-8586","979-8-3503-8753-7","10.1109/AICT61888.2024.10740413","","https://ieeexplore.ieee.org/stamp/stamp.jsp?arnumber=10740413","machine unlearning;deep unlearning;breast cancer classification;DenseNet;responsible AI","Measurement;Adaptation models;Privacy;Medical services;Data models;Breast cancer;Regulation;Information and communication technology;Artificial intelligence;Image classification","","","","35","IEEE","6 Nov 2024","25-27 Sept. 2024","25-27 Sept. 2024","IEEE","IEEE Conferences"
"Unlearning for Clinical Deployment: Scalable Data Erasure in Medical Image Classification Models","U. J. Orthee; A. S. M. Naeem; T. Khatun; M. Ohona; N. Mansoor","Department of CSE, University of Liberal Arts Bangladesh, Dhaka, Bangladesh; Department of CSE, University of Liberal Arts Bangladesh, Dhaka, Bangladesh; Department of CSE, University of Liberal Arts Bangladesh, Dhaka, Bangladesh; Department of CSE, University of Liberal Arts Bangladesh, Dhaka, Bangladesh; Department of CSE, University of Liberal Arts Bangladesh, Dhaka, Bangladesh","2025 IEEE International Conference on Biomedical Engineering, Computer and Information Technology for Health (BECITHCON)","8 May 2026","2025","","","279","284","Machine learning has become integral to modern healthcare. However, models often inherit dataset biases or outdated information that compromise generalizability and clinical reliability. Machine unlearning (MU) offers a means to selectively remove the influence of unwanted data cohorts without necessitating full retraining. This research introduces a sparsity-enhanced unlearning framework for medical image classification, featuring two proposed methods: Fine-Tuning Confusion (FT Confusion) and Gradient Ascent Repair (GA Repair), which are extensions of the standard Fine-Tuning and Gradient Ascent approach. Each method is evaluated across both class-level and instance-level forgetting tasks. Experimental results demonstrate that FT Confusion achieves retraining-level performance in class-wise forgetting, whereas GA Repair most closely approximates retraining in random instance-level scenarios. Furthermore, model sparsity consistently narrowed the gap between approximate unlearning and complete retraining, thereby improving efficiency and stability. These findings indicate that no single strategy is universally optimal; instead, a complementary portfolio is needed, with FT Confusion most effective for class-level bias mitigation and GA Repair for heterogeneous patient-level removal. Our contribution lies in enhancing two widely used MU baselines (fine-tuning and gradient ascent) with optimization-driven mechanisms, providing clearer theoretical grounding and improved reliability over existing approximate unlearning methods. Overall, this work highlights the feasibility of scalable unlearning in clinical workflows, supporting the development of adaptive, bias-aware, and regulator-ready medical AI systems.","","979-8-3315-6105-5","10.1109/BECITHCON69222.2025.11504291","","https://ieeexplore.ieee.org/stamp/stamp.jsp?arnumber=11504291","Machine Unlearning;Healthcare;Model Sparsification;Optimization;Deep Learning","Modeling;Maintenance engineering;Printing;Gallium;Machining;Medical services;Biomedical imaging;Training;Tuning;Accuracy","","","","24","IEEE","8 May 2026","29-30 Nov. 2025","29-30 Nov. 2025","IEEE","IEEE Conferences"
