"Boundary Unlearning: Rapid Forgetting of Deep Networks via Shifting the Decision Boundary","M. Chen; W. Gao; G. Liu; K. Peng; C. Wang","Hubei Key Laboratory of Smart Internet Technology, School of EIC, Huazhong University of Science and Technology, Wuhan, China; Hubei Key Laboratory of Smart Internet Technology, School of EIC, Huazhong University of Science and Technology, Wuhan, China; Hubei Key Laboratory of Smart Internet Technology, School of EIC, Huazhong University of Science and Technology, Wuhan, China; Hubei Key Laboratory of Smart Internet Technology, School of EIC, Huazhong University of Science and Technology, Wuhan, China; Hubei Key Laboratory of Smart Internet Technology, School of EIC, Huazhong University of Science and Technology, Wuhan, China",2023 IEEE/CVF Conference on Computer Vision and Pattern Recognition (CVPR),"22 Aug 2023","2023","","","7766","7775","The practical needs of the “right to be forgotten” and poisoned data removal call for efficient machine unlearning techniques, which enable machine learning models to unlearn, or to forget a fraction of training data and its lineage. Recent studies on machine unlearning for deep neural networks (DNNs) attempt to destroy the influence of the forgetting data by scrubbing the model parameters. However, it is prohibitively expensive due to the large dimension of the parameter space. In this paper, we refocus our attention from the parameter space to the decision space of the DNN model, and propose Boundary Unlearning, a rapid yet effective way to unlearn an entire class from a trained DNN model. The key idea is to shift the decision boundary of the original DNN model to imitate the decision behavior of the model retrained from scratch. We develop two novel boundary shift methods, namely Boundary Shrink and Boundary Expanding, both of which can rapidly achieve the utility and privacy guarantees. We extensively evaluate Boundary Unlearning on CIFAR-10 and Vggface2 datasets, and the results show that Boundary Unlearning can effectively forget the forgetting class on image classification and face recognition tasks, with an expected speed-up of 17x and 19x, respectively, compared with retraining from the scratch.","2575-7075","979-8-3503-0129-8","10.1109/CVPR52729.2023.00750","National Natural Science Foundation of China(grant numbers:62272183,62171189); ","https://ieeexplore.ieee.org/stamp/stamp.jsp?arnumber=10203289","Adversarial attack and defense","Training;Privacy;Face recognition;Pipelines;Training data;Artificial neural networks;Machine learning","","76","","39","IEEE","22 Aug 2023","17-24 June 2023","17-24 June 2023","IEEE","IEEE Conferences"
"Learn to Unlearn for Deep Neural Networks: Minimizing Unlearning Interference with Gradient Projection","T. Hoang; S. Rana; S. Gupta; S. Venkatesh","A2I2, Deakin University; A2I2, Deakin University; A2I2, Deakin University; A2I2, Deakin University",2024 IEEE/CVF Winter Conference on Applications of Computer Vision (WACV),"9 Apr 2024","2024","","","4807","4816","Recent data-privacy laws have sparked interest in machine unlearning, which involves removing the effect of specific training samples from a learnt model as if they were never present in the original training dataset. The challenge of machine unlearning is to discard information about the ""forget"" data in the learnt model without altering the knowledge about the remaining dataset and to do so more efficiently than the naive retraining approach. To achieve this, we adopt a projected-gradient based learning method, named as Projected-Gradient Unlearning (PGU), in which the model takes steps in the orthogonal direction to the gradient subspaces deemed unimportant for the retaining dataset, so as to its knowledge is preserved. By utilizing Stochastic Gradient Descent (SGD) to update the model weights, our method can efficiently scale to any model and dataset size. We provide empirically evidence to demonstrate that our unlearning method can produce models that behave similar to models retrained from scratch across various metrics even when the training dataset is no longer accessible. Our code is available at https://github.com/hnanhtuan/projected_gradient_unlearning.","2642-9381","979-8-3503-1892-0","10.1109/WACV57701.2024.00475","Australian Research Council; ","https://ieeexplore.ieee.org/stamp/stamp.jsp?arnumber=10483632","Algorithms;Explainable;fair;accountable;privacy-preserving;ethical computer vision","Training;Measurement;Learning systems;Data privacy;Computer vision;Training data;Stochastic processes","","17","","48","IEEE","9 Apr 2024","3-8 Jan. 2024","3-8 Jan. 2024","IEEE","IEEE Conferences"
"Towards Enforcement of the EU GDPR: Enabling Data Erasure","S. Sarkar; J. -P. Banatre; L. Rilling; C. Morin","Univ Rennes, IRISA, France; Univ Rennes, IRISA, France; DGA, France; Univ Rennes, IRISA, France","2018 IEEE International Conference on Internet of Things (iThings) and IEEE Green Computing and Communications (GreenCom) and IEEE Cyber, Physical and Social Computing (CPSCom) and IEEE Smart Data (SmartData)","3 Jun 2019","2018","","","222","229","With the emergence of the Internet of Things (IoT), an increasing need for preserving the privacy of personal data has been realized. In this context, the EU has recently published the general data protection regulation (GDPR), which ensures strengthening of the privacy rights of the data subjects concerning their personal data. In this paper, we present the importance of having a holistic solution aimed towards the enforcement of the GDPR. As a first step towards the enforcement of the GDPR, we present the research challenges in facilitating the erasure of data as per the right to erasure. We also propose the envisaged technical solutions to work through the challenges.","","978-1-5386-7975-3","10.1109/Cybermatics_2018.2018.00067","","https://ieeexplore.ieee.org/stamp/stamp.jsp?arnumber=8726847","Personal data privacy;EU GDPR;Internet of Things (IoT);Data erasure","General Data Protection Regulation;Process control;Internet of Things;Data models;Stakeholders","","7","","32","IEEE","3 Jun 2019","30 July-3 Aug. 2018","30 July-3 Aug. 2018","IEEE","IEEE Conferences"
"Securing One-Class Federated Learning Classifiers Against Trojan Attacks in Smart Grid","A. H. Bondok; M. Badr; M. Mahmoud; M. Alsabaan; M. M. Fouda; M. Abdallah","Department of Computer Science, Eastern Connecticut State University, Willimantic, CT, USA; Department of Network and Computer Security, College of Engineering, SUNY Polytechnic Institute, Utica, NY, USA; Department of Electrical and Computer Engineering, Tennessee Tech University, Cookeville, TN, USA; Department of Computer Engineering, College of Computer and Information Sciences, King Saud University, Riyadh, Saudi Arabia; Department of Electrical and Computer Engineering, College of Science and Engineering, Idaho State University, Pocatello, ID, USA; Hamad Bin Khalifa University, Al-Doha, Qatar",IEEE Internet of Things Journal,"5 Feb 2025","2025","12","4","4006","4021","Existing literature confirms the ability of machine learning to identify fraudulent smart grid power consumers who report false consumption readings to pay less electricity bills. Additionally, federated learning (FL) shows promise as a way to train the detection model without requiring data sharing, thereby safeguarding consumer privacy. However, malicious participants (i.e., clients) in FL training can launch adversarial attacks by training their local models with specially crafted low-consumption data to inject a Trojan into the global model. This Trojan can then be activated during the evaluation phase to evade the detection of false data. To the best of our knowledge, not enough research has been done on this topic in the context of unsupervised learning. The absence of labels in unsupervised learning exacerbates the effectiveness of Trojan attacks and renders it more challenging to design robust defense mechanisms. In this article, we first investigate the vulnerability of one-class classifiers to Trojan attacks. Then, we propose two defense approaches named layerwise close-to-median (LWCM) and Machine Unlearning to counter this attack. In LWCM, by choosing a FL client whose last layer model parameters are near to the median of all clients’ last layer parameters to update the global model, we can identify and exclude malicious updates. The idea is that the last layer parameters of honest clients should be similar, whereas those from malicious clients are different. With the majority of clients being honest, the median values are closer to the parameters of these clients, facilitating the detection of malicious clients. In Machine Unlearning, we utilize gradient ascent-based techniques to adapt models by selectively removing attacker-related data points. This is possible because honest clients generate data resembling that of malicious clients and employ a dual-component loss function to maintain model proficiency in recognizing benign power consumption patterns while eliminating malicious patterns. To show the seriousness of Trojan attacks and the effectiveness of our countermeasures, many experiments have been carried out.","2327-4662","","10.1109/JIOT.2024.3481213","Researchers Supporting Project(grant numbers:RSPD2025R636); King Saud University, Riyadh, Saudi Arabia and SUNY, USA(grant numbers:900200-02); ","https://ieeexplore.ieee.org/stamp/stamp.jsp?arnumber=10720069","And smart grid (SG) automatic metering infrastructure;federated learning (FL);one-class classifiers;security;Trojan attacks","Electricity;Data models;Trojan horses;Training;Smart grids;Detectors;Computational modeling;Data privacy;Unsupervised learning;Supervised learning","","7","","62","IEEE","16 Oct 2024","15 Feb.15, 2025","","IEEE","IEEE Journals"
"FedCSA: Boosting the Convergence Speed of Federated Unlearning under Data Heterogeneity","Z. Wang; D. M. Alghazzawi; L. Cheng; G. Liu; C. Wang; Z. Cheng; Y. Yang","Key Laboratory of Intelligent Sensing System and Security (Ministry of Education), School of Artificial Intelligence, Hubei University, Wuhan, China; King Abdulaziz University, Jeddah, Saudi Arabia; Key Laboratory of Intelligent Sensing System and Security (Ministry of Education), School of Artificial Intelligence, Hubei University, Wuhan, China; Huazhong University of Science and Technology, Wuhan, China; Huazhong University of Science and Technology, Wuhan, China; Key Laboratory of Intelligent Sensing System and Security (Ministry of Education), School of Artificial Intelligence, Hubei University, Wuhan, China; Key Laboratory of Intelligent Sensing System and Security (Ministry of Education), School of Artificial Intelligence, Hubei University, Wuhan, China","2023 IEEE Intl Conf on Parallel & Distributed Processing with Applications, Big Data & Cloud Computing, Sustainable Computing & Communications, Social Computing & Networking (ISPA/BDCloud/SocialCom/SustainCom)","11 Apr 2024","2023","","","388","393","The exponential growth of the Internet and the widespread availability of personal data have raised significant concerns regarding personal privacy and societal security. In response, the “right to be forgotten” has emerged as a fundamental principle, empowering individuals to request the removal of their personal data. Though relieving the privacy concerns at a certain degree by doing so, Artificial Intelligence (AI) models, trained by personal data, still suffers from privacy leakage risks. Therefore, machine unlearning attracts great attention from both industry and academia, aiming at erasing the risks of privacy leakage of AI models. However, existing machine unlearning methods primarily operate within centralized frame-works, limiting their applicability to decentralized Federated Learning (FL) settings where data is decentralized and not directly accessible. Additionally, current federated unlearning methods only approximate data deletion, leaving a potential risk of data leakage. To address these issues, this paper presents FedCSA, The FedCSA approach adopts a divide-and-conquer strategy by clustering and slicing the users’ data. Subsequently, submodels are trained on each individual slice, and their aggregation yields the global model. During the unlearning task, only the corresponding sub-model undergoes retraining, significantly reducing training time while ensuring data privacy and achieving precise data deletion. Extensive experiments are conducted on real-world datasets, including MNIST, Fashion-MNIST, and CIFAR-10, to evaluate the performance of FedCSA. The results demonstrate that FedCSA outperforms state-of-the-art machine learning methods, such as retrain and SISA, in terms of efficiency and global model performance. Our code is publicly available at https://github.com/ZhenWang9/FedCSA.","","979-8-3503-2922-3","10.1109/ISPA-BDCloud-SocialCom-SustainCom59178.2023.00083","National Natural Science Foundation of China; ","https://ieeexplore.ieee.org/stamp/stamp.jsp?arnumber=10491845","Privacy;Federated Unlearning;Federated Learning","Training;Data privacy;Privacy;Limiting;Scalability;Data models;Robustness","","3","","14","IEEE","11 Apr 2024","21-24 Dec. 2023","21-24 Dec. 2023","IEEE","IEEE Conferences"
"Identify Backdoored Model in Federated Learning via Individual Unlearning","J. Xu; Z. Zhang; R. Hu","University of Nevada, Reno; University of Nevada, Reno; University of Nevada, Reno",2025 IEEE/CVF Winter Conference on Applications of Computer Vision (WACV),"8 Apr 2025","2025","","","7960","7969","Backdoor attacks present a significant threat to the robustness of Federated Learning (FL) due to their stealth and effectiveness. They maintain both the main task of the FL system and the backdoor task simultaneously, causing malicious models to appear statistically similar to benign ones, which enables them to evade detection by existing defense methods. We find that malicious parameters in backdoored models are inactive on the main task, resulting in a significantly large empirical loss during the machine unlearning process on clean inputs. Inspired by this, we propose MASA, a method that utilizes individual unlearning on local models to identify malicious models in FL. To improve the performance of MASA in challenging non-independent and identically distributed (non-IID) settings, we design pre-unlearning model fusion that integrates local models with knowledge learned from other datasets to mitigate the divergence in their unlearning behaviors caused by the non-IID data distributions of clients. Additionally, we propose a new anomaly detection metric with minimal hyperparameters to filter out malicious models efficiently. Extensive experiments on IID and non-IID datasets across six different attacks validate the effectiveness of MASA. To the best of our knowledge, this is the first work to leverage machine unlearning to identify malicious models in FL. Code is available at https://github.com/JiiahaoXU/MASA.","2642-9381","979-8-3315-1083-1","10.1109/WACV61041.2025.00773","","https://ieeexplore.ieee.org/stamp/stamp.jsp?arnumber=10944040","","Measurement;Computer vision;Codes;Federated learning;Computational modeling;Distributed databases;Information filters;Data models;Robustness;Anomaly detection","","2","","53","IEEE","8 Apr 2025","26 Feb.-6 March 2025","26 Feb.-6 March 2025","IEEE","IEEE Conferences"
"A Distributed Ledger Technology Design using Hyperledger Fabric and a Clinical Trial Use Case","D. R. Kuhn; J. D. Roberts; D. Ferraiolo; J. DeFranco","National Institute of Standards and Technology, Gaithersburg, MD, USA; National Institute of Standards and Technology, Gaithersburg, MD, USA; National Institute of Standards and Technology, Gaithersburg, MD, USA; The Pennsylvania State University, Malvern, PA, USA",2022 IEEE 29th Annual Software Technology Conference (STC),"18 Nov 2022","2022","","","168","173","Industry continues to be challenged when attempting to share data among organizations, especially when the data comes from different database management systems (DBMS) and different DBMS schemas. Another concern is that privacy laws may require some types of data to be protected under local access policies. We describe a secure data sharing solution using Next-generation Database Access Control (NDAC) and the Data Block Matrix (DBM). A clinical trial data use case is discussed, as well as a description of a proof-of-concept implementation of the DBM using Hyperledger Fabric. The solution described allows data access where the data resides, rather than exchanging or being centrally stored. Additionally, it solves the conflict between conventional blockchain use and privacy regulations, by using a form of distributed ledger technology that meets ‘right to erasure’ requirements.","","978-1-6654-8864-8","10.1109/STC55697.2022.00031","","https://ieeexplore.ieee.org/stamp/stamp.jsp?arnumber=9951040","Distributed Ledgers;Blockchain;Data Sharing;Access Control","Data privacy;Privacy;Distributed ledger;Scalability;Organizations;Clinical trials;Fabrics","","2","","18","IEEE","18 Nov 2022","3-6 Oct. 2022","3-6 Oct. 2022","IEEE","IEEE Conferences"
"On the Reliability of Membership Inference Attacks","A. R. Chowdhury; Z. Kong; K. Chaudhuri","University of Michigan, Ann Arbor; University of California, San Diego; University of California, San Diego",2025 IEEE Conference on Secure and Trustworthy Machine Learning (SaTML),"22 May 2025","2025","","","534","549","A membership inference (MI) attack predicts whether a data point was used for training a machine learning (ML) model. MI attacks are currently the most widely deployed attack for auditing privacy of a ML model. A recent work by Thudi et. al. [34] show that approximate machine unlearning is ill-defined. For this, they introduce the notion of forgeability where using forged datasets, one could unlearn without modifying the model at all. In this paper, we show a connection between machine unlearning and membership inferencing. Specifically, we study how to leverage forgeability to repudiate claims on membership inferencing. We show that the ability to forge enables the dataset owner to construct a Witness-of-Repudiation (WoR) which empowers the dataset owner to plausibly repudiate the predictions of an MI attack. This casts a doubt on the reliability of MI attacks in practice. Our empirical evaluations show that it is possible to construct WoRs efficiently.","","979-8-3315-1711-3","10.1109/SaTML64287.2025.00036","","https://ieeexplore.ieee.org/stamp/stamp.jsp?arnumber=10992350","Membership Inferencing;Machine Learning Privacy","Training;Privacy;Machine learning;Predictive models;Data models;Reliability","","","","41","IEEE","22 May 2025","9-11 April 2025","9-11 April 2025","IEEE","IEEE Conferences"
"A2E: Black-Box Anti-Adversarial Example Based Watermarking to Verify Federated Unlearning","X. Gao; J. Wang; Z. Zhang; J. Chen; P. Cheng; J. Chen","Zhejiang University, Hangzhou, China; Zhejiang University, Hangzhou, China; Zhejiang University, Hangzhou, China; Zhejiang University, Hangzhou, China; Zhejiang University, Hangzhou, China; Zhejiang University, Hangzhou, China",IEEE Transactions on Dependable and Secure Computing,"15 Jan 2026","2026","23","1","66","81","Machine unlearning is the primary way to fight for the “right to be forgotten” in machine learning field, which is promoted among multiple privacy legislations, such as GDPR and CCPA. However, the latest work has shown that machine unlearning in deep learning cannot be easily verified, making it challenging for the data owners to be convinced that their data has indeed been deleted as claimed. This is especially problematic for federated learning (FL), where a number of participants jointly train a global model while each participant should be free to join and leave the federation as they wish. However, the lack of a reliable approach to verify unlearning in FL will no doubt discourage certain users from joining the federation. In this work, we propose A2E, a black-box watermarking scheme from a leaving participant’s perspective to realize verifiable federated unlearning which incurs minimum impact and no security threats to vanilla FL. The key idea is to leverage adversarial training to inject the anti-adversarial example (A2E) characteristic into the uploaded model updates of the last contribution round as the watermark of the leaving participant. Then, we verify whether the server has indeed executed the effective unlearning, with the newly developed probabilistic quantification of unlearning confidence, by checking the unlearned global model’s resistance to the specially generated watermark-dependent adversarial examples of the leaver. We conducted large-scale experiments on various popular datasets (including natural images, medical images, and speech) and model structures (including LeNet, ResNet, VGG, and LSTM). The results confirm the effectiveness of A2E in verifying federated unlearning with a high confidence. We also show that A2E is robust against multiple adaptive strategies from the adversarial server and participants.","1941-0018","","10.1109/TDSC.2025.3598987","Key R&D Program of Zhejiang(grant numbers:2025C01083,2025C01061); National Natural Science Foundation of China(grant numbers:62293511,62441618); ","https://ieeexplore.ieee.org/stamp/stamp.jsp?arnumber=11144455","Federated unlearning;anti-adversarial example;black-box;watermark;verify","Data models;Watermarking;Computational modeling;Servers;Adaptation models;Closed box;Training;Predictive models;Federated learning;Probabilistic logic","","","","59","IEEE","29 Aug 2025","Jan.-Feb. 2026","","IEEE","IEEE Journals"
"Part: I Fundamentals of AI","A. Banafa",NA,Artificial Intelligence in Action: Real-World Applications and Innovations,"","2025","","","1","2","This comprehensive book dives deep into the current landscape of AI, exploring its fundamental principles, development challenges, potential risks, and the cutting-edge breakthroughs that are propelling it forward. Artificial intelligence (AI) is rapidly transforming industries and societies worldwide through groundbreaking innovations and real-world applications. Starting with the core concepts, the book examines the various types of AI systems, generative AI models, and the complexities of machine learning. It delves into the programming languages driving AI development, data pipelines, model creation and deployment processes, while shedding light on issues like AI hallucinations and the intricate path of machine unlearning. The book then showcases the remarkable real-world applications of AI across diverse domains. From preventing job displacement and promoting environmental sustainability, to enhancing disaster response, drone technology, and even nuclear energy innovation, it highlights how AI is tackling complex challenges and driving positive change. The book also explores the double-edged nature of AI, recognizing its tremendous potential while cautioning about the risks of misuse, unintended consequences, and the urgent need for responsible development practices. It examines the intersection of AI and fields like operating system design, warfare, and semiconductor technology, underscoring the wide-ranging implications of this transformative force. As the quest for artificial general intelligence (AGI) and superintelligent AI systems intensifies, the book delves into cutting-edge research, emerging trends, and the pursuit of multimodal, explainable, and causally aware AI systems. It explores the symbiotic relationship between AI and human creativity, the rise of user-friendly ""casual AI,"" and the potential of AI to tackle open-ended tasks. This is an essential guide for understanding the profound impact of AI on our world today and its potential to shape our future. From the frontiers of innovation to the challenges of responsible development, this book offers a comprehensive and insightful exploration of the remarkable real-world applications and innovations driving the AI revolution.","","9788770046190","","","https://ieeexplore.ieee.org/xpl/ebooks/bookPdfWithBanner.jsp?fileName=10948968.pdf&bkn=10948919&pdfType=chapter","","","","","","","","3 Apr 2025","","","River Publishers","River eBook Chapters"
