Title,Takeaway,Authors,Year,Citations,Abstract,Study Type,Journal,Journal SJR Quartile,DOI,Consensus Link
Incentivized Federated Learning and Unlearning,"Incentivized federated learning and unlearning can reduce server costs and user engagement, potentially saving up to 53.91% compared to state-of-the-art benchmarks.","Ningning Ding, Zhenyu Sun, Ermin Wei, R. Berry",2023,9,"To protect users’ right to be forgotten in federated learning, federated unlearning aims at eliminating the impact of leaving users’ data on the global learned model. The current research in federated unlearning mainly concentrates on developing effective and efficient unlearning techniques. However, the issue of incentivizing valuable users to remain engaged and preventing their data from being unlearned is still under-explored, yet important to the unlearned model performance. This paper focuses on the incentive issue and develops an incentive mechanism for federated learning and unlearning. We first characterize the leaving users’ impact on the global model accuracy and the required communication rounds for unlearning. Building on these results, we propose a four-stage game to capture the interaction and information updates during the learning and unlearning process. A key contribution is to summarize users’ multi-dimensional private information into one-dimensional metrics to guide the incentive design. Interestingly, we prove that allowing federated unlearning can result in reduced payoffs for both the server and users, compared to a scenario without unlearning. Numerical results demonstrate the necessity of unlearning incentives for retaining valuable leaving users, and also show that our proposed mechanisms decrease the server's cost by up to 53.91% compared to state-of-the-art benchmarks.",,IEEE Transactions on Mobile Computing,1.0,10.1109/tmc.2025.3557857,https://consensus.app/papers/incentivized-federated-learning-and-unlearning-ding-sun/79e9e114214c5073baee4991a2391a6b/
FedWiper: Federated Unlearning via Universal Adapter,"FedWiper enables exact unlearning in federated learning by erasing specific data and its impact from the federated model, ensuring minimal loss of model performance.","Shuai Zhao, Junying Zhang, Xindi Ma, Qi Jiang, Zhuo Ma, Sheng Gao, Zuobing Ying, Jianfeng Ma",2025,6,"Privacy preservation are becoming increasingly significant in machine learning, with recent privacy regulations requiring the deletion of personal data and its impact on models. Although erasing data from storage is simple, removing the influence of data on models remains a challenge. Federated unlearning is an emerging paradigm that aims to forget the knowledge contributed by some specific data to the federated model. In this paper, we design a novel federated unlearning strategy, named FedWiper, which enables exact unlearning in federated learning by erasing specific data and its impact from the federated model. Specifically, based on the granularity of the dataset, we propose training multiple federated submodels to construct a federated unlearning framework, thereby narrowing the scope of the impact of wiped data. Furthermore, the proposed Uni-Adapter structure effectively mitigates the negative impact on model performance from diminishing the dataset scale, while also reducing communication cost. Rather than focusing solely on achieving indistinguishability unlearning of the model for classification task, we extend FedWiper to unlearning for multiple types of tasks and achieve the exact unlearning. Experiments demonstrate that FedWiper can not only accelerate federated unlearning, but also achieve exact unlearning across multiple types of tasks in federated learning while ensuring minimal loss of model performance. Our Code: https://github.com/grey1989/FedWiper.",,IEEE Transactions on Information Forensics and Security,1.0,10.1109/tifs.2025.3557671,https://consensus.app/papers/fedwiper-federated-unlearning-via-universal-adapter-zhao-zhang/58c0ef7a2a0c5eec85035b9bd85fe898/
Don't Forget Too Much: Towards Machine Unlearning on Feature Level,"Feature unlearning, a refined granularity unlearning scheme, effectively unlearns features within instances, improving model utility and granularity in unlearning machine models.","Heng Xu, Tianqing Zhu, Wanlei Zhou, Wei Zhao",2024,10,"Machine unlearning enables pre-trained models to remove the effect of certain portions of training data. Previous machine unlearning schemes have mainly focused on unlearning a cluster of instances or all instances belonging to a specific class. These types of unlearning might have a significant impact on the model utility; and they may be inadequate for situations where we only need to unlearn features within instances, rather than the whole instances. Due to the different granularity, current unlearning methods can hardly achieve feature-level unlearning. To address the challenges of utility and granularity, we propose a refined granularity unlearning scheme referred to as “feature unlearning”. We first explore two distinct scenarios based on whether the annotation information about the features is given: feature unlearning with known annotations and feature unlearning without annotations. Regarding unlearning with known annotations, we propose an adversarial learning approach to automatically remove effects about features. For unlearning without annotations, we initially enable the output of one model's layer to identify different pattern features using model interpretability techniques. We proceed to filter features from instances based on these outputs with identifying ability. So that we can remove the feature impact based on filtered instances and the fine-tuning process. The effectiveness of our proposed approach is demonstrated through experiments involving diverse models on various datasets in different scenarios.",,IEEE Transactions on Dependable and Secure Computing,1.0,10.1109/tdsc.2024.3432169,https://consensus.app/papers/dont-forget-too-much-towards-machine-unlearning-on-feature-xu-zhu/46a80698af8d50f1a010e0909550b02a/
FedMUA: Exploring the Vulnerabilities of Federated Learning to Malicious Unlearning Attacks,FedMUA effectively induces misclassification on target samples and can achieve an 80% attack success rate with only 0.3% malicious unlearning requests in federated learning.,"Jian Chen, Zehui Lin, Wanyu Lin, Wenlong Shi, Xiaoyan Yin, Di Wang",2025,8,"Recently, the practical needs of “the right to be forgotten” in federated learning gave birth to a paradigm known as federated unlearning, which enables the server to forget personal data upon the client’s removal request. Existing studies on federated unlearning have primarily focused on efficiently eliminating the influence of requested data from the client’s model without retraining from scratch, however, they have rarely doubted the reliability of the global model posed by the discrepancy between its prediction performance before and after unlearning. To bridge this gap, we take the first step by introducing a novel malicious unlearning attack dubbed FedMUA, aiming to unveil potential vulnerabilities emerging from federated learning during the unlearning process. Specifically, clients may act as attackers by crafting malicious unlearning requests to manipulate the prediction behavior of the global model. The crux of FedMUA is to mislead the global model into unlearning more information associated with the influential samples for the target sample than anticipated, thus inducing adverse effects on target samples from other clients. To achieve this, we design a novel two-step method, known as Influential Sample Identification and Malicious Unlearning Generation, to identify and subsequently generate malicious feature unlearning requests within the influential samples. By doing so, we can significantly alter the predictions pertaining to the target sample by initiating the malicious feature unlearning requests, leading to the deliberate manipulation for the user adversely. Additionally, we design a new defense mechanism that is highly resilient against malicious unlearning attacks. Extensive experiments on three realistic datasets reveal that FedMUA effectively induces misclassification on target samples and can achieve an 80% attack success rate by triggering only 0.3% malicious unlearning requests.",,IEEE Transactions on Information Forensics and Security,1.0,10.1109/tifs.2025.3531141,https://consensus.app/papers/fedmua-exploring-the-vulnerabilities-of-federated-chen-lin/2a363edaf6b957febbfce358502c5ca5/
Efficient Vertical Federated Unlearning via Fast Retraining,"Our vertical federated unlearning framework can achieve up to 6.3x speedup in erasing one's contribution from a shared model, with minimal impact on the original learning task.","Zichen Wang, Xiangshan Gao, Cong Wang, Peng Cheng, Jiming Chen",2024,23,"Vertical federated learning (VFL) revolutionizes privacy-preserved collaboration for small businesses that have distinct but complementary feature sets. However, as the scope of VFL expands, the constant entering and leaving of participants and the subsequent exercise of the “right to be forgotten” pose a great challenge in practice. The question of how to efficiently erase one’s contribution from the shared model remains largely unexplored in the context of VFL. In this article, we introduce a vertical federated unlearning framework, which integrates model checkpointing techniques with a hybrid, first-order optimization technique. The core concept is to reduce backpropagation time and improve convergence/generalization by combining the advantages of the existing optimizers. We provide in-depth theoretical analysis and time complexity to illustrate the effectiveness of the proposed design. We conduct extensive experiments on six public datasets and demonstrate that our method could achieve up to 6.3× speedup compared to the baseline, with negligible influence on the original learning task.",,ACM Transactions on Internet Technology,1.0,10.1145/3657290,https://consensus.app/papers/efficient-vertical-federated-unlearning-via-fast-wang-gao/6019261d2a6653978917648ceb2b23b0/
Private Data Protection With Machine Unlearning for Next-Generation Networks,"Our machine unlearning approach effectively erases private data from next-generation networks, reducing privacy risks and requiring less storage than traditional retraining methods.","Kongyang Chen, Yiwen Wang, Lan Zhao, Caiyun Jiang, Haiyan Mai, Yuanyi Wu, Huanqi Hong, Yuanyuan Shen, Jian Mo, Lin-Lu Huang, Jun Peng, Xiaoying Wang, Qintai Yang",2025,5,"In next-generation networks, distributed clients collaborate to generate an aggregated global model tailored for various vertical applications. However, this convenience comes at the cost of potential privacy risks, as personal information may be exposed within the global model aggregation process. In response, the right to be forgotten was introduced, granting individuals the right to withdraw their consent for the processing of their personal information. To address this challenge, machine unlearning has been developed, enabling models to erase any memory of private data. Previous approaches, such as retraining or incremental learning, often require additional storage or are difficult to implement in neural networks. Our method, by contrast, introduces a small perturbation to the model’s weights, guiding it to iteratively move towards a model trained only on the remaining data subset until the contribution of the unlearned data is completely removed. In our approach, machine unlearning is conceptualized as a process that iteratively adjusts the initial model to remove any trace of the forgotten data. Our key contribution is the introduction of a reference model, trained on a subset of the remaining data, which guides the target unlearning model toward successfully forgetting the data. Additionally, we discuss two evaluation methods-membership inference and backdoor evaluation-that effectively assess the success of our machine unlearning approach. These methods verify whether the private data has truly been forgotten by the target unlearning model. Through experiments on five datasets, we demonstrate the effectiveness of our approach, which is $15\times $ faster than the traditional retraining method.",,IEEE Open Journal of the Communications Society,1.0,10.1109/ojcoms.2024.3518503,https://consensus.app/papers/private-data-protection-with-machine-unlearning-for-chen-wang/8ea8a54ccf1457cab484518c1dd2904c/
Mitigating Poor Data Quality Impact with Federated Unlearning for Human-Centric Metaverse,MetaFul improves model accuracy by at least 2.5% and decreases user perception time by at least 19.3% in human-centric metaverse by removing low-quality training models at the server side.,"Pengfei Wang, Zongzheng Wei, Heng Qi, Shaohua Wan, Yunming Xiao, Geng Sun, Qiang Zhang",2024,34,"Federated Learning (FL), which has been employed to train machine learning models on the data with a distributed manner, could enhance the immersive user experience for the human-centric metaverse. However, it’s challenging to train machine learning models accurately and promptly with FL for the human-centric metaverse due to massive data communication and user unreliability. User experience could be negatively affected by using low-quality machine learning models for human-centric metaverse, e.g., it cannot scrutinize and arrive at decisions accurately and timely. To resolve this pressing issue, we propose MetaFul a federated unlearning solution which reduces the negative influences of low-quality data with no data transmission by removing low-quality training models at the server side. To be specific, MetaFul includes three main components. (i) Low-throughput federated learning (LT-FL) addresses the issue of large model transmission in FL by decreasing the dimension and the number of transmitted model parameters. (ii) Loss-based model quality assessment (LM-QA) utilizes the model loss generated in LT-FL to estimate user data quality. (iii) Non-communicative federated unlearning (NC-FUL) revokes the low-quality data impact on the FL model with careful designed federated unlearning at the server side. Both LM-QA and NC-FUL have no communications with clients. Finally, extensive evaluations are conducted to show MetaFul could improve the model accuracy by at least 2.5% and decrease the user perception time by at least 19.3% in human-centric metaverse compared to benchmarks.",,IEEE Journal on Selected Areas in Communications,1.0,10.1109/jsac.2023.3345388,https://consensus.app/papers/mitigating-poor-data-quality-impact-with-federated-wang-wei/7deb6627baa551fc9280aace133888bd/
Machine unlearning in brain-inspired neural network paradigms,"The hybrid approach for machine unlearning in Spiking Neuron Models effectively eliminates targeted information while maintaining or enhancing neural network performance, making it practical and efficient for real-world AI systems.","Chaoyi Wang, Zuobin Ying, Zijie Pan",2024,3,"Machine unlearning, which is crucial for data privacy and regulatory compliance, involves the selective removal of specific information from a machine learning model. This study focuses on implementing machine unlearning in Spiking Neuron Models (SNMs) that closely mimic biological neural network behaviors, aiming to enhance both flexibility and ethical compliance of AI models. We introduce a novel hybrid approach for machine unlearning in SNMs, which combines selective synaptic retraining, synaptic pruning, and adaptive neuron thresholding. This methodology is designed to effectively eliminate targeted information while preserving the overall integrity and performance of the neural network. Extensive experiments were conducted on various computer vision datasets to assess the impact of machine unlearning on critical performance metrics such as accuracy, precision, recall, and ROC AUC. Our findings indicate that the hybrid approach not only maintains but in some cases enhances the neural network's performance post-unlearning. The results confirm the practicality and efficiency of our approach, underscoring its applicability in real-world AI systems.",,Frontiers in Neurorobotics,2.0,10.3389/fnbot.2024.1361577,https://consensus.app/papers/machine-unlearning-in-braininspired-neural-network-wang-ying/a099f80a196556d0ba052a05e7e21bb8/
Certified Unlearning for Federated Recommendation,"CFRU, a novel federated recommendation unlearning model, efficiently removes target clients from the global model while maintaining model quality and performance up to 1,000 times faster than retraining from scratch.","T. Huynh, Trong Bang Nguyen, Thanh Toan Nguyen, Phi Le Nguyen, Hongzhi Yin, Quoc Viet Hung Nguyen, T. Nguyen",2024,22,"Recommendation systems play a crucial role in providing web-based suggestion utilities by leveraging user behavior, preferences, and interests. In the context of privacy concerns and the proliferation of handheld devices, federated recommender systems have emerged as a promising solution. These systems allow each client to train a local model and exchange only the model updates with a central server, thus preserving data privacy. However, certain use cases necessitate the deduction of contributions from specific clients, a process known as “unlearning.” Existing machine unlearning methods are designed for centralized settings and do not cater to the collaborative nature of recommendation systems, thereby overlooking their unique characteristics. This article proposes CFRU, a novel federated recommendation unlearning model that enables efficient and certified removal of target clients from the global model. Instead of retraining the model, our approach rolls back and eliminates the historical updates associated with the target client. To efficiently store the learning process’s historical updates, we propose sampling strategies that reduce the number of historical updates, retaining only the most significant ones. Furthermore, we analyze the potential bias introduced by the removal of target clients’ updates at each training round and establish an estimation using the Lipschitz condition. Leveraging this estimation, we propose an efficient iterative scheme to accumulate the bias across all rounds, compensating for the removed updates from the global model and recovering its utility without requiring post-training steps. Extensive experiments conducted on two real-world datasets, incorporating two poison attack scenarios, have shown that our unlearning technique can achieve a model quality that is 99.3% equivalent to retraining the model from scratch while performing up to 1,000 times faster.",,ACM Transactions on Information Systems,1.0,10.1145/3706419,https://consensus.app/papers/certified-unlearning-for-federated-recommendation-huynh-nguyen/e2c2173992bf5afcbbf231893da48ac6/
Proof of Unlearning: Definitions and Instantiation,Our new Proof of Unlearning (PoUL) definition framework and hardware-empowered SGX enclave effectively prevent forging attacks and ensure data deletion in machine learning as a service scenarios.,"Jiasi Weng, Shenglong Yao, Yuefeng Du, Jian Weng, Cong Wang",2022,27,"The “Right to be Forgotten” rule in machine learning (ML) practice enables some individual data to be deleted from a trained model, as pursued by recently developed machine unlearning techniques. To truly comply with the rule, a natural and necessary step is to verify if the individual data are indeed deleted after unlearning. Yet, previous parameter-space verification metrics may be easily evaded by a distrustful model trainer. Thus, Thudi et al. recently present a call to action on algorithm-level verification in USENIX Security’22. We respond to the call, by reconsidering the unlearning problem in the scenario of machine learning as a service (MLaaS), and proposing a new definition framework for Proof of Unlearning (PoUL) on algorithm level. Specifically, our PoUL definitions (i) enforce correctness properties on both the pre and post phases of unlearning, so as to prevent the state-of-the-art forging attacks; (ii) highlight proper practicality requirements of both the prover and verifier sides with minimal invasiveness to the off-the-shelf service pipeline and computational workloads. Under the definition framework, we subsequently present a trusted hardware-empowered instantiation using SGX enclave, by logically incorporating an authentication layer for tracing the data lineage with a proving layer for supporting the audit of learning. We customize authenticated data structures to support large out-of-enclave storage with simple operation logic, and meanwhile, enable proving complex unlearning logic with affordable memory footprints in the enclave. We finally validate the feasibility of the proposed instantiation with a proof-of-concept implementation and multi-dimensional performance evaluation.",,IEEE Transactions on Information Forensics and Security,1.0,10.1109/tifs.2024.3358993,https://consensus.app/papers/proof-of-unlearning-definitions-and-instantiation-weng-yao/8fcb3d077f0951189c41747cb2eb3914/
"Exploring Federated Unlearning: Review, Comparison, and Insights","Federated unlearning methods balance privacy, accuracy, and efficiency, with the OpenFederatedUnlearning framework providing a unified benchmark for evaluating their performance.","Yang Zhao, Jiaxi Yang, Yiling Tao, Lixu Wang, Xiaoxiao Li, D. Niyato, H. V. Poor",2023,6,"The increasing demand for privacy-preserving machine learning has spurred interest in federated unlearning, which enables the selective removal of data from models trained in federated systems. However, developing federated unlearning methods presents challenges, particularly in balancing three often conflicting objectives: privacy, accuracy, and efficiency. This paper provides a comprehensive analysis of existing federated unlearning approaches, examining their algorithmic efficiency, impact on model accuracy, and effectiveness in preserving privacy. We discuss key trade-offs among these dimensions and highlight their implications for practical applications across various domains. Additionally, we propose the OpenFederatedUnlearning framework, a unified benchmark for evaluating federated unlearning methods, incorporating classic baselines and diverse performance metrics. Our findings aim to guide practitioners in navigating the complex interplay of these objectives, offering insights to achieve effective and efficient federated unlearning. Finally, we outline directions for future research to further advance the state of federated unlearning techniques.",,IEEE Network,1.0,10.1109/mnet.2025.3571462,https://consensus.app/papers/exploring-federated-unlearning-review-comparison-and-zhao-yang/ffb3b8f0501655c5b8940804ac7d0019/
GDPR and Large Language Models: Technical and Legal Obstacles,"Large Language Models (LLMs) face technical and legal challenges in aligning with GDPR requirements, but a four-layer governance framework can help bridge the gap and promote responsible AI practices.","G. Feretzakis, Evangelia Vagena, Konstantinos Kalodanis, P. Peristera, D. Kalles, Athanasios Anastasiou",2025,18,"Large Language Models (LLMs) have revolutionized natural language processing but present significant technical and legal challenges when confronted with the General Data Protection Regulation (GDPR). This paper examines the complexities involved in reconciling the design and operation of LLMs with GDPR requirements. In particular, we analyze how key GDPR provisions—including the Right to Erasure, Right of Access, Right to Rectification, and restrictions on Automated Decision-Making—are challenged by the opaque and distributed nature of LLMs. We discuss issues such as the transformation of personal data into non-interpretable model parameters, difficulties in ensuring transparency and accountability, and the risks of bias and data over-collection. Moreover, the paper explores potential technical solutions such as machine unlearning, explainable AI (XAI), differential privacy, and federated learning, alongside strategies for embedding privacy-by-design principles and automated compliance tools into LLM development. The analysis is further enriched by considering the implications of emerging regulations like the EU’s Artificial Intelligence Act. In addition, we propose a four-layer governance framework that addresses data governance, technical privacy enhancements, continuous compliance monitoring, and explainability and oversight, thereby offering a practical roadmap for GDPR alignment in LLM systems. Through this comprehensive examination, we aim to bridge the gap between the technical capabilities of LLMs and the stringent data protection standards mandated by GDPR, ultimately contributing to more responsible and ethical AI practices.",,Future Internet,2.0,10.3390/fi17040151,https://consensus.app/papers/gdpr-and-large-language-models-technical-and-legal-feretzakis-vagena/8609b78005c75104b73ca772c1c8c9c0/
