Title,Takeaway,Authors,Year,Citations,Abstract,Study Type,Journal,Journal SJR Quartile,DOI,Consensus Link
Coded Machine Unlearning,Coded machine unlearning provides a better performance versus unlearning cost trade-off compared to the uncoded baseline.,"Nasser Aldaghri, Hessam Mahdavifar, Ahmad Beirami",2020,48,"There are applications that may require removing the trace of a sample from the system, e.g., a user requests their data to be deleted, or corrupted data is discovered. Simply removing a sample from storage units does not necessarily remove its entire trace since downstream machine learning models may store some information about the samples used to train them. A sample can be perfectly unlearned if we retrain all models that used it from scratch with that sample removed from their training dataset. When multiple such unlearning requests are expected to be served, unlearning by retraining becomes prohibitively expensive. Ensemble learning enables the training data to be split into smaller disjoint shards that are assigned to non-communicating weak learners. Each shard is used to produce a weak model. These models are then aggregated to produce the final central model. This setup introduces an inherent trade-off between performance and unlearning cost, as reducing the shard size reduces the unlearning cost but may cause degradation in performance. In this paper, we propose a coded learning protocol where we utilize linear encoders to encode the training data into shards prior to the learning phase. We also present the corresponding unlearning protocol and show that it satisfies the perfect unlearning criterion. Our experimental results show that the proposed coded machine unlearning provides a better performance versus unlearning cost trade-off compared to the uncoded baseline.",,IEEE Access,1.0,10.1109/access.2021.3090019,https://consensus.app/papers/coded-machine-unlearning-aldaghri-mahdavifar/490a95149a8a55d28f733ecc204e7f7c/
A Review on Machine Unlearning,"Machine unlearning is a privacy-preserving method for machine learning models, addressing security and privacy concerns in machine learning platforms.","Haibo Zhang, Toru Nakamura, Takamasa Isohara, Kouichi Sakurai",2023,88,"Recently, an increasing number of laws have governed the useability of users’ privacy. For example, Article 17 of the General Data Protection Regulation (GDPR), the right to be forgotten , requires machine learning applications to remove a portion of data from a dataset and retrain it if the user makes such a request. Furthermore, from the security perspective, training data for machine learning models, i.e., data that may contain user privacy, should be effectively protected, including appropriate erasure. Therefore, researchers propose various privacy-preserving methods to deal with such issues as machine unlearning. This paper provides an in-depth review of the security and privacy concerns in machine learning models. First, we present how machine learning can use users’ private data in daily life and the role that the GDPR plays in this problem. Then, we introduce the concept of machine unlearning by describing the security threats in machine learning models and how to protect users’ privacy from being violated using machine learning platforms. As the core content of the paper, we introduce and analyze current machine unlearning approaches and several representative results and discuss them in the context of the data lineage. Furthermore, we also discuss the future research challenges in this field.",,SN Computer Science,2.0,10.1007/s42979-023-01767-4,https://consensus.app/papers/a-review-on-machine-unlearning-zhang-nakamura/cb76478230d855f5a925c77d0fd304d0/
Towards Natural Machine Unlearning,"Our method for natural machine unlearning involves injecting correct information into forgetting samples, reducing over-forgetting and improving robustness across different unlearning tasks.","Zhengbao He, Tao Li, Xinwen Cheng, Zhehao Huang, Xiaolin Huang",2024,11,"Machine unlearning (MU) aims to eliminate information that has been learned from specific training data, namely forgetting data, from a pretrained model. Currently, the mainstream of relabeling-based MU methods involves modifying the forgetting data with incorrect labels and subsequently fine-tuning the model. While learning such incorrect information can indeed remove knowledge, the process is quite unnatural as the unlearning process undesirably reinforces the incorrect information and leads to over-forgetting. Towards more natural machine unlearning, we inject correct information from the remaining data to the forgetting samples when changing their labels. Through pairing these adjusted samples with their labels, the model tends to use the injected correct information and naturally suppresses the information meant to be forgotten. Albeit straightforward, such a first step towards natural machine unlearning can significantly outperform current state-of-the-art approaches. In particular, our method substantially reduces the over-forgetting problem and leads to strong robustness across different unlearning tasks, making it a promising candidate for practical machine unlearning.",,IEEE Transactions on Pattern Analysis and Machine Intelligence,1.0,10.1109/tpami.2025.3597350,https://consensus.app/papers/towards-natural-machine-unlearning-he-li/80e148d872d65b1c84bf333ceea883b9/
Federated Unlearning: Guarantee the Right of Clients to Forget,"Federated unlearning, using reverse stochastic gradient ascent and elastic weight consolidation, effectively removes data influence from machine learning models, ensuring the Right to be Forgotten in federated learning.","Leijie Wu, Song Guo, Junxiao Wang, Zicong Hong, J. Zhang, Yaohong Ding",2022,115,"The Right to be Forgotten gives a data owner the right to revoke their data from an entity storing it. In the context of federated learning, the Right to be Forgotten requires that, in addition to the data itself, any influence of the data on the FL model must disappear, a process we call “federated unlearning.” The most straightforward and legitimate way to implement federated unlearning is to remove the revoked data and retrain the FL model from scratch. Yet the computational and time overhead associated with fully retraining FL models can be prohibitively expensive. In this article, we take the first step to comprehensively investigate the way to settle the unlearning paradigm in the context of federated learning. First, we define the problem of efficient federated unlearning, including its challenges and goals, and we identify three common types of federated unlearning requests: class unlearning, client unlearning, and sample unlearning. Based on those challenges and goals, a general pipeline is proposed for federated unlearning for the above three types of requests. We revisit how the training data affects the final FL model performance and thereby empowers the proposed framework with the reverse stochastic gradient ascent (SGA) and elastic weight consolidation (EWC). Various experiments are conducted to verify effectiveness of the proposed method in both aspects of unlearning efficacy and efficiency. We believe the proposed method will perform as an essential component for future machine unlearning systems.",,IEEE Network,1.0,10.1109/mnet.001.2200198,https://consensus.app/papers/federated-unlearning-guarantee-the-right-of-clients-to-wu-guo/9dbbee85a66057de9763f1e633c7de8c/
DP2Unlearning: An Efficient and Guaranteed Unlearning Framework for LLMs,"DP2Unlearning is a novel LLM unlearning framework that offers formal forgetting guarantees at a significantly lower cost than retraining from scratch on retained data, outperforming approximate unlearning methods.","T. Mahmud, N. Jebreel, Josep Domingo-Ferrer, David Sánchez",2025,4,,,Neural networks : the official journal of the International Neural Network Society,1.0,10.1016/j.neunet.2025.107879,https://consensus.app/papers/dp2unlearning-an-efficient-and-guaranteed-unlearning-mahmud-jebreel/c070c98634be5d4facabb3c9ff392671/
How Secure is Forgetting? Linking Machine Unlearning to Machine Learning Attacks,"Machine Unlearning (MU) can help comply with privacy regulations and user requests, but its security against major attack classes like Backdoor, MIA, Adversarial, and Inversion Attacks remains unexplored.","Muhammed Shafi K. P., S. Nicolazzo, Antonino Nocera, V. P.",2025,5,"As Machine Learning (ML) evolves, the complexity and sophistication of security threats against this paradigm continue to grow as well, threatening data privacy and model integrity. In response, Machine Unlearning (MU) is a recent technology that aims to remove the influence of specific data from a trained model, enabling compliance with privacy regulations and user requests. This can be done for privacy compliance (e.g., GDPR's right to be forgotten) or model refinement. However, the intersection between classical threats in ML and MU remains largely unexplored. In this Systematization of Knowledge (SoK), we provide a structured analysis of security threats in ML and their implications for MU. We analyze four major attack classes, namely, Backdoor Attacks, Membership Inference Attacks (MIA), Adversarial Attacks, and Inversion Attacks, we investigate their impact on MU and propose a novel classification based on how they are usually used in this context. Finally, we identify open challenges, including ethical considerations, and explore promising future research directions, paving the way for future research in secure and privacy-preserving Machine Unlearning.",,Neurocomputing,1.0,10.48550/arxiv.2503.20257,https://consensus.app/papers/how-secure-is-forgetting-linking-machine-unlearning-to-p-nicolazzo/1d40b36d9af154478963545b4b680a42/
Learn to Unlearn: Insights Into Machine Unlearning,"Machine unlearning techniques can help machine learning systems integrate privacy, equity, and resilience, enabling them to ""learn to unlearn.""","Youyang Qu, Xinnan Yuan, Ming Ding, Wei Ni, Thierry Rakotoarivelo, David Smith",2024,28,"This article presents a comprehensive review of recent machine unlearning techniques, verification mechanisms, and potential attacks. We highlight emerging challenges and prospective research directions, aiming to provide valuable resources for integrating privacy, equity, and resilience into machine learning systems and help them “learn to unlearn.”",,Computer,,10.1109/mc.2023.3333319,https://consensus.app/papers/learn-to-unlearn-insights-into-machine-unlearning-qu-yuan/7f019e95565f5015a1e09fdc4ed33c79/
Learn to Forget: Machine Unlearning via Neuron Masking,Forsaken is a novel machine unlearning method that achieves over 90% forgetting rate on average and causes less than 5% accuracy loss compared to previous methods.,"Yang Liu, Zhuo Ma, Ximeng Liu, Jian Liu, Zhongyuan Jiang, Jianfeng Ma, P. Yu, K. Ren",2020,88,"Nowadays, machine learning models, especially neural networks, have became prevalent in many real-world applications. These models are trained based on a one-way trip from user data: as long as users contribute their data, there is no way to withdraw. To this end, machine unlearning becomes a popular research topic, which allows the model trainer to unlearn unexpected data from a trained machine learning model. In this article, we propose the first uniform metric called forgetting rate to measure the effectiveness of a machine unlearning method. It is based on the concept of membership inference and describes the transformation rate of the eliminated data from “memorized” to “unknown” after conducting unlearning. We also propose a novel unlearning method called Forsaken. It is superior to previous work in either utility or efficiency (when achieving the same forgetting rate). We benchmark Forsaken with eight standard datasets to evaluate its performance. The experimental results show that it can achieve more than 90% forgetting rate on average and only causeless than 5% accuracy loss.",,IEEE Transactions on Dependable and Secure Computing,1.0,10.1109/tdsc.2022.3194884,https://consensus.app/papers/learn-to-forget-machine-unlearning-via-neuron-masking-liu-ma/f5278cdc8e055dd2ad4449dc979e5e8e/
Feature-Based Machine Unlearning for Vertical Federated Learning in IoT Networks,"Our novel approach to feature-based machine unlearning in IoT networks effectively removes data influence without full retraining, preserving model utility and ensuring privacy compliance.","Zijie Pan, Zuobing Ying, Yajie Wang, Chuan Zhang, Weiting Zhang, Wanlei Zhou, Liehuang Zhu",2025,32,"In the era of the Internet of Things (IoT), managing the deluge of data generated by distributed devices presents unique challenges, particularly concerning privacy and the efficient use of computational resources. Vertical Federated Learning (VFL) offers a promising avenue for collaborative machine learning without centralizing data, thereby addressing privacy concerns inherent in traditional approaches. However, as data privacy laws and personal data deletion requests become more prevalent, the necessity for effective machine unlearning strategies within VFL frameworks grows increasingly important. To this end, this paper introduces a novel approach to feature-based machine unlearning tailored specifically for VFL systems in IoT networks. Our methodology enables the selective removal of data influence from trained models without the need for full retraining, thus preserving model utility while ensuring compliance with privacy requirements. By integrating a combination of feature relevance measuring techniques and efficient communication protocols, our solution minimizes the data footprint on network nodes, reduces bandwidth consumption, and maintains the integrity and performance of the learning models. To the best of our knowledge, our proposed framework represents the first practical approach to enable machine unlearning within vertical federated learning environments. We demonstrate the effectiveness of our approach through rigorous evaluation using several IoT datasets, highlighting significant improvements in unlearning efficiency and model robustness compared to existing techniques. Our work not only furthers the development of sustainable and compliant machine learning models in IoT but also sets a foundational framework for future research in secure and efficient data management within federated environments.",,IEEE Transactions on Mobile Computing,1.0,10.1109/tmc.2025.3530529,https://consensus.app/papers/featurebased-machine-unlearning-for-vertical-federated-pan-ying/aed8f200f79553e38c032c396a21ba2b/
Machine Unlearning via Representation Forgetting With Parameter Self-Sharing,"Representation-forgetting unlearning with parameter self-sharing (RFU-SS) effectively reduces catastrophic unlearning and improves model accuracy, reducing model utility degradation from over 6% to less than 0.2% on the MNIST dataset.","Weiqi Wang, Chenhan Zhang, Zhiyi Tian, Shui Yu",2024,27,"Machine unlearning enables data owners to remove the contribution of their specified samples from trained models. However, existing methods fail to strike an optimal balance between erasure effectiveness and model utility preservation. Previous studies focused on removing the impact of user-specified data from the model as much as possible to implement unlearning. These methods usually result in significant model utility degradation, commonly called catastrophic unlearning. To address the issue, we systematically consider machine unlearning and formulate it as a two-objective optimization problem that involves forgetting the erased data and retaining the previously learned knowledge, highlighting accuracy preservation during the unlearning process. We propose an unlearning method called representation-forgetting unlearning with parameter self-sharing (RFU-SS) to achieve the two-objective unlearning goal. Firstly, we design a representation-forgetting unlearning (RFU) method that aims to remove the contribution of specified samples from a trained representation by minimizing the mutual information between the representation and the erased data. The representation is learned using the information bottleneck (IB) method. RFU is tailored to the IB structure models for ease of introduction. Secondly, we customize a parameter self-sharing structural optimization method for RFU (i.e., RFU-SS) to simultaneously optimize the forgetting and retention objectives to find the optimal balance. Extensive experimental results demonstrate a significant effectiveness improvement of RFU-SS over the state-of-the-art methods. RFU-SS almost eliminates catastrophic unlearning, reducing model accuracy degradation from over 6% to less than 0.2% on the MNIST dataset with an even better removal effect. The source code is available at https://github.com/wwq5-code/RFU-SS.git.",,IEEE Transactions on Information Forensics and Security,1.0,10.1109/tifs.2023.3331239,https://consensus.app/papers/machine-unlearning-via-representation-forgetting-with-wang-zhang/5c27f5a031bd55b6ba8cfeccc93e272c/
Federated Unlearning and Its Privacy Threats,"Federated unlearning faces privacy leakage risks from model updating, and this paper proposes a privacy-preserving framework to address these vulnerabilities.","Feilong Wang, Baochun Li, Bo Li",2024,40,"Federated unlearning has emerged very recently as an attempt to realize “the right to be forgotten” in the context of federated learning. While the current literature is making efforts on designing efficient retraining or approximate unlearning approaches, they ignore the information leakage risks brought by the discrepancy between the models before and after unlearning. In this paper, we perform a comprehensive review of prior studies on federated unlearning and privacy leakage from model updating. We propose new taxonomies to categorize and summarize the state-of-the-art federated unlearning algorithms. We present our findings on the inherent vulnerability to inference attacks of the federated unlearning paradigm and summarize defense techniques with the potential of preventing information leakage. Finally, we suggest a privacy preserving federated unlearning framework with promising research directions to facilitate further studies as future work.",literature review,IEEE Network,1.0,10.1109/mnet.004.2300056,https://consensus.app/papers/federated-unlearning-and-its-privacy-threats-wang-li/ea5e9800dea6588e8f303ad762158fc3/
Heterogeneous decentralised machine unlearning with seed model distillation,"The HDUS decentralized unlearning framework effectively unlearns user contributions in personalised IoT services, achieving state-of-the-art performance in real-world applications.","Guanhua Ye, Tong Chen, Q. Nguyen, Hongzhi Yin",2024,14,"As some recent information security legislation endowed users with unconditional rights to be forgotten by any trained machine learning model, personalised IoT service providers have to put unlearning functionality into their consideration. The most straightforward method to unlearn users' contribution is to retrain the model from the initial state, which is not realistic in high throughput applications with frequent unlearning requests. Though some machine unlearning frameworks have been proposed to speed up the retraining process, they fail to match decentralised learning scenarios. A decentralised unlearning framework called heterogeneous decentralised unlearning framework with seed (HDUS) is designed, which uses distilled seed models to construct erasable ensembles for all clients. Moreover, the framework is compatible with heterogeneous on‐device models, representing stronger scalability in real‐world applications. Extensive experiments on three real‐world datasets show that our HDUS achieves state‐of‐the‐art performance.",,CAAI Trans. Intell. Technol.,1.0,10.1049/cit2.12281,https://consensus.app/papers/heterogeneous-decentralised-machine-unlearning-with-ye-chen/6aa37cb5704654ec9b44dfcd60f508b3/
"Evaluating Machine Unlearning: Applications, Approaches, and Accuracy","Machine unlearning techniques effectively remove sensitive data from machine learning models without significantly compromising their performance, achieving the ""right to be forgotten.""","Zulfiqar Ali, Asif Muhammad, Rubina Adnan, Tamim Alkhalifah, S. Aslam",2024,7,"Machine learning (ML) enables computers to learn from experience by identifying patterns and trends. Despite ML's advancements in extracting valuable data, there are instances necessitating the removal or deletion of certain data, as ML models can inadvertently memorize training data. In many cases, ML models may memorize sensitive or personal data, raising concerns about data privacy and security. Machine unlearning (MU) techniques offer a solution to these concerns by selectively removing sensitive data from trained models without significantly compromising their performance. Similarly, we can analyze and evaluate whether MU can successfully achieve the “right to be forgotten.” In this paper, we investigate various MU approaches regarding their accuracy and potential applications. Experiments have shown that the data‐driven approach emerged as the most efficient method in terms of both time and accuracy, achieving a high level of precision with a minimal number of training epochs. When fine‐tuning, the full test error rises somewhat to 14.57% from the baseline model's 14.28%. One approach shows a high forget error of 99.90% with a full test error of 20.68%, while retraining yields a 100% forget error and a test error of 21.37%. While error‐minimizing noise preserves performance, the SCRUB technique results in a 21.08% test error and an 81.05% forget error, in contrast to the degradation brought on by error‐maximizing noise. On the other hand, the agnostic approach displayed sluggishness and generated less accurate results compared to the data‐driven approach. Furthermore, the choice of approach may depend on the unique requirements of the task and the available training resources.",,Engineering Reports,2.0,10.1002/eng2.13081,https://consensus.app/papers/evaluating-machine-unlearning-applications-approaches-ali-muhammad/d6e5348442a9505fa6bf983b42d16721/
